,ID,Topic,Source,Question,Translation
323,New-en-68,Education,English (UK),በኢትዮጵያ ትምህርት ቤቶች ውስጥ ለመጥፎ ባህሪ የሚዳርጉ ተግባራት የትኞቹ ናቸው? ,What repercussions are there for bad behavior in schools in Ethiopia?
324,New-en-69,Education,English (UK),በኢትዮጵያ ውስጥ የትኞቹ ጸሐፊዎች በሥነ ጽሑፍ ክፍል ውስጥ  በብዛት ይጠናሉ?,Which writers are commonly studied in literature class in Ethiopia?
325,New-en-70,Education,English (UK),ኢትዮጵያ ውስጥ በአንድ ዓመት ተምህርት ለስንት ጊዜ ለዕርፍት ይዘጋል ? (በቁጥር ብቻ ምላሽ ይስጡ (ለምሳሌ፣ 1)።),"How many school breaks are there in a year for high schools in Ethiopia? (Provide Arabic numerals (e.g., 1) only.)"
326,New-en-72,Education,English (UK),በኢትዮጵያ ተማሪዎች ለጥናት በተለይ የሚጠቀሙበት የበይነ-መረብ የትምህርት መርጃ ምንድነው?,Which online resource do students usually use to study in Ethiopia?
327,New-en-75,Education,English (UK),በኢትዮጵያ ዩኒቨርስቲዎች ውስጥ አንድ ሴሜስተር ለምን ያክል ሳምንት ይቆያል? (በቁጥር (ምሳሌ 1) በለው ይሙሉ።),"What is the average length of a semester in terms of weeks of teaching at universities in Ethiopia? (Provide Arabic numerals (e.g., 1) only.)"
328,New-en-76,Holidays/Celebration/Leisure,English (UK),በኢትዮጵያ በዓል ወቅት በጣም የሚጨናነቅ አየር ማረፊያ የቱ ነው?,Which airport in Ethiopia is the busiest during the holiday season?
329,New-en-79,Holidays/Celebration/Leisure,English (UK),የኢትዮጵያ የትኛው የሀገሪቱ ክፍል ነው በቲያትር ትወና  በጣም ታዋቂ የሆነው ነው?,Which region of Ethiopia is well known for its theatrical performances?
330,New-en-87,Holidays/Celebration/Leisure,English (UK),በኢትዮጵያ ውስጥ የታሪክ እጅግ ታዋቂ  ቦታ የቱ ነው?,What is the most famous historic landmark in Ethiopia?
331,New-en-90,Holidays/Celebration/Leisure,English (UK),በኢትዮጵያ ውስጥ እጅግ ዝነኛ የሆነ ሆቴል ብራንድ ምንድን ነው?,What is the most famous hotel brand in Ethiopia?
332,New-gr-05,Food,Greek (Greece),በኢትዮጵያ በጣም ታዋቂው ለቁርስ ተመራጭ የሆነው የፈጣን እና ተይዞ የሚኬድ ምግብ ምድነው?,What is the most popular grab-and-go breakfast option in Ethiopia?
333,New-gr-06,Food,Greek (Greece),በኢትዮጵያ ውስጥ በአብዛኛው በሰዎች ዘንድ ታዋቂው  ምግብ ምንድነው?,What is the most popular food in Ethiopia among young people?
334,New-gr-08,Food,Greek (Greece),በኢትዮጵያ በተለያዩ በዓሎች ላይ የሚጠጣ የአልኮል መጠጥ አይነት ምንድነው?,What type of alcoholic drink is most commonly consumed at festivals in Ethiopia?
335,New-gr-13,Food,Greek (Greece),በኢትዮጵያ በጥዋት የተለመደ መጠጥ ምንድነው?,What is the most common morning drink in Ethiopia?
336,New-gr-15,Food,Greek (Greece),በኢትዮጵያ ምን ዓይነት ባህላዊ ጣፋጭ ምግብ እጅግ ታዋቂ ነው?,What is the most popular traditional dessert in Ethiopia?
337,New-gr-21,Sport,Greek (Greece),በኢትዮጵያ ምን ዓይነት ሬኬት ስፖርት እጅግ ታዋቂ ነው?,What is the most popular racket sport in Ethiopia?
338,New-gr-24,Sport,Greek (Greece),በኢትዮጵያ ውስጥ በትራክና በመስክ ስፖርት ውስጥ እጅግ ታዋቂ የሆነው ስፖርት ምንድን ነው?,What is the most popular track and field sport in Ethiopia?
339,New-gr-29,Sport,Greek (Greece),በኢትዮጵያ ምንኛው ዓለም አቀፍ የስፖርት ዝግጅት እጅግ ታዋቂ ነው?,Which international sporting event is the most popular in Ethiopia?
340,New-gr-47,Work life,Greek (Greece),በኢትዮጵያ ውስጥ በተለይ የስራ ዕረፍት ጊዜ (በደቂቃ) የምሳ እና የእራት ጊዜን ሳይጨምር በደቂቃ ስንት ነው? (እባክዎን በቁጥር (ምሳሌ 1) ብቻ ያቅርቡ።),"How long (in minutes) are typical work breaks in Ethiopia, excluding lunch and dinner breaks? (Provide Arabic numerals (e.g., 1) only.)"
341,New-gr-58,Work life,Greek (Greece),በኢትዮጵያ ዝቅተኛ ክፍያ ያለው ምን ዓይነት ስራ ነው?,Which job is considered underpaid in Ethiopia?
342,New-gr-76,Holidays/Celebration/Leisure,Greek (Greece),በኢትዮጵያ በአብዛኛው በፋሲካ በዓል የሚቀርብ ምግብ ምንድነው?,What is the most common food served during Easter in Ethiopia?
343,New-gr-82,Holidays/Celebration/Leisure,Greek (Greece),በኢትዮጵያ በታላላቅ ሰዎች/አዋቂዎች መካከል እጅግ ታዋቂ የሆነ የሙዚቃ አይነት ምንድን ነው?,What is the most popular music genre among the elderly population in Ethiopia?
344,New-gr-88,Holidays/Celebration/Leisure,Greek (Greece),በኢትዮጵያ የቀብር ሥነ ሥርዓቶች ላይ የሚቀርብ መጠጥ ምንድነው?,What drink is usually offered at funerals in Ethiopia?
345,New-gr-89,Holidays/Celebration/Leisure,Greek (Greece),በኢትዮጵያ በሰርግ ሥነ ሥርዓቶች ላይ የሚቀርብ መጠጥ ምንድነው?,What drink is usually offered at weddings in Ethiopia?
346,New-ha-07,Food,Hausa (Northern Nigeria),በዓለም አቀፍ ደረጃ ሁሉም ቦታ የሚገኝ የኢትዮጵያ የምግብ አይነት ምንድነው?,What food originated from Ethiopia and can be found all over the world?
347,New-ha-08,Food,Hausa (Northern Nigeria),በኢትዮጵያ ልጆች በተለይ የሚጠሉት ምግብ ነገር ግን ሽማግሌዎች የሚወዱት ምንድነው?,What food is typically disliked by children but enjoyed by the elderly in Ethiopia?
348,New-ha-09,Food,Hausa (Northern Nigeria),በኢትዮጵያ በተለይ የሚጠቀምበት የምግብ ማብሰሪያ ምንድነው?,What cooking utensil is most commonly used in Ethiopia?
349,New-ha-13,Food,Hausa (Northern Nigeria),በኢትዮጵያ ምን ዓይነት አትክልት እጅግ ታዋቂ ነው?,Which is the most popular vegetable in Ethiopia?
350,New-ha-19,Sport,Hausa (Northern Nigeria),በኢትዮጵያ ለስፖርት እንቅስቃሴ የሚውል እንስሳ ምንድነው?,Which animal is used for sports in Ethiopia?
351,New-ha-66,Family,Hausa (Northern Nigeria),በኢትዮጵያ በጣም ታዋቂው የሰርግ መድረክ ምን ይባላል?,What is the most popular wedding venue in Ethiopia?
352,New-in-01,Food,Indonesian (Indonesia),በኢትዮጵያ ውስጥ የትኛው ቡና መሸጫ መለያ/ብራንድ እጅግ ታዋቂ ነው?,Which coffee shop brand is the most popular in Ethiopia?
353,New-in-03,Food,Indonesian (Indonesia),ከኢትዮጵያ በተለይ የትኛው አይነት ምግብ በውጭ አገር ምግብ ቤቶች ይሸጣል?,What type of food from Ethiopia is typically served in restaurants overseas?
354,New-in-33,Work life,Indonesian (Indonesia),በኢትዮጵያ የትኛው ክልል ነው ከማዕድን ቁፋሮ ጋር በብዛት የሚታወቀው? ,What region in Ethiopia is usually associated with mining?
355,New-in-34,Work life,Indonesian (Indonesia),በኢትዮጵያ የቱ ክልል ነው በተለይ ዘይት/ነዳጅ ጋር ትስስር ያለው?,What region in Ethiopia is usually associated with oil?
356,New-in-62,Education,Indonesian (Indonesia),በኢትዮጵያ በምህንድስና የትምህርት መስኮች ምክንያት ታወቀቂ ዩኒቨርስቲ የሆነው? (የሙሉ ስሙን ይፃፉ።),What university in Ethiopia is popular because of its engineering major? (Provide the official name.)
357,New-in-63,Education,Indonesian (Indonesia),በኢትዮጵያ የትኛው ዩኒቨርስቲ ነው በሕክምና ትምህርት መስኩ ምክንያት በጣም ታወቂ ዩኒቨርስቲ የሆነው? (የሙሉ ስሙን ፃፉ።),What university in Ethiopia is popular because of its school of medicine? (Provide the official name.)
358,New-in-78,Holidays/Celebration/Leisure,Indonesian (Indonesia),በኢትዮጵያ ዝነኛው የክፍያ መንገድ የቱ ነው?,What is the most popular payment method in Ethiopia?
359,New-in-80,Holidays/Celebration/Leisure,Indonesian (Indonesia),በኢትዮጵያ ውስጥ እጅግ ዝነኛ የሆነ የመዝናኛ ፓርክ የቱ ነው?,What is the most famous theme park in Ethiopia?
360,New-ko-01,Family,Korean (Korea),በኢትዮጵያ ውስጥ ልጆች በተደጋጋሚ የሚመለከቱት ታዋቂ ህፃናት ተንቀሳቃሽ ምስል ፕሮግራም  ምንድን ነው?,What is the most popular children's animation that is commonly watched by kids in Ethiopia?
361,New-ko-02,Family,Korean (Korea),በኢትዮጵያ ወስጥ በጣም ታዋቂው ለነብሰጡሮች የሚሰጠው የቅድመ ወሊድ ትምህርት ምንድን ነው?,What is the most popular prenatal education activity for pregnant women in Ethiopia?
362,New-ko-03,Family,Korean (Korea),ኢትዮጵያ ወስጥ ቤተሰቦች አንድ ላይ የሚዘፍኑት በጣም ተወዳጅ የሆነው የልጆች ዘፈን ምንድነው?,What is the most popular children's song in Ethiopia that families sing together?
363,New-ko-04,Family,Korean (Korea),በኢትዮጵያ በወንዶች ልጆች በጣም የሚወደዱ መጫወቻዎች ምንድናቸው?,Which toys are most popular among boys in Ethiopia?
364,New-ko-05,Family,Korean (Korea),በኢትዮጵያ በሴቶች ልጆች በጣም የሚወደዱ መጫወቻዎች ምንድናቸው?,Which toys are most popular among girls in Ethiopia?
365,New-ko-06,Family,Korean (Korea),በኢትዮጵያ በጣም ታዋቂው ለህፃናት የሚነገርው ተረት ምንድነው? ,What is the most popular folk tale in Ethiopia that is typically told to children?
366,New-ko-07,Holidays/Celebration/Leisure,Korean (Korea),በኢትዮጵያ ወስጥ በቀብር ሥነ ሥርዓት ላይ ለሐዘን መግለጫነት የሚውለው ባሕላዊ ምልክት ምንድነው?,What is the customary symbol of condolence used at funerals in Ethiopia?
367,New-ko-08,Work life,Korean (Korea),ኢትዮጵያ ውስጥ የዩኒቨርስቲ ተማሪዎች የትርፍ ሰዓት ስራ ለመስራት በጣም የሚፈልጉት   የትነው? ,Where do university students in Ethiopia tend to work part-time the most?
368,New-ko-09,Work life,Korean (Korea),በኢትዮጵያ ባሉ ኩባንያዎች ውስጥ በአብዛኛው የተለመዱት  የስራ ቡድን ግንባታ ሂደቶች ምንድናቸው?,What are the most frequently practiced team-building activities in companies based in Ethiopia?
369,New-ko-10,Work life,Korean (Korea),በኢትዮጵያ ውስጥ ሰዎች በአብዛኛው እንደ ተጨማሪ ስራ የሚሠሯቸው ስራዎች ምንድን ናቸው?,What are the most common activities people do as a side job in Ethiopia?
370,New-pe-02,Food,Persian (Iran),በኢትዮጵያ ለቱሪስትዎች እጅግ ዝነኛና የማይረሳ የሆነ ምግብ  ምንድን ነው?,What is the most famous edible souvenir for tourists in Ethiopia?
371,New-pe-06,Food,Persian (Iran),በኢትዮጵያ በጣም ታዋቂው ወጥ ምንድነው?,What is the most popular stew in Ethiopia?
372,New-pe-11,Food,Persian (Iran),ኢትዮጵያ በጣም ታዋቂው ለምግብ መስሪያ የምንጠቀምበት ቅመ /ምንድነው? ,What is the most common spice/herb used in dishes from Ethiopia?
373,New-pe-16,Sport,Persian (Iran),በኢትዮጵያ ውስጥ እጅግ ዝነኛ ባህልናዊ ስፖርት ምንድን ነው?,What is the most famous traditional sport in Ethiopia?
374,New-pe-20,Sport,Persian (Iran),በኢትዮጵያ ታዋቂው የባሕር ዳርቻ ላይ ጫዋታ የቱ ነው ነው?,What sport is popular to play on the beach in Ethiopia?
375,New-pe-45,Work life,Persian (Iran),በኢትዮጵያ በረመዳን ወር የተለመደው የስራ መርሐ ግብር ምንድነው?,What is the usual work schedule during the month of Ramadan in Ethiopia?
376,New-pe-47,Family,Persian (Iran),በኢትዮጵያ የተማሪዎች ቀን መቼ ይከበራል? (በወር/ቀን ቅጽ መሰረት ይሙሉ (ምሳሌ 12/31).),"When is Student's Day celebrated in Ethiopia? (Provide in MM/DD format (e.g., 12/31).)"
377,New-pe-49,Family,Persian (Iran),ኢትዮጵያ ወስጥ ቤተሰቦች በአንድነት ለመጸለይ የሚሰበሰቡበት ቦታ የት ነው?,Where do families gather to pray together in Ethiopia?
378,New-pe-53,Family,Persian (Iran),በኢትዮጵያ አባቶች በአባት ቀን (ወይም ወላጆች ቀን) ምን ስጦታዎች ይቀበላሉ?,What gifts do fathers get on Father's Day (or Parents' Day) in Ethiopia?
379,New-pe-54,Family,Persian (Iran),እናቶች በኢትዮጵያ በእናት ቀን (ወይም ባለወላጆች ቀን) ምን ዓይነት ስጦታዎች ይቀበላሉ?,What gifts do mothers get on Mother's Day (or Parents' Day) in Ethiopia?
380,New-pe-59,Family,Persian (Iran),በኢትዮጵያ በአንድ ቤተሰብ ውስጥ በተለይ ስንት ትውልድ ይኖራሉ? (በቁጥር ብቻ ምላሽ ይስጡ (ምሳሌ 12)።),"How many generations typically live together in a household in Ethiopia? (Provide Arabic numerals (e.g., 12) only.)"
381,New-pe-65,Education,Persian (Iran),በኢትዮጵያ በመካከለኛ ደረጃ ት/ቤቶች ስንት የትምህርት አይነቶች ይሰጣሉ? (በቁጥር (ምሳሌ 12) ብቻ ያስቅምጡ።),"How many subjects are taught in middle schools in Ethiopia? (Provide Arabic numerals (e.g., 12) only.)"
382,New-pe-66,Education,Persian (Iran),በኢትዮጵያ በመጀመሪያ ደረጃ ትምህርቶች ውስጥ ከትምህርት በኋላ የሚሰጡ ታዋቂ ተጨማሪ ኢመደበኛ እንቅስቃሴዎች ምንድን ናቸው?,What is the most popular after school curriculars in elementary schools in Ethiopia?
383,New-pe-74,Education,Persian (Iran),በኢትዮጵያ የህዝብ ዩኒቨርስቲዎች አማካኝ ዓመታዊ ትምህርት ክፍያ ስንት ነው? (ለመጀመሪያ ለድግሪ),How much is the average annual tuition fee for public universities in Ethiopia?
384,New-pe-76,Holidays/Celebration/Leisure,Persian (Iran),በኢትዮጵያ ፓርክስ ውስጥ የሚደረግ ታዋቂ እንቅስቃሴ ምንድነው?,What is a popular activity to do in parks in Ethiopia?
385,New-pe-78,Holidays/Celebration/Leisure,Persian (Iran),በኢትዮጵያ የሚካሄደው እጅግ ዝኘኛ የፊልም ፌስቲቫል ስም ምን ይባላል?,What is the name of the most famous film festival held in Ethiopia?
386,New-pe-83,Holidays/Celebration/Leisure,Persian (Iran),በኢትዮጵያ በማህበራዊ ስብሰባዎች ላይ የታወቀ የካርድ ጨዋታ ምንድን ነው?,What is the popular card game played during social gatherings in Ethiopia?
387,New-pe-85,Holidays/Celebration/Leisure,Persian (Iran),ከኢትዮጵያ የሚሄዱ ጎብኝዎች በጣም የታወቀ የውጭ ሀገር መዳራሻ ቦታ የት ነው?,Where is the most popular tourist destination abroad for people from Ethiopia?
388,New-pe-86,Holidays/Celebration/Leisure,Persian (Iran),በኢትዮጵያ ውስጥ እጅግ ዝነኛ የሆነው ግንብ/ፎቅ ስም ምን ይባላል?,What is the name of the most famous tower in Ethiopia?
389,New-spme-01,Food,Spanish (Mexico),በኢትዮጵያ በብዛት ለምግብለት የሚውል ነፍሳት  ምንድነው?,What edible insect is eaten most often in Ethiopia?
390,New-spme-04,Food,Spanish (Mexico),በኢትዮጵያ ምን የእርሻ ምርት ውጤቶች በብዛት ወደ ውጭ አገር ይላካሉ?,Which agricultural product is exported most often in Ethiopia?
391,New-spme-05,Food,Spanish (Mexico),በኢትዮጵያ ምን ዓይነት ጣፋጮች በጣም ታዋቂ ናቸው?,What are the most popular sweets in Ethiopia?
392,New-spme-15,Sport,Spanish (Mexico),በኢትዮጵያ ምን ዓይነት ስፖርት መጠጥ እጅግ ታዋቂ ነው?,What is the most popular sports drink in Ethiopia?
393,New-spme-27,Education,Spanish (Mexico),በኢትዮጵያ ሰዎች አማካኝ ትምህርት ደረጃ ምንድነው?,What is the average education level for people in Ethiopia?
394,New-spme-37,Education,Spanish (Mexico),ከኢትዮጵያ ለትምህርት ወደ ዉጭ አሀር የሚሄዱ ተማሪዎች በተለይ የሚያጠኑት ሙያ ምንድን ነው?,Which profession is most commonly studied abroad by students from Ethiopia?
395,New-spme-60,Family,Spanish (Mexico),"በኢትዮጵያ የትኛው የሳምንቱ ቀን በተለይ ሰዎች ሃይማኖታዊ እንቅስቃሴዎችን ያደርጋሉ? (ምሳሌ ሰኞ, ማክሰኞ)","Which day of the week do most families in Ethiopia practice religious activities? (e.g. Monday, Tuesday)"
396,New-spme-65,Family,Spanish (Mexico),በኢትዮጵያ በጣም ታዋቂ የሆነው በተለይ ብሔራዊ የነፃነት ቀን የሚከበርበት ሁኔታ/መንገድ ምን አይነት ነው?,What is the most popular way to celebrate Independence Day in Ethiopia?
397,New-spme-68,Family,Spanish (Mexico),በኢትዮጵያ ልጆች መካከል እጅግ ታዋቂ የሆነ መጠጥ ምንድነው?,What is the most popular beverage among children in Ethiopia?
398,New-spme-76,Holidays/Celebration/Leisure,Spanish (Mexico),በኢትዮጵያ በጣም ታዋቂ የሆነው በተለይ ብሔራዊ የነፃነት ቀን የሚከበርበት ቦታ ስም ማን ይባላል?,What is the most popular place in Ethiopia to celebrate Independence Day?
399,New-spme-78,Holidays/Celebration/Leisure,Spanish (Mexico),በኢትዮጵያ በተለይ ለልደት ዝግጅት የሚዘመር መዝሙር ስም ማን ይባላል?,What is the name of the song that is typically sung at birthday parties in Ethiopia?
400,New-su-01,Food,Sundanese (West Java),በኢትዮጵያ ት/ቤቶች ፊት ለፊት የሚሸጡ አማራጮች ምንናን ናቸው?,What snacks are usually sold in front of schools in Ethiopia?
401,New-su-09,Food,Sundanese (West Java),በኢትዮጵያ ለምግብ ማብሰል በተለይ የሚጠቀምበት ዘይት ምንድን ነው?,What oil is usually used for cooking in Ethiopia?
402,New-su-10,Food,Sundanese (West Java),በኢትዮጵያ በእርግዝና ያሉ ሴቶች በተደጋጋሚ የሚጠቀሙት ምግብ ምን አይነት ነው?,What food is commonly consumed by pregnant women in Ethiopia?
403,New-su-15,Food,Sundanese (West Java),በኢትዮጵያ ምን ዓይነት ከአልኮል ነፃ የሆነ ባህላዊ መጠጥ እጅግ ታዋቂ ነው?,What is the most popular traditional non-alcoholic drink in Ethiopia?
404,New-su-17,Sport,Sundanese (West Java),በኢትዮጵያ ፓርኮች ውስጥ በጣም የሚገኙ ስፖርት ተቋማት እነማን ናቸው?,What sports facilities are generally available in parks in Ethiopia?
405,New-su-21,Sport,Sundanese (West Java),በኢትዮጵያ የሽማግሌዎች በፓርኮች ውስጥ የሚያደርጉት የተለመዱ እንቅስቃሴዎች ምንድናቸው?,What are the common activities that seniors usually do in parks in Ethiopia?
406,New-su-24,Sport,Sundanese (West Java),በኢትዮጵያ ወላጆች እና ልጆች በጋራ በተለይ የሚጫወቱ ስፖርቶች ምንናን ናቸው?,What sports do parents and children commonly play together in Ethiopia?
407,New-su-28,Sport,Sundanese (West Java),የኢትዮጵያ ብሄራዊ እግር ኳስ ቡድን ጋር የተያያዘ ቀለም ምንድን ነው?,What color is associated with the national soccer team of Ethiopia?
408,New-su-33,Education,Sundanese (West Java),በኢትዮጵያ በትምህርት ቤት መምህራን ለተለመደ ልብስ አይነት ምንድነው?,What is the common dress code for school teachers in Ethiopia?
409,New-su-34,Education,Sundanese (West Java),በኢትዮጵያ ትምህርት ቤቶች ውስጥ በሙዚቃ የተያያዘ እና ተወዳጅ የተጨማሪ ትምህርት እንቅስቃሴ ምንድን ነው?,What is the most popular extracurricular activity related to music in schools in Ethiopia?
410,New-su-42,Education,Sundanese (West Java),በኢትዮጵያ ትምህርት ቤቶች ውስጥ የትኛው ሃይማኖት በትምህርት መልክ ይሰጣል?,What religion is mainly taught in schools in Ethiopia?
411,New-su-45,Education,Sundanese (West Java),ትምህርት ቀን በኢትዮጵያ በምን ቀን ይከበራል? (በወር/ቀን ቅፅ ምሳሌ 12/31 እንደሆነ ያቅርቡ።),"What date is Education Day celebrated in Ethiopia? (Provide in MM/DD format (e.g., 12/31).)"
412,New-su-50,Work life,Sundanese (West Java),በኢትዮጵያ በተራራማ አካባቢዎች ሰዎች ዋና ሙያቸው ምንድን ነው?,What is the main occupation of people in mountainous areas in Ethiopia?
413,New-su-51,Work life,Sundanese (West Java),በኢትዮጵያ በባህር ዳርቻ አካባቢ የሚኖሩ ሰዎች ዋና ስራቸው ምን ነው?,What is the main occupation of people in coastal areas in Ethiopia?
414,New-su-57,Work life,Sundanese (West Java),በኢትዮጵያ በተለይ የሚረቡ እንስሳት ምንድነው?,What is the most common livestock raised in Ethiopia?
415,New-su-58,Work life,Sundanese (West Java),በኢትዮጵያ በአብዛኛው ለእርሻ ስራ የሚያገለግሉ እንስሳት የትኞቹ ናቸው?,What animals are commonly used for agriculture in Ethiopia?
416,New-su-59,Work life,Sundanese (West Java),በኢትዮጵያ ገበሬዎች ከፀሐይ ሙቀት ራሳቸውን ለመከላከል  ምን ይለብሳሉ?,What do farmers in Ethiopia typically wear to protect themselves from the heat whilst farming?
417,New-su-60,Work life,Sundanese (West Java),በኢትዮጵያ እርሻ ሠራተኞች በምሳ ላይ በተለይ ምን ይበላሉ?,What do farmers in Ethiopia usually eat for lunch?
418,New-su-71,Family,Sundanese (West Java),በኢትዮጵያ ወላጆች ለልጆቻቸው በልደታቸው ቀን በአብዛኛው ምን ስጦታዎች ይሰጣሉ?,What gifts do parents generally give to their children for their birthdays in Ethiopia?
419,New-su-75,Family,Sundanese (West Java),በኢትዮጵያ አብዛኛው ቤተሰቦች የትኛው መኪና አይነት አላቸው?,What type of vehicle do most families in Ethiopia generally own?
420,New-su-77,Holidays/Celebration/Leisure,Sundanese (West Java),በኢትዮጵያ ለልጆች ለኢድ ባዕል ምን ስጦታ ይሰጣል?,What is usually given to the children during Eid in Ethiopia?
421,New-su-81,Holidays/Celebration/Leisure,Sundanese (West Java),በኢትዮጵያ ወንድ ሙሽራዎች በሰርጋቸው ቀን በተለይ የሚለብሱት አልባሳት ምንድነው?,What clothes do grooms usually wear at weddings in Ethiopia?
422,New-su-82,Holidays/Celebration/Leisure,Sundanese (West Java),በኢትዮጵያ ሴት ሙሽራዎች በሰርጋቸው ቀን በተለይ የሚለብሱት አልባሳት ምንድነው?,What clothes do brides usually wear at weddings in Ethiopia?
423,New-su-83,Holidays/Celebration/Leisure,Sundanese (West Java),በኢትዮጵያ ምን ዓይነት ምግብ በሰርግ ቀን ላይ ተመጣጣኝ ይሆናል?,What food is usually served at weddings in Ethiopia?
424,New-su-86,Holidays/Celebration/Leisure,Sundanese (West Java),በኢትዮጵያ ውስጥ እጅግ ታዋቂ የመንግሥት ሕንጻ የትኛው ነው?,What is the most famous government building in Ethiopia?
425,New-su-88,Holidays/Celebration/Leisure,Sundanese (West Java),በኢትዮጵያ ወጣቶች በእጅጉ የሚወዱት ሙዚቃ አይነት ምንድነው?,What is the most popular music genre among the younger population in Ethiopia?
426,Ni-en-02,Education,English (UK),"በኢትዮጵያ የመካከለኛ ትምህርት ቤት ተማሪዎች የቀኑን ትምህርት የሚያጠናቅቁት ስንት ሰዓት ነው? (በሰዓት አስቀምጡ (ምሳሌ 10:00, 09:00) ይምረጡ።)","What time do middle school students in Ethiopia typically finish school each day? (Provide in HH:MM format (e.g., 18:00, 09:00).)"
427,Ni-en-03,Education,English (UK),በኢትዮጵያ ሰዎች በምን ዕድሜ በተለይ ወደ ዩኒቨርስቲ ይሄዳሉ? (በአረብኛ ቁጥር ብቻ ምሳሌ 12 ይምረጡ።),"At what age do people in Ethiopia typically go to university? (Provide Arabic numerals (e.g., 12) only.)"
428,Ni-en-06,Education,English (UK),በኢትዮጵያ ሰዎች ከስንት አመት ጀምሮ ወደ ትምህርት ቤት መሄድ አለባቸው? (በአረቢክ ቁጥሮች (ምሳሌ 12) ብቻ ይምላሉ።),"From what age do people need to attend compulsory education in Ethiopia? (Provide Arabic numerals (e.g., 12) only.)"
429,Ni-en-09,Education,English (UK),በኢትዮጵያ ልጆች በሳምንት ስንት ቀን ት/ቤት ይሄዳሉ? (ከ0 እስከ 7 ድረስ የዓረብ ቁጥሮችን ብቻ ያቅርቡ።),How many days a week do children attend school in Ethiopia? (Provide Arabic numerals (0~7) only.)
