,ID,Topic,Source,Question,Translation
102,Jod-ch-04,Food,Chinese (China),በኢትዮጵያ ሰዎች ምን የልስላሳ መጠጥ መጠጣትን ይወዳሉ?,What soft drink do people in Ethiopia like to have?
103,Jod-ch-06,Food,Chinese (China),በኢትዮጵያ ምን ዓይነት ባህልያዊ አልኮል ታዋቂ ነው?,What is the most popular traditional alcohol in Ethiopia?
104,Jod-ch-07,Food,Chinese (China),"በኢትዮጵያ ሰዎች በአማካይነት እራት ለመመገብ በምግብ ቤት ስንት ሰአት የቆያሉ? (እባክዎን በአረቢክ ቁጥሮች እስከ አንድ ነጥብ ቁጥር (ምሳሌ 2, 3.5) ብቻ ያቅርቡ።)","How long (in hours) on average does it take for people in Ethiopia to have dinner at a restaurant? (Provide Arabic numerals up to one decimal point (e.g., 2, 3.5) only.)"
105,Jod-ch-09,Food,Chinese (China),"በኢትዮጵያ ሰዎች እራት በምን ሰዓት ይበላሉ? (በ HH:MM ቅጽ ያቅርቡ (ምሳሌ 18:00, 09:00).)","What time do people usually have dinner in Ethiopia? (Provide in HH:MM format (e.g., 18:00, 09:00).)"
106,Jod-ch-12,Food,Chinese (China),ኢትዮጵያውያን ምን ዓይነት ሾርብ መብላት ይወዳሉ?,What kind of soup do people from Ethiopia like to have?
107,Jod-ch-13,Food,Chinese (China),ኢትዮጵያውያን ምን የጎዳና ምግብ ይወዳሉ?,What street food do people from Ethiopia like to eat?
108,Jod-ch-15,Food,Chinese (China),ኢትዮጵያውያን የባህር ምግብ እንዴት ያለ አይነት ይወዳሉ?,What kind of seafood do people from Ethiopia like to eat?
109,Jod-ch-16,Holidays/Celebration/Leisure,Chinese (China),በኢትዮጵያ ትልቅ ዓለም አቀፍ በዓል የቱ ነው?,What is the biggest festival in Ethiopia?
110,Jod-ch-28,Holidays/Celebration/Leisure,Chinese (China),በኢትዮጵያ ከከተማ ወደ ከተማ ሲጓዙ ሰዎች በተለይ የሚጠቀሙበት ህዝባዊ ትራንስፖርት ምንድን ነው?,What is the most commonly used public transport by people when travelling between cites in Ethiopia?
111,Jod-ch-30,Holidays/Celebration/Leisure,Chinese (China),በኢትዮጵያ ውስጥ በእጅጉ ታላቅ በዓል ጋር የተያያዙ ምልክቶች ወይም ምስሎች ምንድነው?,What are the specific decorations or symbols associated with the most biggest festival in Ethiopia?
112,Jod-ch-37,Sport,Chinese (China),በኢትዮጵያ ሴቶች ምን ዓይነት ስፖርት ማየት እናፈቅራሉ?,What sports do women like to watch the most in Ethiopia?
113,Jod-ch-38,Sport,Chinese (China),በኢትዮጵያ ወንዶች ምን ዓይነት ስፖርት ማየት እናፈቅራሉ?,What sports do men like to watch the most in Ethiopia?
114,Jod-ch-41,Holidays/Celebration/Leisure,Chinese (China),በኢትዮጵያ ወስጥ እድሜያቸው 20ዎቹ የሚገኙ ሴቶች በዋናነት የሚያደርጉት የመዝናኛ እንቅስቃሴ ምንድን ነው?,What is the common leisure activity that females in their 20s in Ethiopia engage in?
115,Jod-ch-42,Holidays/Celebration/Leisure,Chinese (China),በኢትዮጵያ ወስጥ እድሜያቸው 20ዎቹ የሚገኙ ወንዶች በዋናነት የሚያደርጉት የመዝናኛ እንቅስቃሴ ምንድን ነው?,What is the common leisure activity that males in their 20s in Ethiopia engage in?
116,Jod-ch-46,Work life,Chinese (China),"በኢትዮጵያ በሳምንቱ ቀናት ሰዎች ከምሳ በኋላ ለስንት ሰዓት (በሰዓት) የማረፍያ ቀንበር ይወስዳሉ? (በአረቢክ ቁጥሮች እስከ አንድ ነጥብ ቁጥር (ምሳሌ 2, 3.5) ብቻ ይምረጡ።)","How long (in hours) do people usually take a break after lunch on a weekday in Ethiopia? (Provide Arabic numerals up to one decimal point (e.g., 2, 3.5) only.)"
117,Jod-ch-48,Work life,Chinese (China),በኢትዮጵያ በስራ ቀናት ላይ ሰዎች ለምሳ ምን ይበላሉ?,What do people eat for lunch during the working days in Ethiopia?
118,Jod-ch-50,Work life,Chinese (China),በኢትዮጵያ የሰዎች አማካይ የጉዞ ጊዜያቸው (በደቂቃ) ምን ያክል ነው? (እባኮትን በቁጥር (ምሳሌ 1) ያስቀምጡ።),"What is the average commute time (in minutes) for people in Ethiopia? (Provide Arabic numerals (e.g., 1) only.)"
119,Jod-ch-51,Work life,Chinese (China),በኢትዮጵያ ሰዎች ለመስራት የሚወስዱት እጅግ ተደጋጋሚ መጓጓዣ እንደምን ነው?,What is the most common transportation that people take to get to work in Ethiopia?
120,Jod-ch-54,Work life,Chinese (China),በኢትዮጵያ የጋብቻ የፍቃድ ጊዜ ስንት ቀን  ነው? ,"How long (in days) is the marriage leave in Ethiopia? (Provide Arabic numerals (e.g., 12) only.)"
121,Jod-ch-56,Work life,Chinese (China),በኢትዮጵያ ሴቶች ጡረታ የሚዎጡበት እድሜ ስንት ነው? ,"What is the typical retirement age for women in Ethiopia? (Provide Arabic numerals (e.g., 12) only.)"
122,Jod-ch-57,Work life,Chinese (China),በኢትዮጵያ ወንዶች ጡረታ የሚዎጡበት እድሜ ስንት ነው?,"What is the typical retirement age for men in Ethiopia? (Provide Arabic numerals (e.g., 12) only.)"
123,Jod-ch-58,Work life,Chinese (China),በኢትዮጵያ ምን ዓይነት ሙያ እጅግ ከበረታች ነው?,Which profession is the most respected in Ethiopia?
124,Jod-ch-60,Work life,Chinese (China),በኢትዮጵያ ውስጥ አንድ ቀን የስራ ሰዓት ርዝመት ስንት ሰዓት ነው? (በአረቢኛ ቁጥሮች (0~24) ብቻ ምላሽ ይስጡ።),What is the duration (in hours) of a typical workday in Ethiopia? (Provide Arabic numerals (0~24) only.)
125,Jod-ch-61,Work life,Chinese (China),በኢትዮጵያ ውስጥ ሴቶች በሚመርጡት ሙያዎች መካከል ምንም ሙያ በተሻለ ይመረጣል?,Which occupation is most preferred among females in Ethiopia?
126,Jod-ch-62,Work life,Chinese (China),በኢትዮጵያ ውስጥ ወንዶች በሚመረጡት ሙያዎች መካከል ምንም ሙያ በተሻለ ይመረጣል?,Which occupation is most preferred among males in Ethiopia?
127,Ki-pe-17,Education,Persian (Iran),በኢትዮጵያ ተማሪዎች በአማካኝ እስከ የትኛውን ደረጃ ትምህርት ይቀጥላሉ? (ምሳሌ፣ ታናሽ ወይም ከፍተኛ ትምህርት),"On average, how far do students typically pursue their education in Ethiopia? (e.g., elementary, high school)"
128,Ki-pe-24,Education,Persian (Iran),በኢትዮጵያ ትምህርት ቤቶች ከእንግሊዝኛ ቋንቋ በተጨማሪ ምን ይማራል?,What language is taught in schools in Ethiopia besides English?
129,Ki-pe-30,Education,Persian (Iran),በኢትዮጵያ ትምህርት ቤቶች ከሳምንቱ ቀኖች ውስጥ በየትኞቹ ይዘጋሉ?,What days of the week are schools closed in Ethiopia?
130,Ki-pe-32,Food,Persian (Iran),በኢትዮጵያ እንግዶችን ለመቀበል ቤተሰቦች በተለይ ምን ምግብ ያዘጋጃሉ?,What food do the hosts usually prepare for the guests in Ethiopia?
131,Ki-pe-34,Food,Persian (Iran),በኢትዮጵያ በማለዳ ምግብ ጊዜ የተለመደ መጠጥ ምንድን ነው?,What is the usual drink in the breakfast in Ethiopia?
132,Ki-pe-36,Food,Persian (Iran),ከኢትዮጵያ ከተመረተ ምግብ ውጭ የምን አገር ምግብ በኢትዮጵያ ታዋቂ ነው?,"Except the food original from Ethiopia, which country's food is more popular in Ethiopia?"
133,Ki-pe-39,Food,Persian (Iran),በኢትዮጵያ ለቤተሰብ ሽርሽር ጊዜ በተለይ ምን ዓይነት ምግብ ይዘጋጃል?,What food is usually prepared for a family picnic in Ethiopia?
134,Ki-pe-40,Food,Persian (Iran),ከኢትዮጵያ የትኛው ምግብ በአለም ላይ በተለይ የሚጠላ ምግብ ነው?,Which food from Ethiopia is considered disgusting by the rest of the world?
135,Ki-pe-43,Food,Persian (Iran),በኢትዮጵያ የታወቀው የዳቦ ስም ምን ይባላል?,What is the name of the popular bread in Ethiopia?
136,Ki-pe-51,Work life,Persian (Iran),"በኢትዮጵያ የመንግሥት ቢሮዎች በምን ሰዓት ይዘጋሉ? (በኤችኤች:ኤምኤም ቅጽ ይምረጡ (ምሳሌ 18:00, 09:00).)","What time of day are government offices closed in Ethiopia? (Provide in HH:MM format (e.g., 18:00, 09:00).)"
137,Ki-pe-53,Work life,Persian (Iran),"በኢትዮጵያ የመንግሥት ቢሮዎች መደበኛ የመጀመሪያ ሰዓት ምን ሰዓት ነው? (በዚህ ቅጽ ይምረጡ HH:MM ምሳሌ 18:00, 09:00).","What is the normal start time of government offices in Ethiopia? (Provide in HH:MM format (e.g., 18:00, 09:00).)"
138,Kik-in-01,Holidays/Celebration/Leisure,Indonesian (Indonesia),በኢትዮጵያ ምን ብሔራዊ በዓል ረጅም ጊዜ ይከበራል?,What national holiday has the longest duration in Ethiopia?
139,Kik-in-02,Holidays/Celebration/Leisure,Indonesian (Indonesia),ኢትዮጵያውያን የነጣነት ቀን ሲከበር የተለመደ እንቅስቃሴዎች ምንድን ናቸው?,What are the common activities people from Ethiopia do to celebrate Independence day?
140,Kik-in-04,Holidays/Celebration/Leisure,Indonesian (Indonesia),በኢትዮጵያ ቤተሰብ አንድ አባል ሲሞት በቤት ፊት ምን ይተክላል?,What is installed in front of the house when a family member dies in Ethiopia?
141,Kik-in-05,Holidays/Celebration/Leisure,Indonesian (Indonesia),በኢትዮጵያ የእርግዝና በዓል ወይም ሥነ-ሥርዓት መቼ ይካሄዳል?,When is a pregnancy celebration or ceremony usually held in Ethiopia?
142,Kik-in-06,Holidays/Celebration/Leisure,Indonesian (Indonesia),በኢትዮጵያ ከሰርግ በፊት ምን ዓይነት ክስተት ይካሄዳል?,What event is usually held before a wedding in Ethiopia?
143,Kik-in-07,Holidays/Celebration/Leisure,Indonesian (Indonesia),በኢትዮጵያ አዲስ አመት ልጆች የሚጋሩት ነገር ምንድን ነው?,What is usually shared to the children during (Lunar) New Year in Ethiopia?
144,Kik-in-08,Holidays/Celebration/Leisure,Indonesian (Indonesia),በኢትዮጵያ ረመዳን ከመጀመሪያው ቀናት በፊት ምን ዓይነት እንቅስቃሴዎች ተደርገዋል?,What activities are usually done days before Ramadan in Ethiopia?
145,Kik-in-10,Holidays/Celebration/Leisure,Indonesian (Indonesia),በኢትዮጵያ ለውጭ ጉብኝቶች እጅግ ታዋቂው የመስብ ቦታዎች ምንድን ነው?,What is the most popular tourist attraction for foreign visitors in Ethiopia?
146,Kik-in-11,Holidays/Celebration/Leisure,Indonesian (Indonesia),በኢትዮጵያ ለቱሪዝም የታወቀው የሃይማኖት ቦታ (ቤተ መቅደስ፣ ቤተ ክርስቲያን ማለት ነው፣ ወዘተ) ምንድን ነው?,"What is the most popular religious sites (temple, church, etc.) for tourism in Ethiopia?"
147,Kik-in-15,Holidays/Celebration/Leisure,Indonesian (Indonesia),በኢትዮጵያ ሴቶች በመጨረሻ የተመረቀችውን የምረቃ ስነስርዓት ላይ በተለይ ምን ዓይነት ልብስ ይለብሳሉ?,What clothes do women usually wear on graduation commencement ceremony in Ethiopia?
148,Kik-in-16,Food,Indonesian (Indonesia),በኢትዮጵያ የሙቀት ሲቀዝቅዝ በተለይ ምን መጠጥ ይጠጣል?,What drink is commonly consumed in Ethiopia when the weather is cold?
149,Kik-in-17,Food,Indonesian (Indonesia),በኢትዮጵያ ረመዳን ጊዜ በተለይ የሚሸጥና የሚገኝ ፍሬ ምንድነው?,What fruit is more commonly sold and found during Ramadan in Ethiopia?
150,Kik-in-24,Food,Indonesian (Indonesia),በኢትዮጵያ ውስጥ በፈጣን ምግብ ቤት ከዶሮ ጋር ተመጣጣኝ የሚሆን ካርቦሃድሬት ምንድን ነው?,What carbohydrate is usually served with chicken in a fast-food restaurant in Ethiopia?
151,Kik-in-31,Sport,Indonesian (Indonesia),በኢትዮጵያ ውስጥ እጅግ ተውዳጅ የሆን የማርሻል አርት ስፖርት ምንድን ነው?,What is the most famous martial art sports in Ethiopia?
152,Kik-in-34,Sport,Indonesian (Indonesia),በኢትዮጵያ ብሄራዊ ቴሌቪዥን ላይ በተደጋጋሚ የሚሰሩ ስፖርቶች ምንናን ናቸው?,What sports are often broadcasted on national television in Ethiopia?
153,Kik-in-35,Sport,Indonesian (Indonesia),በCOVID-19 እለት በኢትዮጵያ ላይ ምን ዓይነት ስፖርቶች በሰዎች መካከል ታዋቂ ነበሩ?,What sports were popular among people from Ethiopia during the COVID-19 pandemic?
154,Kik-in-36,Sport,Indonesian (Indonesia),በኢትዮጵያ ታዋቂ የእግር ኳስ አሰልጣኝ ማን ነው?,Who is the most popular soccer coach in Ethiopia?
155,Kik-in-37,Sport,Indonesian (Indonesia),በኢትዮጵያ ውስጥ ምንኛው እግር ኳስ ቡድኖች ለባሕርይ መዋዕላቸው ለመሆን የታወቁ ናቸው? (ምሳሌ ፡፡ ___ እና ___),What soccer teams in Ethiopia are famous for their intense rivalry? (e.g. ___ vs ___)
156,Kik-in-38,Sport,Indonesian (Indonesia),በኢትዮጵያ ውስጥ ለታላቅ ባህርይ የታወቁ እግር ኳስ ደጋፊዎች ስም ምን ይባላል? (ምሳሌ ፡፡ ___ እና ___),What are the names of soccer supporters in Ethiopia who are famous for their intense rivalry? (e.g. ___ vs ___)
157,Kik-in-40,Sport,Indonesian (Indonesia),በኢትዮጵያ እጅግ የታወቀ ወንድ ባድሜንተን ተጫዋች ማን ነው?,Who is the most famous male badminton player in Ethiopia?
158,Kik-in-41,Sport,Indonesian (Indonesia),በኢትዮጵያ እጅግ የታወቀ ሴት ባድሜንተን ተጫዋች ማን ነው?,Who is the most famous female badminton player in Ethiopia?
159,Kik-in-44,Sport,Indonesian (Indonesia),በኢትዮጵያ የትኛው ስፖርት ከመንግሥት የበለጠ ድጋፍ ይከተላል?,What sport gets the most support from the government in Ethiopia?
160,Kik-in-45,Sport,Indonesian (Indonesia),በኢትዮጵያ የትምህርት ቤቶች ውስጥ በተለይ የሚገኙ የስፖርት መስኮች እንዳሉ ምን ናቸው?,What sports field facilities are usually available at schools in Ethiopia?
161,Na-ko-02,Food,Korean (South Korea),በኢትዮጵያ ሰዎች በተለይ የሚወዱት የካፌ መጠጥ ምንድነው?,What cafe beverage do people from Ethiopia most commonly enjoy?
162,Na-ko-04,Food,Korean (South Korea),ከኢትዮጵያ ሰዎች የተመረጡት የሐንጋቨር ፈውስ ምግቦች ምንድነው?,What is the preferred hangover cure food for people from Ethiopia?
163,Na-ko-05,Food,Korean (South Korea),በኢትዮጵያ የተለመደው ከፈለጉት ቦታ የሚመጣ ምግብ ምንድን ነው?,What is the typical delivery food in Ethiopia?
164,Na-ko-07,Food,Korean (South Korea),በኢትዮጵያ ሰዎች በብዛት የሚበሉት የሥጋ አይነት ምንድን ነው?,What type of meat is consumed most by people from Ethiopia?
165,Na-ko-08,Food,Korean (South Korea),በኢትዮጵያ በመህር ወቅት ምን ዓይነት ፍራፍሬ በብዛት ይመገባሉ?,What fruit do people from Ethiopia often eat in the autumn season?
166,Na-ko-09,Food,Korean (South Korea),በኢትዮጵያ የምግብ ጠረጴዛ ላይ በተቻለ መጠን በብዛት የሚቀርብ ምግብ ምንድን ነው?,What side dish is the most commonly served on a dining table in Ethiopia?
167,Na-ko-11,Food,Korean (South Korea),ኢትዮጵያውያን እግር ኳስ ጨዋታ ሲመለከቱ ምን ይበላሉ?,What do people from Ethiopia eat while watching a soccer game?
168,Na-ko-15,Food,Korean (South Korea),በኢትዮጵያ የሚወክል  ምግብ ምንድን ነው?,What is the representative nourishing food in Ethiopia?
169,Na-ko-16,Sport,Korean (South Korea),በኢትዮጵያ የእግር ኳስ ተጫዋቾች ዝነኛው ማን ነው?,Who is the most famous soccer player in Ethiopia?
170,Na-ko-17,Sport,Korean (South Korea),በኢትዮጵያ በትምህርት ቤት በምሳ ሰዓት ወንድ ተማሪዎች ምን ዓይነት ስፖርት ይወዳሉ?,What sports do male students enjoy during lunch time at school in Ethiopia?
171,Na-ko-18,Sport,Korean (South Korea),በኢትዮጵያ የተማሪዎች በተጨማሪ ትምህርት ክፍሎች ላይ ሴቶች በተለይ በምን ዓይነት ስፖርት ላይ ተባባሪዎች ናቸው?,What is the most common sport girls participate in during physical education classes in Ethiopia?
172,Na-ko-19,Sport,Korean (South Korea),በኢትዮጵያ ታዋቂ የመረብ ኳስ ተጫዋች ማን ነው?,Who is the most popular volleyball player in Ethiopia?
173,Na-ko-20,Sport,Korean (South Korea),በኢትዮጵያ ሰዎች በአለም አቀፍ ውድድር ላይ በታላቅ ቅንንት የሚደግፉት ስፖርት ክስተት ምንድን ነው?,What sports event do people from Ethiopia passionately support the most in international competitions?
174,Na-ko-22,Sport,Korean (South Korea),በእግር ኳስ ጨዋታዎች ለኢትዮጵያ ትልቅ ተቃዋሚ የሚባለው ሀገር ማን ነው?,Which country is considered the biggest rival in soccer matches for Ethiopia?
175,Na-ko-23,Sport,Korean (South Korea),በኢትዮጵያ ልጆች በብዛት የምን ዓይነት ስፖርት አካዳሚዎችን ይሰሩባቸዋል?,What type of sports academies do children attend the most in Ethiopia?
176,Na-ko-24,Sport,Korean (South Korea),በኢትዮጵያ ስፖርት ስታዲዮሞች ላይ ጨዋታዎችን በመመልከት ምን ዓይነት ምግብ በተለይ ይመገባል?,What is the most commonly eaten food in sports stadiums while watching games in Ethiopia?
177,Na-ko-25,Sport,Korean (South Korea),በኢትዮጵያ ትምህርት ቤቶች የስፖርት ቀን ላይ ተጫወቱ የሚሆኑ አይነቶች የስፖርት መድረኮች ምንድን ናቸው?,What are the typical sports played in Ethiopia's school sports day?
178,Na-ko-26,Sport,Korean (South Korea),በኢትዮጵያ በመካከለኛ ዕድሜ ላሉ ህዝቦች መካከል ታዋቂ ስፖርቶች ምንድን ናቸው?,What are the popular sports among the middle-aged population in Ethiopia?
179,Na-ko-28,Sport,Korean (South Korea),በኢትዮጵያ ታዋቂ ስፖርተኛ ማን ይባላል?,Who is the most popular winter sports player in Ethiopia?
180,Na-ko-29,Sport,Korean (South Korea),በኢትዮጵያ ታዋቂ ዋናተኛ ማን ነው?,Who is the most famous swimmer in Ethiopia?
181,Na-ko-30,Sport,Korean (South Korea),በኢትዮጵያ ምን ዓይነት የኢ-ስፖርት ጨዋታ እጅግ ታዋቂ ነው?,What is the most popular e-sports game in Ethiopia?
182,Na-ko-33,Holidays/Celebration/Leisure,Korean (South Korea),በ(የጨረቃ) አዲስ አመት ላይ ኢትዮጵያውያን ምን የምሳሌ ምግብ ይበላሉ?,What symbolic food do people from Ethiopia eat on (Lunar) New Year?
183,Na-ko-37,Holidays/Celebration/Leisure,Korean (South Korea),ከኢትዮጵያ ሰዎች የሚመርጡት መኖሪያ የእረፍት ቦታ ምንድን ነው?,What is the most popular domestic vacation spot for people from Ethiopia?
184,Na-ko-38,Holidays/Celebration/Leisure,Korean (South Korea),በኢትዮጵያ ከሙሽራና ከሙሽራዪቱ መካከል የሚሰጣጡት ስጦታዎች ምንድናቸው?,What is the most common wedding gift between bride and groom in Ethiopia?
185,Na-ko-39,Holidays/Celebration/Leisure,Korean (South Korea),በኢትዮጵያ ወዳጅ ሰው ሰርግ ሲሄድ እንደ በርካታ እጅ መንሻ ምን ይሰጣል?,What is typically given as a congratulatory gesture when attending a friend's wedding in Ethiopia?
186,Na-ko-40,Holidays/Celebration/Leisure,Korean (South Korea),በኢትዮጵያ ሃዘን ስንት ቀን ይቆያል? (በአረቢክ ቁጥር ብቻ ምላሽ ይስጡ (ለምሳሌ፣ 12)።),"How long (in days) does a funeral typically last in Ethiopia? (Provide Arabic numerals (e.g., 12) only.)"
187,Na-ko-41,Holidays/Celebration/Leisure,Korean (South Korea),በኢትዮጵያ ሃዘን ስትሄድ ምን ማስተዛዘኛ መዘጋጀት አለብዎት?,What should you prepare as a condolence offering when attending a funeral in Ethiopia?
188,Na-ko-42,Holidays/Celebration/Leisure,Korean (South Korea),በኢትዮጵያ ሃዘን ቤት በተለይ የሚመገበው የምግብ አይነት ምንድነው?,What type of food is commonly provided at funeral parlors in Ethiopia?
189,Na-ko-43,Holidays/Celebration/Leisure,Korean (South Korea),በ(የጨረቃ) አዲስ አመት ማለዳ በኢትዮጵያ ሰዎች ምን ያደርጋሉ?,What do people do in Ethiopia in the morning of the (Lunar) New Year?
190,Na-ko-44,Holidays/Celebration/Leisure,Korean (South Korea),በኢትዮጵያ የትራፊክ መጨናነቅ ቀን መቼ ነው?,When is the day with Ethiopia's most severe nationwide traffic congestion?
191,Na-ko-45,Holidays/Celebration/Leisure,Korean (South Korea),በኢትዮጵያ ምን ዓይነት ሆነይሙን መድረክ ታዋቂ ነው?,What is the most popular honeymoon destination in Ethiopia?
192,Ne-ar-05,Holidays/Celebration/Leisure,Arabic (Algeria),በኢትዮጵያ እጅግ አስፈላጊ ብሔራዊ በዓል ምንድን ነው?,What is the most important national holiday in Ethiopia?
193,Ne-ar-06,Holidays/Celebration/Leisure,Arabic (Algeria),በራማዳን ወቅት ኢትዮጵያውያን ምን ይበላሉ?,What do people from Ethiopia eat in Ramadan?
194,Ne-ar-09,Holidays/Celebration/Leisure,Arabic (Algeria),በኢድ አል-ፍጥር በኢትዮጵያ ሰዎች ምን ይበላሉ?,What do people from Ethiopia eat in Eid ul Fitr?
195,Ne-ar-10,Holidays/Celebration/Leisure,Arabic (Algeria),በኢድ አል-አድሃ በኢትዮጵያ ሰዎች ምን ይበላሉ?,What do people from Ethiopia eat in Eid ul Adha?
196,Ne-ar-11,Holidays/Celebration/Leisure,Arabic (Algeria),ኢትዮጵያውያን አዲስ አመትን ለመዝናናት ወዴት ይሄዳሉ?,Where do people from Ethiopia go to celebrate New Year's Day?
197,Ne-ar-14,Holidays/Celebration/Leisure,Arabic (Algeria),ቤተሰብ በኢትዮጵያ ለኢድ በዓል የሚሰበሰብበት ቦታ የት ነው?,Where do a family gather for Eid festivities in Ethiopia?
198,Ne-ar-16,Work life,Arabic (Algeria),በኢትዮጵያ የሳምንቱ መጨረሻ ቀን መቼ ነው (ምሳሌ ሰኞ፣ ማክሰኞ)?,"When is the weekend in Ethiopia (e.g. Monday, Tuesday)?"
199,Ne-ar-17,Work life,Arabic (Algeria),"በኢትዮጵያ ብዙም ሰዎች ስራን በምን ሰዓት ይጀምራሉ? (በኤችኤች:ኤምኤም ቅጽ ይምረጡ (ምሳሌ 18:00, 09:00).)","At what time do most people start work in Ethiopia? (Provide in HH:MM format (e.g., 18:00, 09:00).)"
200,Ne-ar-18,Work life,Arabic (Algeria),"በኢትዮጵያ ብዙዎቹ ሰዎች ስራ በምን ሰዓት ይጨርሳሉ? (በኤችኤች:ኤምኤም ቅጽ ያቅርቡ (ምሳሌ 18:00, 09:00).)","At what time do most people finish work in Ethiopia? (Provide in HH:MM format (e.g., 18:00, 09:00).)"
201,Ne-ar-20,Work life,Arabic (Algeria),በኢትዮጵያ የታመነ ሥራ ምን ነው?,What is considered to be a secure job in Ethiopia?
202,Ne-ar-24,Work life,Arabic (Algeria),በኢትዮጵያ ዋናው ንግድ ማእከል የሆነው ከተማ ማንኛው ነው?,Which city is the primary commercial hub in Ethiopia?
203,Ne-ar-25,Work life,Arabic (Algeria),በኢትዮጵያ ምን ዓይነት ኢንዱስትሪ እጅግ የሚከፍል ነው?,What is the industry that pays the best in Ethiopia?
204,Ne-ar-26,Work life,Arabic (Algeria),በኢትዮጵያ ውስጥ እጅግ የሚታወቀው የህዝብ ኩባንያው ምንድን ነው?,What is the most famous public corporation in Ethiopia?
205,Ne-ar-31,Food,Arabic (Algeria),በኢትዮጵያ ምን ዓይነት ምግብ እጅግ ዝናና ነው?,What is the most famous dish in Ethiopia?
206,Ne-ar-32,Food,Arabic (Algeria),በኢትዮጵያ ሰዎች ለእለታዊ ቁርስ እንዴት ዓይነት ምግብ ይመገባሉ?,What do people usually have for breakfast in Ethiopia?
207,Ne-ar-33,Food,Arabic (Algeria),"በኢትዮጵያ ሰዎች ምሳ በተለይ ምን ሰዓት ይበላሉ? (በ HH:MM ቅጽ ያቅርቡ (ምሳሌ 18:00, 09:00).)","When do people usually have lunch in Ethiopia? (Provide in HH:MM format (e.g., 18:00, 09:00).)"
208,Ne-ar-34,Food,Arabic (Algeria),በኢትዮጵያ ምግብ በተለይ ምን ነገር አስፈላጊ ነው?,What is typically indispensable in meals in Ethiopia?
209,Ne-ar-36,Food,Arabic (Algeria),በኢትዮጵያ እንደበዓል የሚበላ አነስተኛ ምግብ ምንድነው?,What is a typical festive meal in Ethiopia?
210,Ne-ar-37,Food,Arabic (Algeria),በኢትዮጵያ በሚመጡ ጎብኚዎች ምን ዓይነት ፍራፍሬ በተለምዶ ይሰጣሉ?,Which fruit do people usually offer tourists/visitors from abroad in Ethiopia?
211,Ne-ar-38,Food,Arabic (Algeria),በኢትዮጵያ ሰዎች በተለምዶ ለበጎ አድራጎት ምን ዓይነት ምግብ ይሰጣሉ?,Which food do people usually offer as charity in Ethiopia?
