,ID,Topic,Source,Question,Translation
212,Ne-ar-39,Food,Arabic (Algeria),በኢትዮጵያ ውስጥ ትንሽ ዋጋ ያለው ፈጣን ምግብ ምንድነው?,What is the cheapest fast food in Ethiopia?
213,Ne-ar-43,Food,Arabic (Algeria),በኢትዮጵያ ሰዎች በተለይ ከሻይ ጋር ምን ይመገባሉ?,What do people usually have with tea in Ethiopia?
214,Ne-ar-44,Food,Arabic (Algeria),በኢትዮጵያ ሰዎች ከቡና ጋር ምን ይበላሉ?,What do people have with coffee in Ethiopia?
215,New-am-02,Food,Amharic (Ethiopia),በኢትዮጵያ እጅግ ታዋቂው ባህላዊ ምግብ ምንድነው?,What is the most popular traditional food in Ethiopia?
216,New-am-04,Food,Amharic (Ethiopia),በኢትዮጵያ ምን ዓይነት ወጥ እጅግ ታዋቂ ነው?,What is the most popular dipping sauce in Ethiopia?
217,New-am-08,Food,Amharic (Ethiopia),በኢትዮጵያ በክርስቲያኖች ጾም ጊዜ በተለይ የሚበላ ምግብ ምንድን ነው?,What food is most often consumed during Christian fasting in Ethiopia?
218,New-am-15,Food,Amharic (Ethiopia),እናቶች በኢትዮጵያ ሲወልዱ በተለይ የሚዘጋጀው ምግብ ምንድን ነው?,What food is usually prepared when mothers give birth in Ethiopia?
219,New-am-27,Sport,Amharic (Ethiopia),በኢትዮጵያ እጅግ ታዋቂዋ ሴት ስፖርተኛ ማን ናት?,Who is the most popular female sportperson in Ethiopia?
220,New-am-34,Education,Amharic (Ethiopia),በኢትዮጵያ በአብዛኛው የመጀመሪያ ደረጃ ት/ቤት ተማሪዎች ለፈተናቸው የት ቦታ ይዘጋጃሉ?,Where do most elementary school students prepare for their exams in Ethiopia?
221,New-am-41,Education,Amharic (Ethiopia),በኢትዮጵያ በስንተኛው የክፍል ደረጃ ላይ ተማሪዎች የመጀመሪያውን ብሄራዊ ፈተና የሚወስዱት?,"In Ethiopia, at which grade level do students take their first national-level examination?"
222,New-am-53,Work life,Amharic (Ethiopia),በኢትዮጵያ ምንኛው ክልል ለቡና/ሻይ ኢንዱስትሪ በስፋት ታውቃል?,Which region in Ethiopia is widely known for its coffee/tea industry?
223,New-am-54,Work life,Amharic (Ethiopia),በኢትዮጵያ ውስጥ የትኛው ክልል በእንስሳት እርባታ ኢንዱስትሪ በስፋት ይታወቃል?,Which region in Ethiopia is widely known for its livestock industry?
224,New-am-59,Work life,Amharic (Ethiopia),በኢትዮጵያ በበርሃማ አካባቢ የሚኖሩ ሰዎች ዋና ሥራ ምንድን ነው?,What is the main occupation of people living in deserts in Ethiopia?
225,New-am-60,Work life,Amharic (Ethiopia),በኢትዮጵያ የትኛው እንስሳት ነው ለመጓጓዣነት የሚያገለግለው?,Which animal is typically used for transportation in Ethiopia?
226,New-am-72,Family,Amharic (Ethiopia),በኢትዮጵያ ለልጆች ለመነበብ በአዝናኝነቱ በጣም ታዋቂው መጽሐፍ የቱ ነው?,What is the most popular comic book for children to read in Ethiopia?
227,New-am-73,Family,Amharic (Ethiopia),በኢትዮጵያ ለልጆች በጣም ታዋቂ የዩቲዩብ ቻናል ምንድን ነው?,What is the most popular YouTube channel for children in Ethiopia?
228,New-am-74,Family,Amharic (Ethiopia),በኢትዮጵያ እጅግ ተወዳጁ የውይይት ፕሮርጋም ነው?,What is the most popular talk show in Ethiopia?
229,New-am-77,Holidays/Celebration/Leisure,Amharic (Ethiopia),በኢትዮጵያ እጅግ ታዋቂው ሃይማኖታዊ ባዓል የቱ ነው?,What is the most famous religious holiday in Ethiopia?
230,New-am-81,Holidays/Celebration/Leisure,Amharic (Ethiopia),በኢትዮጵያ እጅግ በጣም ሰርግ የሚበዛበት ወር የትኛው ነው? (በቁጥረ (ምሳሌ 1) ብቻ ስጡ።),"What is the busiest month for weddings in Ethiopia? (Provide Arabic numerals (e.g., 1) only.)"
231,New-am-83,Holidays/Celebration/Leisure,Amharic (Ethiopia),በኢትዮጵያ ምን ዓይነት ባህላዊ የሙዚቃ መሣሪያ እጅግ ታዋቂ ነው?,What is the most popular traditional musical instrument in Ethiopia?
232,New-as-01,Food,Assamese (Assam),በኢትዮጵያ የሚመረተው ዋና የእርሻ ምርት ምንድነው?,What is the main agricultural product produced in Ethiopia?
233,New-as-02,Food,Assamese (Assam),በኢትዮጵያ እጅግ ታዋቂው ከስንዴ ግባአት የሚዘጋጅ ምግብ ምንድን ነው?,What is the most popular wheat-based food item in Ethiopia?
234,New-as-05,Food,Assamese (Assam),በኢትዮጵያ እንግዶች ቤተሰቦችን ሲጎበኙ የሚቀርብላቸው እጅግ እንደተለመደ መጠጥ ምንድን ነው?,What is the most typical drink offered to guests when they visit households in Ethiopia?
235,New-as-07,Food,Assamese (Assam),በኢትዮጵያ በጣም የታወቀው ከአሳ የሚዘጋጅ ምግብ ምንድን ነው?,What is the most popular dish cooked with fish in Ethiopia?
236,New-as-14,Food,Assamese (Assam),በዝናባማ ወራት ጊዜ ኢትዮጵያውያን ምን ምግብ ይወዳሉ?,What food do people from Ethiopia like to eat during rainy weather?
237,New-as-15,Food,Assamese (Assam),በኢትዮጵያ የአየር ሙቀት ሲጨምር ምን መጠጥ በአብዛኛው ይጠጣል?,What drink is commonly consumed in Ethiopia when the weather is hot?
238,New-as-20,Sport,Assamese (Assam),በኢትዮጵያ የትኛው ዓይነት የቤት ውስጥ ስፖርት በጣም ታዋቂ ነው?,What is the most popular indoor sport in Ethiopia?
239,New-as-29,Sport,Assamese (Assam),በኢትዮጵያ ወንዶች ምን ዓይነት ስፖርት መመልከት ይወዳሉ?,What sport do men in Ethiopia like to watch?
240,New-as-30,Sport,Assamese (Assam),ኢትዮጵያዊት ሴቶች ምን ዓይነት ስፖርት መመልከት ይወዳሉ?,What sport do women in Ethiopia like to watch?
241,New-as-58,Work life,Assamese (Assam),በኢትዮጵያ ሰዎች በየስራ ቦታቸው ለመጠጣት የሚወዱት እጅግ ታዋቂ መጠጥ ምንድን ነው?,What is the most popular beverage that people from Ethiopia like to drink in their workplace?
242,New-as-64,Family,Assamese (Assam),በኢትዮጵያ በየትኛው በዓል ሁሉም ቤተሰቦች በአንድ ላይ ለመሆን ይሻሉ?,On which holiday do all family members tend to reunite in Ethiopia?
243,New-as-76,Holidays/Celebration/Leisure,Assamese (Assam),በኢትዮጵያ በባህላዊ በዓላት ጊዜ ቤተሰቦች ምን ዓይነት ባህላዊ ጨዋታዎች ይጫወታሉ?,What traditional games do families play during traditional holidays in Ethiopia?
244,New-as-80,Holidays/Celebration/Leisure,Assamese (Assam),በኢትዮጵያ በባህላዊ በዓላት ላይ ሰዎች የምን ዓይነት አልባሳት ይለብሳሉ?,What type of clothing do people from Ethiopia wear during traditional festivals?
245,New-as-89,Holidays/Celebration/Leisure,Assamese (Assam),በኢትዮጵያ በባህላዊ በዓላት ላይ ሰዎች የምን ዓይነት ጌጣጌጥ ይለብሳሉ?,What traditional festival accessories do people from Ethiopia wear?
246,New-az-05,Food,Azerbaijani (Azerbaijan),በኢትዮጵያ በአልኮል ምርት እጅግ ታዋቂ የሆነ ክልል የት ነው?,What is the most famous region for alcohol production in Ethiopia?
247,New-az-11,Food,Azerbaijani (Azerbaijan),በክረምት ወራት ሰዎች በኢትዮጵያ በብዛት የሚበሉት ፍሬ ምንድን ነው?,What fruit do people from Ethiopia often eat in the summer season?
248,New-az-12,Food,Azerbaijani (Azerbaijan),በኢትዮጵያ ውስጥ በባህር ምግብ ምርቱ የታወቀው ክልል የቱ ነው?,Which region in Ethiopia is known for its seafood?
249,New-az-21,Sport,Azerbaijani (Azerbaijan),በኢትዮጵያ የትኛው ክልል ለበረዶ መንሸራተቻ ጨዋታ በጣም ታዋቂ ነው?,Which region in Ethiopia is the most popular skiing destination?
250,New-az-26,Sport,Azerbaijani (Azerbaijan),በኢትዮጵያ እጅግ ታዋቂ የማርሻል አርት ተጫዋች ማነው?,Who is the most popular martial arts player in Ethiopia?
251,New-az-27,Sport,Azerbaijani (Azerbaijan),ባለፉት አስር አመታት ውስጥ በኢትዮጵያ እያደገ የነበረው ስፖርት ምንድን ነው?,Which sport has been one of the fastest-growing in Ethiopia over the last decade?
252,New-az-39,Education,Azerbaijani (Azerbaijan),ከኢትዮጵያ ለትምህርት ወዴ ውጭ የሚሄዱ ተማሪዎች በአብዛኛው የሚመርጡት አገር የቱ ነው?,Which country is the most popular destination for students from Ethiopia studying abroad?
253,New-az-49,Work life,Azerbaijani (Azerbaijan),በኢትዮጵያ በአንድ ቤተሰብ ስንት ሰዎች ይኖራሉ? (እባኮትን በቁጥር (ምሳሌ 1) ብቻ ያቅርቡ።),"How many people work in a typical family in Ethiopia? (Provide Arabic numerals (e.g., 1) only.)"
254,New-az-60,Family,Azerbaijani (Azerbaijan),በኢትዮጵያ፣ ሁለቱም ወላጆች ሰራተኞች ከሆኑ ልጆችን ማን ይከታተላል?,"In Ethiopia, who takes care of kids when both parents are working?"
255,New-az-69,Holidays/Celebration/Leisure,Azerbaijani (Azerbaijan),ኢትዮጵያ ወንዶች የሚመርጡት የአልኮል መጠጥ ምንድነው?,What is the preferred alcoholic beverage for men from Ethiopia?
256,New-az-70,Holidays/Celebration/Leisure,Azerbaijani (Azerbaijan),ኢትዮጵያ ሴቶች የሚመርጡት አስካሪ መጠጥ መጠጥ ምንድነው?,What is the preferred alcoholic beverage for women from Ethiopia?
257,New-az-73,Holidays/Celebration/Leisure,Azerbaijani (Azerbaijan),ኢትዮጵያ በተለይ ሰርግ ላይ በአማካይ ስንት ሰዎች ይሳተፋሉ? (በቁጥረ (ምሳሌ 1) ብቻ ስጡ።),"How many people on average typically attend a wedding in Ethiopia? (Provide Arabic numerals (e.g., 1) only.)"
258,New-ch-01,Food,Chinese (China),በኢትዮጵያ ሰዎች ጥብስ ሲሰሩ በተለይ የሚጠቀሙት ምን ዓይነት ሥጋ ነው?,What kind of meat do people usually eat when they have barbecue in Ethiopia?
259,New-ch-02,Food,Chinese (China),"በኢትዮጵያ ሰዎች በተለይ ምን ሰዓት ቁርስ ይበላሉ? (በሰዓት አስቅምጡ (ምሳሌ 18:00, 09:00).)","When do people usually have breakfast in Ethiopia? (Provide in HH:MM format (e.g., 18:00, 09:00).)"
260,New-ch-04,Food,Chinese (China),በኢትዮጵያ ሰዎች በምሽት ምግብ ሲበሉ በተለይ ምን ዓይነት ምግብ ይመገባሉ?,What kinds of food do people usually eat for late-night snacks in Ethiopia?
261,New-ch-05,Food,Chinese (China),በኢትዮጵያ በጣም ዝኘኛ የሚያቃጥል  ምግብ ምንድነው?,What is the most famous spicy dish in Ethiopia?
262,New-ch-07,Food,Chinese (China),በኢትዮጵያ ሰዎች ከጠንካራ መጠጥ ጋር በተለይ የሚወሰዱ ምግቦች ምንምን ናቸው?,What food items do people typically pair with hard liquor in Ethiopia?
263,New-ch-08,Food,Chinese (China),በኢትዮጵያ ምግብ ለማብሰል ምን ዓይነት ቅመማ ቅመም አስፈላጊ ነው??,What seasoning is indispensable in cooking in Ethiopia?
264,New-ch-09,Food,Chinese (China),በኢትዮጵያ የአየር ሁኔታ ቀዝቃዛ ሲሆን ሰዎች በተለይ ምን ምግብ ይመገባሉ?,What food do people typically consume when the weather is cold in Ethiopia?
265,New-ch-13,Food,Chinese (China),በኢትዮጵያ ምን ዓይነት አልኮል ብራንድ እጅግ ዝነኛ ነው?,What is the most famous alcohol brand in Ethiopia?
266,New-ch-14,Food,Chinese (China),በኢትዮጵያ ሰዎች ሲታመሙ በተለይ ምን ምግቦችን ይመገባሉ?,What foods do people usually eat when they are sick in Ethiopia?
267,New-ch-15,Food,Chinese (China),በኢትዮጵያ ሰዎች ከሱፐርማርኬቶች ምን አይነት የተዘጋጁ  ምግቦችን በተለይ ይገዛሉ?,What prepared/ready-to-eat food do people typically buy at supermarkets in Ethiopia?
268,New-ch-16,Sport,Chinese (China),በኢትዮጵያ በጣም ታዋቂው ከስፖርት ጋር የተያያዥነት ያለው ፊልም ምንድነው?,What is the most famous sports-related movie in Ethiopia?
269,New-ch-17,Sport,Chinese (China),በኢትዮጵያ ሰዎች ብዙ ለመሞከር የሚፈልጉት ምን ዓይነት ስፖርት ነው?,What extreme sport do people generally wish to try the most in Ethiopia?
270,New-ch-18,Sport,Chinese (China),በኢትዮጵያ በቤት ወስጥ እና በሜዳ ላይ ከሚከናወኑ ውድድሮች ለመመልከት እጅግ ታዋቂዎቹ የትኞቹ ናቸው?,Which track and field event is the most popular to watch during competitions in Ethiopia?
271,New-ch-19,Sport,Chinese (China),በኢትዮጵያ ከሚደረጉ ውድድሮች ለመታየት በጣም ተወዳጅ የሆነው የትኛው የጂምናስቲክ ዝግጅት ነው?,Which gymnastics event is the most popular to watch during competitions in Ethiopia?
272,New-ch-23,Sport,Chinese (China),በኢትዮጵያ በጣም ታዋቂው የጠረጴዛ ቴኒስ ተጫዋች ማነው?,Who is the most famous table tennis player in Ethiopia?
273,New-ch-26,Sport,Chinese (China),በኢትዮጵያ በክረምት ኦሊምፒክ ለመታየት በጣም ታዋቂ የሆነው የትኛው ዝግጅት ነው?,"In the Winter Olympics, which event is the most popular to watch in Ethiopia?"
274,New-ch-27,Sport,Chinese (China),በኢትዮጵያ በጣም ታዋቂው ቦክሰኛ ማነው? ,Who is the most famous boxer in Ethiopia?
275,New-ch-30,Sport,Chinese (China),በኢትዮጵያ በቤት ወስጥና በሜዳ  ውድድሮች እጅግ ታዋቂ የሆነው አትሌት ማነው? ,Who is the most famous track and field athlete in Ethiopia?
276,New-ch-31,Work life,Chinese (China),በኢትዮጵያ ወላጆች ለልጆቻቸው ከሁሉ ይልቅ የሚመኙት የስራ አይነት ምንድነው?,What job do parents most hope their children will pursue in Ethiopia?
277,New-ch-32,Work life,Chinese (China),በኢትዮጵያ ሰዎች ምን አይነት የተለየ ሶፍትዌን ለቢሮ ስራ ይጠቀማሉ?,What office software do people typically use in the workplace in Ethiopia?
278,New-ch-38,Work life,Chinese (China),በኢትዮጵያ ምርት ወደ ውጭ በመላክና ከውጭም በማስገባት ታዋቂ የሆነ ከተማ ወይም ክልል የቱ ነው?  ,Which cities or regions are known for their import and export activities in Ethiopia?
279,New-ch-39,Work life,Chinese (China),በኢትዮጵያ በበይነ-መረብ ንግድ ኢንዱስትሪው በአብዛኛው የሚታወቅ ድረ-ገፅ የትኛው ነው?,What platform is commonly used in the e-commerce industry in Ethiopia?
280,New-ch-44,Work life,Chinese (China),በኢትዮጵያ የአዲስ ሠራተኞች መደበኛዉን የቅጥር ፎርም ከመፈረማቸው በፊት በተልየ የሚፈርሙት የሙከራ ቅጥር ለምን ያክል ጊዜ ነው? (ምሳሌ 1 ወር)።,"How long is the typical probation period for new employees before signing a formal contract in Ethiopia? (e.g., 1 month)."
281,New-ch-45,Work life,Chinese (China),በኢትዮጵያ ወጣቶች ስራ ለመጀመር በተለይ የትኛውን ዓይነት የስራ ዘርፍ ይመርጣሉ?,Which industries do young people typically choose to start businesses in Ethiopia?
282,New-ch-49,Family,Chinese (China),በኢትዮጵያ ቤተሰቦች የርቀት ግንኙነት ለማድረግ በተለይ የሚመርጡት የመገናኛ ዘዴ ምንድን ነው?,What is the most common way for family members to communicate remotely in Ethiopia?
283,New-ch-51,Family,Chinese (China),በኢትዮጵያ ለቤተሰብ ጉዞዎች በተለይ የሚመረጠው የእንግዳ ማረፊያ የትኛው ነው?,What form of accommodation is typically booked for family trips in Ethiopia?
284,New-ch-54,Family,Chinese (China),በኢትዮጵያ በቤተሰቦች የእራት ምግብ ላይ በተለይ ተዘጋጅቶ የሚቀርብ ፍራፍሬ ምንድን ነው?,Which fruit is usually prepared the most for family dinners in Ethiopia?
285,New-ch-64,Education,Chinese (China),በኢትዮጵያ ዩኒቨርስቲ ተማሪዎች በሳምንት ለምን ያክል ሰዓት ክፍለጊዜ አሉአቸው? (በቁጥር (ምሳሌ 1) በለው ይስጡ።),"How many hours of classes do university students typically have per week in Ethiopia? (Provide Arabic numerals (e.g., 1) only.)"
286,New-ch-66,Education,Chinese (China),በኢትዮጵያ በህዝብ ከፍተኛ ትምህርት ቤቶች ለአንድ ሴሜስተር የሚከፈል የትምህርት ክፍያ ስንት ነው? (በቁጥር  (ምሳሌ 1) ብለው ይስጡ።),"What is the typical tuition fee per semester for public high schools in Ethiopia?  (Provide Arabic numerals (e.g., 1) only.)"
287,New-ch-70,Education,Chinese (China),በኢትዮጵያ ሁሉም የዩኒቨርስቲ ተማሪዎች በጋራ የሚማሯቸው አስፈላጊ ኮርሶች የትኞቹ ናቸው?,What compulsory courses do university students have in common in Ethiopia?
288,New-ch-71,Education,Chinese (China),በኢትዮጵያ በከፍተኛ 2ኛ ደረጃ ትምህርት ቤቶች ውስጥ በአንድ የክፍል አማካይ  መጠን ስንት ነው? (በቁጥር (ምሳሌ 1) ይፃፉ።),"What is the average class size in high schools in Ethiopia? (Provide Arabic numerals (e.g., 1) only.)"
289,New-ch-72,Education,Chinese (China),በኢትዮጵያ የትኛው ዓይነት ዋና የትምህርት መስከ  ለሥራ ቅጥር እጅግ ጥሩ ነው?,Which major is considered most conducive to employment in Ethiopia?
290,New-ch-73,Education,Chinese (China),በኢትዮጵያ በዩኒቨርስቲ ተማሪዎች በዝነኛነት የሚታወቁት ክለቦች ምን አይነት ናቸው?,What type of clubs are most popular among university students in Ethiopia?
291,New-ch-74,Education,Chinese (China),በኢትዮጵያ የዩኒቨርስቲ ተማሪዎች በተለይ የምን ዓይነት መኖሪያ ይኖራሉ?,What types of accommodation do university students in Ethiopia typically live in?
292,New-ch-75,Education,Chinese (China),በኢትዮጵያ ለመካከለኛ ት/ቤት ተማሪዎች እያንዳንዱ ክፍለ-ትምህርት ጊዜ ስንት ደቂቃ ነው? (በቁጥር ብቻ ምላሽ ይስጡ። ምሳሌ፡ 1),"How long is each class period for middle school students in Ethiopia (minutes)?  (Provide Arabic numerals (e.g., 1) only.)"
293,New-ch-78,Holidays/Celebration/Leisure,Chinese (China),በኢትዮጵያ ጡረተኛ ሴቶች የሚወዷቸው የመዝናኛ እንቅስቃሴዎች የትኞቹ ናቸው? ,What leisure activities do retired women typically like in Ethiopia?
294,New-ch-79,Holidays/Celebration/Leisure,Chinese (China),በኢትዮጵያ ጡረተኛ ወንዶች የሚወዷቸው የመዝናኛ እንቅስቃሴዎች የትኞቹ ናቸው? ,What leisure activities do retired men typically like in Ethiopia?
295,New-ch-80,Holidays/Celebration/Leisure,Chinese (China),በኢትዮጵያ ሰዎች በተለይ በየትኞቹ ሀይማኖታዊ በዓላት ጊዜ ነው ቅዱሳን ቦታዎችን (ቤተ ክርስቲያኖች፣ መቅደሶች ወዘተ) የሚጎበኙት? ,"During which holidays do people typically visit religious sites (temples, churches, etc.) in Ethiopia?"
296,New-ch-81,Holidays/Celebration/Leisure,Chinese (China),በኢትዮጵያ በተለይ ቤት  የሚያደምቁ ስጦታዎች የትኞቹ ናቸው?,What are the typical housewarming gifts in Ethiopia?
297,New-ch-82,Holidays/Celebration/Leisure,Chinese (China),"በኢትዮጵያ የሰርግ ስነስርዓት በተለይ ስንት ሰዓት ላይ ይጀመራል? (ምሳሌ 18:00, 09:00) ይምረጡ።)","At what time do weddings typically start in Ethiopia? (Provide in HH:MM format (e.g., 18:00, 09:00).)"
298,New-ch-83,Holidays/Celebration/Leisure,Chinese (China),ከኢትዮጵያ ከተሞች በርካታ ዝግጅቶችን የሚያስተናግደው የትኛው ነው?  ,Which city in Ethiopia hosts festivals the most?
299,New-ch-84,Holidays/Celebration/Leisure,Chinese (China),በኢትዮጵያ ሰዎች ሰርግ ስነስርዓት ላይ ለመታደም በተለይ የሚለብሱት የልብስ ቀለም ምን አይነት ነው? ,What color of clothing do people typically wear when attending weddings in Ethiopia?
300,New-ch-85,Holidays/Celebration/Leisure,Chinese (China),በኢትዮጵያ ሰዎች ሀዘን ስነስርዓት ላይ ለመታደም በተለይ የሚለብሱት የልብስ ቀለም ምን አይነት ነው? ,What color of clothing do people typically wear when attending funerals in Ethiopia?
301,New-en-01,Food,English (UK),በኢትዮጵያ ሲኒማ ውስጥ የሚመገቡት ምግብ የትኛው ነው?,Which snack is eaten in the cinema in Ethiopia?
302,New-en-02,Food,English (UK),በኢትዮጵያ ታዋቂውና ጥራት ያለው ጣዕም የትኛው ነው?,What is the most popular chip/crisp flavour in Ethiopia?
303,New-en-04,Food,English (UK),በኢትዮጵያ ውስጥ ውስጥ ዝነኛና ታዋቂ ሼፍ ማን ነው?,Who is a popular celebrity chef in Ethiopia?
304,New-en-05,Food,English (UK),በኢትዮጵያ ውስጥ የትኛው የምግብ አይነት ነው በጣም ርካሽና ፈጣን የምግብ አማራጭ የሚባለው?,Which food is a cost-effective and quick meal option in Ethiopia?
305,New-en-07,Food,English (UK),በኢትዮጵያ ዝነኛውና ታዋቂው የምግብ ዝግጅት ፕሮግራም/ሾው የቱ ነው?  ,What are the most popular cooking shows in Ethiopia?
306,New-en-08,Food,English (UK),በኢትዮጵያ ምን ዓይነት ቸኮሌት ብራንድ እጅግ ታዋቂ ነው?,What is the most popular chocolate brand in Ethiopia?
307,New-en-10,Food,English (UK),ኢትዮጵያ ውስጥ በብዛት የሚበላው የአይብ አይነት የትኛው ነው? ,What is the most eaten cheese in Ethiopia?
308,New-en-11,Food,English (UK),በኢትዮጵያ እጅግ የተጠላ አትክልት ምንድን ነው?,What is the most disliked vegetable in Ethiopia?
309,New-en-12,Food,English (UK),ኢትዮጵያ ወስጥ የትኛው የምግብ አይነት ነው በአብዛኛው የምግብ ጠርጴዛ ላይ የማይታጣው?  ,What food is most commonly found in food courts in Ethiopia?
310,New-en-17,Sport,English (UK),ኢትዮጵያ ውስጥ የስፖርት አድናቂዎች የሚጠቀሙባቸው በጣም የተለመዱ የደስታ መግለጫ ምግቦች የትኞቹ ናትው?,What are the most common cheering tools used by sports fans in Ethiopia?
311,New-en-18,Sport,English (UK),ኢትዮጵያ ውስጥ በቀጥታ ጨዋታ ላይ ሲገኙ የስፖርት አድናቂዎች የሚጠቀሙባቸው በጣም የተለመዱ የደስታ መግለጫ ምግቦች የትኞቹ ናትው?,What do fans bring with them when attending a live game in Ethiopia?
312,New-en-19,Sport,English (UK),በኢትዮጵያ ውስጥ በጣም ታዋቂ የስፖርት ስታዲየም የትኛው ነው?,What is the most well known sporting stadium in Ethiopia?
313,New-en-23,Sport,English (UK),በኢትዮጵያ ወስጥ በትም ታዋቂው  የፓራሊምፒክ  ስፖርተኛ ማን ነው?,Who is the most famous Paralympian in Ethiopia?
314,New-en-26,Sport,English (UK),በኢትዮጵያ ውስጥ በጣም ታዋቂው የስፖርት ዝማሬ ምንድነው?,What is the best recognized sporting chant in Ethiopia?
315,New-en-38,Work life,English (UK),በኢትዮጵያ የትኛው የስራ ዘርፍ ነው ተለማጭ የስራ ሰዓት ያለው?,Which industries are known for more flexible working hours in Ethiopia?
316,New-en-41,Work life,English (UK),በኢትዮጵያ ውስጥ በጣም ታዋቂ እና ስኬታማ የስራ ፈጣሪ ማን ነው?,Who is the most well known and successful entrepreneur in Ethiopia?
317,New-en-47,Family,English (UK),በኢትዮጵያ በቤቶች የኋላ ቦታ/ጓሮ ውስጥ ምን ይገኛል? ,What can typically be found in the back garden of houses in Ethiopia?
318,New-en-49,Family,English (UK),በኢትዮጵያ ውስጥ እጅግ ዝነኛ የሆነው የቤተሰብ አባል ማነው? ,What is the name of the most famous family in Ethiopia?
319,New-en-50,Family,English (UK),በኢትዮጵያ በጣም ታዋቂ የቤተሰብ ስም ምንድን ነው?,What is the most common family name in Ethiopia?
320,New-en-55,Family,English (UK),በኢትዮጵያ ውስጥ የትኛው ሃይማኖት ነው በርካታ ተከታይ ያለው?  ,Which religion is most commonly practiced by families in Ethiopia?
321,New-en-56,Family,English (UK),በኢትዮጵያ ውስጥ የትኛው የውጭ ቋንቋ ነው በአብዛኛው የቤተሰብ አባላት የሚነገረው? ,What is the most popular foreign language spoken by families in Ethiopia?
322,New-en-59,Family,English (UK),የትኛው ሀገር ነው ለበርካታ ኢትዮጵያዊያን ቤተሰቦች በጣም ታዋቂ የስደት መዳረሻ የሆነው? ,Which country is the most popular destination for families from Ethiopia to emigrate to?
