ID,Topic,Source,Question,Translation
New-az-69,Holidays/Celebration/Leisure,Azerbaijani (Azerbaijan),What is the preferred alcoholic beverage for men from your country?,¿Cuál es la bebida alcohólica preferida por los hombres de México?
New-az-70,Holidays/Celebration/Leisure,Azerbaijani (Azerbaijan),What is the preferred alcoholic beverage for women from your country?,¿Cuál es la bebida alcohólica preferida por las mujeres de México?
New-az-73,Holidays/Celebration/Leisure,Azerbaijani (Azerbaijan),"How many people on average typically attend a wedding in your country? (Provide Arabic numerals (e.g., 1) only.)","¿Cuántas personas en promedio suelen asistir a una boda en México? (Proporciona solo números arábigos (por ejemplo, 1).)"
New-ch-01,Food,Chinese (China),What kind of meat do people usually eat when they have barbecue in your country?,¿Qué tipo de carne suelen comer las personas cuando hacen carne asada en México?
New-ch-02,Food,Chinese (China),"When do people usually have breakfast in your country? (Provide in HH:MM format (e.g., 18:00, 09:00).)","¿A qué hora suelen desayunar las personas en México? (Proporcionar en formato HH:MM (por ejemplo, 18:00, 09:00).)"
New-ch-04,Food,Chinese (China),What kinds of food do people usually eat for late-night snacks in your country?,¿Qué tipos de comida suelen comer las personas en México como bocadillos nocturnos?
New-ch-05,Food,Chinese (China),What is the most famous spicy dish in your country?,¿Cuál es el platillo picante más famoso de México?
New-ch-07,Food,Chinese (China),What food items do people typically pair with hard liquor in your country?,¿Qué alimentos suelen acompañar las personas con bebidas alcohólicas fuertes en México?
New-ch-08,Food,Chinese (China),What seasoning is indispensable in cooking in your country?,¿Qué condimento esencial es indispensable en la cocina en México?
New-ch-09,Food,Chinese (China),What food do people typically consume when the weather is cold in your country?,¿Qué comida consumen típicamente las personas cuando el clima está frío en México?
New-ch-13,Food,Chinese (China),What is the most famous alcohol brand in your country?,¿Cuál es la marca de alcohol más famosa en México?
New-ch-14,Food,Chinese (China),What foods do people usually eat when they are sick in your country?,¿Qué alimentos suelen comer las personas cuando están enfermas en México?
New-ch-15,Food,Chinese (China),What prepared/ready-to-eat food do people typically buy at supermarkets in your country?,¿Qué alimentos preparados/listos para comer suelen comprar las personas en los supermercados de México?
New-ch-16,Sport,Chinese (China),What is the most famous sports-related movie in your country?,¿Cuál es la película relacionada con el deporte más famosa en México?
New-ch-17,Sport,Chinese (China),What extreme sport do people generally wish to try the most in your country?,¿Qué deporte extremo desean intentar más las personas en general en México?
New-ch-18,Sport,Chinese (China),Which track and field event is the most popular to watch during competitions in your country?,¿Cuál es la prueba de atletismo más popular para ver durante las competiciones en México?
New-ch-19,Sport,Chinese (China),Which gymnastics event is the most popular to watch during competitions in your country?,¿Cuál es el evento de gimnasia más popular para ver durante las competencias en México?
New-ch-23,Sport,Chinese (China),Who is the most famous table tennis player in your country?,¿Quién es el jugador de tenis de mesa más famoso en México?
New-ch-26,Sport,Chinese (China),"In the Winter Olympics, which event is the most popular to watch in your country?","En los Juegos Olímpicos de Invierno, ¿cuál es el evento más popular para ver en México?"
New-ch-27,Sport,Chinese (China),Who is the most famous boxer in your country?,¿Quién es el boxeador más famoso de México?
New-ch-30,Sport,Chinese (China),Who is the most famous track and field athlete in your country?,¿Quién es el atleta de pista y campo más famoso en México?
New-ch-31,Work life,Chinese (China),What job do parents most hope their children will pursue in your country?,¿Qué profesión esperan los padres que sus hijos persigan más en México?
New-ch-32,Work life,Chinese (China),What office software do people typically use in the workplace in your country?,¿Qué software de oficina suelen utilizar las personas en el lugar de trabajo en México?
New-ch-38,Work life,Chinese (China),Which cities or regions are known for their import and export activities in your country?,¿Qué ciudades o regiones son conocidas por sus actividades de importación y exportación en México?
New-ch-39,Work life,Chinese (China),What platform is commonly used in the e-commerce industry in your country?,¿Qué plataforma se utiliza comúnmente en la industria del comercio electrónico en México?
New-ch-44,Work life,Chinese (China),"How long is the typical probation period for new employees before signing a formal contract in your country? (e.g., 1 month).","¿Cuál es el período de prueba típico para los nuevos empleados antes de firmar un contrato formal en México? (por ejemplo, 1 mes)."
New-ch-45,Work life,Chinese (China),Which industries do young people typically choose to start businesses in your country?,¿Qué industrias suelen elegir los jóvenes para iniciar negocios en México?
New-ch-49,Family,Chinese (China),What is the most common way for family members to communicate remotely in your country?,¿Cuál es la forma más común en que los miembros de la familia se comunican a distancia en México?
New-ch-51,Family,Chinese (China),What form of accommodation is typically booked for family trips in your country?,¿Qué tipo de alojamiento se reserva habitualmente para viajes familiares en México?
New-ch-54,Family,Chinese (China),Which fruit is usually prepared the most for family dinners in your country?,¿Qué fruta se suele preparar más para las cenas familiares en México?
New-ch-64,Education,Chinese (China),"How many hours of classes do university students typically have per week in your country? (Provide Arabic numerals (e.g., 1) only.)","¿Cuántas horas de clases suelen tener los estudiantes universitarios por semana en México? (Proporciona solo números arábigos (por ejemplo, 1).)"
New-ch-66,Education,Chinese (China),"What is the typical tuition fee per semester for public high schools in your country?  (Provide Arabic numerals (e.g., 1) only.)","¿Cuál es la cuota de inscripción típica por semestre para las preparatorias públicas en México? (Proporciona solo números arábigos (por ejemplo, 1).)"
New-ch-70,Education,Chinese (China),What compulsory courses do university students have in common in your country?,¿Qué cursos obligatorios tienen en común los estudiantes universitarios en México?
New-ch-71,Education,Chinese (China),"What is the average class size in high schools in your country? (Provide Arabic numerals (e.g., 1) only.)","¿Cuál es el tamaño promedio de las clases en las preparatorias en México? (Proporcione únicamente números arábigos (por ejemplo, 1).)"
New-ch-72,Education,Chinese (China),Which major is considered most conducive to employment in your country?,¿Qué carrera se considera más conducente al empleo en México?
New-ch-73,Education,Chinese (China),What type of clubs are most popular among university students in your country?,¿Qué tipo de clubes son los más populares entre los estudiantes universitarios en México?
New-ch-74,Education,Chinese (China),What types of accommodation do university students in your country typically live in?,¿En que tipos de alojamiento viven principalmente los estudiantes universitarios en México?
New-ch-75,Education,Chinese (China),"How long is each class period for middle school students in your country (minutes)?  (Provide Arabic numerals (e.g., 1) only.)","¿Cuánto dura cada período de clase para los estudiantes de secundaria en México (minutos)? (Proporcione solo números arábigos (por ejemplo, 1).)"
New-ch-78,Holidays/Celebration/Leisure,Chinese (China),What leisure activities do retired women typically like in your country?,¿Qué actividades de ocio suelen gustarle a las mujeres jubiladas en México?
New-ch-79,Holidays/Celebration/Leisure,Chinese (China),What leisure activities do retired men typically like in your country?,¿Qué actividades de ocio suelen gustarles a los hombres jubilados en México?
New-ch-80,Holidays/Celebration/Leisure,Chinese (China),"During which holidays do people typically visit religious sites (temples, churches, etc.) in your country?","¿Durante qué festividades la gente suele visitar lugares religiosos (templos, iglesias, etc.) en México?"
New-ch-81,Holidays/Celebration/Leisure,Chinese (China),What are the typical housewarming gifts in your country?,¿Cuáles son los regalos típicos para una inauguración de casa en México?
New-ch-82,Holidays/Celebration/Leisure,Chinese (China),"At what time do weddings typically start in your country? (Provide in HH:MM format (e.g., 18:00, 09:00).)","¿A qué hora suelen comenzar las bodas típicamente en México? (Proporcionar en formato HH:MM (por ejemplo, 18:00, 09:00).)"
New-ch-83,Holidays/Celebration/Leisure,Chinese (China),Which city in your country hosts festivals the most?,¿Qué ciudad de México es la que más festivales alberga?
New-ch-84,Holidays/Celebration/Leisure,Chinese (China),What color of clothing do people typically wear when attending weddings in your country?,¿Qué color de ropa suelen llevar las personas cuando asisten a bodas en México?
New-ch-85,Holidays/Celebration/Leisure,Chinese (China),What color of clothing do people typically wear when attending funerals in your country?,¿Qué color de ropa suelen llevar las personas cuando asisten a funerales en México?
New-en-01,Food,English (UK),Which snack is eaten in the cinema in your country?,¿Qué botana se come en el cine en México?
New-en-02,Food,English (UK),What is the most popular chip/crisp flavour in your country?,¿Cuál es el sabor de papas fritas más popular en México?
New-en-04,Food,English (UK),Who is a popular celebrity chef in your country?,¿Quién es un chef celebridad popular en México?
New-en-05,Food,English (UK),Which food is a cost-effective and quick meal option in your country?,¿Qué comida es una opción rápida y económica para comer en México?
New-en-07,Food,English (UK),What are the most popular cooking shows in your country?,¿Cuáles son los programas de cocina más populares en México?
New-en-08,Food,English (UK),What is the most popular chocolate brand in your country?,¿Cuál es la marca de chocolate más popular en México?
New-en-10,Food,English (UK),What is the most eaten cheese in your country?,¿Cuál es el queso más consumido en México?
New-en-11,Food,English (UK),What is the most disliked vegetable in your country?,¿Cuál es la verdura menos gustada en México?
New-en-12,Food,English (UK),What food is most commonly found in food courts in your country?,¿Qué comida se encuentra más comúnmente en las plazas de comida en México?
New-en-17,Sport,English (UK),What are the most common cheering tools used by sports fans in your country?,¿Cuáles son los instrumentos de animación más comunes utilizados por los aficionados al deporte en México?
New-en-18,Sport,English (UK),What do fans bring with them when attending a live game in your country?,¿Qué llevan los aficionados consigo cuando asisten a un partido en vivo en México?
New-en-19,Sport,English (UK),What is the most well known sporting stadium in your country?,¿Cuál es el estadio deportivo más conocido en México?
New-en-23,Sport,English (UK),Who is the most famous Paralympian in your country?,¿Quién es el paralímpico más famoso de México?
New-en-26,Sport,English (UK),What is the best recognized sporting chant in your country?,¿Cuál es el cántico deportivo más reconocido en México?
New-en-38,Work life,English (UK),Which industries are known for more flexible working hours in your country?,¿Qué industrias son conocidas por tener horarios de trabajo más flexibles en México?
New-en-41,Work life,English (UK),Who is the most well known and successful entrepreneur in your country?,¿Quién es el empresario más conocido y exitoso de México?
New-en-47,Family,English (UK),What can typically be found in the back garden of houses in your country?,¿Qué se puede encontrar típicamente en el jardín trasero de las casas en México?
New-en-49,Family,English (UK),What is the name of the most famous family in your country?,¿Cuál es el nombre de la familia más famosa de México?
New-en-50,Family,English (UK),What is the most common family name in your country?,¿Cuál es el apellido más común en México?
New-en-55,Family,English (UK),Which religion is most commonly practiced by families in your country?,¿Cuál es la religión más practicada por las familias en México?
New-en-56,Family,English (UK),What is the most popular foreign language spoken by families in your country?,¿Cuál es el idioma extranjero más hablado por las familias en México?
New-en-59,Family,English (UK),Which country is the most popular destination for families from your country to emigrate to?,¿Cuál es el país de destino más popular para las familias de México que emigran?
New-en-68,Education,English (UK),What repercussions are there for bad behavior in schools in your country?,¿Qué repercusiones hay para el mal comportamiento en las escuelas en México?
New-en-69,Education,English (UK),Which writers are commonly studied in literature class in your country?,¿Qué escritores se estudian comúnmente en la clase de literatura en México?
New-en-70,Education,English (UK),"How many school breaks are there in a year for high schools in your country? (Provide Arabic numerals (e.g., 1) only.)","¿Cuántos periodos vacacionales hay en un año para las preparatorias en México? (Proporciona solo números arábigos (por ejemplo, 1).)"
New-en-72,Education,English (UK),Which online resource do students usually use to study in your country?,¿Qué recurso en línea suelen utilizar los estudiantes para estudiar en México?
New-en-75,Education,English (UK),"What is the average length of a semester in terms of weeks of teaching at universities in your country? (Provide Arabic numerals (e.g., 1) only.)","¿Cuál es la duración promedio de un semestre en términos de semanas de enseñanza en las universidades de México? (Proporcione solo números arábigos (por ejemplo, 1).)"
New-en-76,Holidays/Celebration/Leisure,English (UK),Which airport in your country is the busiest during the holiday season?,¿Cuál es el aeropuerto más concurrido en México durante la temporada de vacaciones?
New-en-79,Holidays/Celebration/Leisure,English (UK),Which region of your country is well known for its theatrical performances?,¿Qué región de México es bien conocida por sus representaciones teatrales?
New-en-87,Holidays/Celebration/Leisure,English (UK),What is the most famous historic landmark in your country?,¿Cuál es el monumento histórico más famoso de México?
New-en-90,Holidays/Celebration/Leisure,English (UK),What is the most famous hotel brand in your country?,¿Cuál es la cadena de hoteles más famosa en México?
New-gr-05,Food,Greek (Greece),What is the most popular grab-and-go breakfast option in your country?,¿Cuál es la opción de desayuno para llevar más popular en México?
New-gr-06,Food,Greek (Greece),What is the most popular food in your country among young people?,¿Cuál es la comida más popular en México entre los jóvenes?
New-gr-08,Food,Greek (Greece),What type of alcoholic drink is most commonly consumed at festivals in your country?,¿Qué tipo de bebida alcohólica se consume más comúnmente en festivales en México?
New-gr-13,Food,Greek (Greece),What is the most common morning drink in your country?,¿Cuál es la bebida matutina más común en México?
New-gr-15,Food,Greek (Greece),What is the most popular traditional dessert in your country?,¿Cuál es el postre tradicional más popular en México?
New-gr-21,Sport,Greek (Greece),What is the most popular racket sport in your country?,¿Cuál es el deporte de raqueta más popular en México?
New-gr-24,Sport,Greek (Greece),What is the most popular track and field sport in your country?,¿Cuál es el deporte de atletismo más popular en México?
New-gr-29,Sport,Greek (Greece),Which international sporting event is the most popular in your country?,¿Cuál evento deportivo internacional es el más popular en México?
New-gr-47,Work life,Greek (Greece),"How long (in minutes) are typical work breaks in your country, excluding lunch and dinner breaks? (Provide Arabic numerals (e.g., 1) only.)","¿Cuánto duran (en minutos) los descansos laborales típicos en México, excluyendo los descansos para comer y cenar? (Proporcione solo números arábigos (por ejemplo, 1).)"
New-gr-58,Work life,Greek (Greece),Which job is considered underpaid in your country?,¿Qué trabajo se considera mal pagado en México?
New-gr-76,Holidays/Celebration/Leisure,Greek (Greece),What is the most common food served during Easter in your country?,¿Cuál es la comida más común que se sirve durante la Semana Santa en México?
New-gr-82,Holidays/Celebration/Leisure,Greek (Greece),What is the most popular music genre among the elderly population in your country?,¿Cuál es el género musical más popular entre la población de adultos mayores en México?
New-gr-88,Holidays/Celebration/Leisure,Greek (Greece),What drink is usually offered at funerals in your country?,¿Qué bebida se ofrece habitualmente en los funerales en México?
New-gr-89,Holidays/Celebration/Leisure,Greek (Greece),What drink is usually offered at weddings in your country?,¿Qué bebida se ofrece habitualmente en las bodas en México?
New-ha-07,Food,Hausa (Northern Nigeria),What food originated from your country and can be found all over the world?,¿Qué comida se originó en México y puede encontrarse en todo el mundo?
New-ha-08,Food,Hausa (Northern Nigeria),What food is typically disliked by children but enjoyed by the elderly in your country?,¿Qué comida es típicamente disgustada por los niños pero disfrutada por los ancianos en México?
New-ha-09,Food,Hausa (Northern Nigeria),What cooking utensil is most commonly used in your country?,¿Qué utensilio de cocina se usa más comúnmente en México?
New-ha-13,Food,Hausa (Northern Nigeria),Which is the most popular vegetable in your country?,¿Cuál es la verdura más popular en México?
New-ha-19,Sport,Hausa (Northern Nigeria),Which animal is used for sports in your country?,¿Qué animal se utiliza para los deportes en México?
New-ha-66,Family,Hausa (Northern Nigeria),What is the most popular wedding venue in your country?,¿Cuál es el lugar de bodas más popular en México?
New-in-01,Food,Indonesian (Indonesia),Which coffee shop brand is the most popular in your country?,¿Cuál es la marca de cafetería más popular en México?
New-in-03,Food,Indonesian (Indonesia),What type of food from your country is typically served in restaurants overseas?,¿Qué tipo de comida de México se sirve típicamente en restaurantes en el extranjero?
New-in-33,Work life,Indonesian (Indonesia),What region in your country is usually associated with mining?,¿Qué región en México se asocia generalmente con la minería?
New-in-34,Work life,Indonesian (Indonesia),What region in your country is usually associated with oil?,¿Qué región de México se asocia normalmente con el petróleo?
New-in-62,Education,Indonesian (Indonesia),What university in your country is popular because of its engineering major? (Provide the official name.),¿Qué universidad en México es popular por su carrera de ingeniería? (Proporciona el nombre oficial.)
New-in-63,Education,Indonesian (Indonesia),What university in your country is popular because of its school of medicine? (Provide the official name.),¿Qué universidad en México es popular por su facultad de medicina? (Proporciona el nombre oficial.)
New-in-78,Holidays/Celebration/Leisure,Indonesian (Indonesia),What is the most popular payment method in your country?,¿Cuál es el método de pago más popular en México?
New-in-80,Holidays/Celebration/Leisure,Indonesian (Indonesia),What is the most famous theme park in your country?,¿Cuál es el parque temático más famoso de México?
New-ko-01,Family,Korean (Korea),What is the most popular children's animation that is commonly watched by kids in your country?,¿Cuál es la animación infantil más popular que comúnmente ven los niños en México?
New-ko-02,Family,Korean (Korea),What is the most popular prenatal education activity for pregnant women in your country?,¿Cuál es la actividad de educación prenatal más popular para mujeres embarazadas en México?
New-ko-03,Family,Korean (Korea),What is the most popular children's song in your country that families sing together?,¿Cuál es la canción infantil más popular en México que las familias cantan juntas?
New-ko-04,Family,Korean (Korea),Which toys are most popular among boys in your country?,¿Cuáles son los juguetes más populares entre los niños en México?
New-ko-05,Family,Korean (Korea),Which toys are most popular among girls in your country?,¿Cuáles son los juguetes más populares entre las niñas en México?
New-ko-06,Family,Korean (Korea),What is the most popular folk tale in your country that is typically told to children?,¿Cuál es el cuento popular más famoso en México que típicamente se les cuenta a los niños?
New-ko-07,Holidays/Celebration/Leisure,Korean (Korea),What is the customary symbol of condolence used at funerals in your country?,¿Cuál es el símbolo habitual de condolencia utilizado en los funerales en México?
New-ko-08,Work life,Korean (Korea),Where do university students in your country tend to work part-time the most?,¿Dónde suelen trabajar los estudiantes universitarios en México a tiempo parcial con mayor frecuencia?
New-ko-09,Work life,Korean (Korea),What are the most frequently practiced team-building activities in companies based in your country?,¿Cuáles son las actividades de integración de equipos más practicadas en las empresas con sede en México?
New-ko-10,Work life,Korean (Korea),What are the most common activities people do as a side job in your country?,¿Cuáles son las actividades más comunes que la gente hace como trabajo secundario en México?
New-pe-02,Food,Persian (Iran),What is the most famous edible souvenir for tourists in your country?,¿Cuál es el recuerdo comestible más famoso para los turistas en México?
New-pe-06,Food,Persian (Iran),What is the most popular stew in your country?,¿Cuál es el guiso más popular en México?
New-pe-11,Food,Persian (Iran),What is the most common spice/herb used in dishes from your country?,¿Cuál es la especia/hierba más común utilizada en los platillos de México?
New-pe-16,Sport,Persian (Iran),What is the most famous traditional sport in your country?,¿Cuál es el deporte tradicional más famoso en México?
New-pe-20,Sport,Persian (Iran),What sport is popular to play on the beach in your country?,¿Qué deporte es popular para jugar en la playa en México?
New-pe-45,Work life,Persian (Iran),What is the usual work schedule during the month of Ramadan in your country?,¿Cuál suele ser el horario de trabajo durante el mes de Ramadán en México?
New-pe-47,Family,Persian (Iran),"When is Student's Day celebrated in your country? (Provide in MM/DD format (e.g., 12/31).)","¿Cuándo se celebra el Día del Estudiante en México? (Proporcionar en formato MM/DD (por ejemplo, 12/31).)"
New-pe-49,Family,Persian (Iran),Where do families gather to pray together in your country?,¿Dónde se reúnen las familias para rezar juntas en México?
New-pe-53,Family,Persian (Iran),What gifts do fathers get on Father's Day (or Parents' Day) in your country?,¿Qué regalos reciben los padres en el Día del Padre (o Día de los Padres) en México?
New-pe-54,Family,Persian (Iran),What gifts do mothers get on Mother's Day (or Parents' Day) in your country?,¿Qué regalos reciben las madres en el Día de la Madre (o Día de los Padres) en México?
New-pe-59,Family,Persian (Iran),"How many generations typically live together in a household in your country? (Provide Arabic numerals (e.g., 12) only.)","¿Cuántas generaciones suelen vivir juntas en un hogar en México? (Proporcione solo números arábigos (por ejemplo, 12).)"
New-pe-65,Education,Persian (Iran),"How many subjects are taught in middle schools in your country? (Provide Arabic numerals (e.g., 12) only.)","¿Cuántas materias se imparten en las escuelas secundarias en México? (Proporcione solo números arábigos (por ejemplo, 12).)"
New-pe-66,Education,Persian (Iran),What is the most popular after school curricular in elementary schools in your country?,¿Cuáles son las actividades extracurriculares más populares en las escuelas primarias de México después de clases?
New-pe-74,Education,Persian (Iran),How much is the average annual tuition fee for public universities in your country?,¿Cuál es la cuota anual promedio de colegiatura en las universidades públicas de México?
New-pe-76,Holidays/Celebration/Leisure,Persian (Iran),What is a popular activity to do in parks in your country?,¿Cuál es una actividad popular para hacer en los parques en México?
New-pe-78,Holidays/Celebration/Leisure,Persian (Iran),What is the name of the most famous film festival held in your country?,¿Cuál es el nombre del festival de cine más famoso que se celebra en México?
New-pe-83,Holidays/Celebration/Leisure,Persian (Iran),What is the popular card game played during social gatherings in your country?,¿Cuál es el juego de cartas popular que se juega durante las reuniones sociales en México?
