ID,Topic,Source,Question,Translation
Al-en-01,Food,English (US),What is a common snack for preschool kids in your country?,¿Cuál es una merienda común para niños de preescolar en México?
Al-en-02,Food,English (US),What is a popular food to go with beer in your country?,¿Cuál es una comida popular para acompañar con cerveza en México?
Al-en-04,Food,English (US),What is the most popular fruit in your country?,¿Cuál es la fruta más popular en México?
Al-en-06,Food,English (US),What is a common school cafeteria food in your country?,¿Cuál es una comida común en las cafeterías escolares de México?
Al-en-08,Food,English (US),What are the most commonly eaten snacks at shopping malls in your country?,¿Cuáles son los bocadillos más comúnmente consumidos en los centros comerciales de México?
Al-en-09,Food,English (US),What is a popular snack at an amusement park in your country?,¿Cuál es una botana popular en un parque de diversiones en México?
Al-en-16,Education,English (US),"At what age do kids start preschool in your country? (Provide Arabic numerals (e.g., 12) only.)","¿A qué edad comienzan los niños el preescolar en México? (Proporcione solo números arábigos (por ejemplo, 3).)"
Al-en-17,Education,English (US),What is a popular afterschool sport for elementary schools in your country?,¿Cuál es un deporte extracurricular popular para la primaria en México?
Al-en-18,Education,English (US),For which subject do elementary students get private education in your country?,¿Para qué materia reciben educación privada los estudiantes de primaria en México?
Al-en-19,Education,English (US),What is a popular second language for high school students in your country?,¿Cuál es un segundo idioma popular para los estudiantes de preparatoria en México?
Al-en-21,Education,English (US),Which subject is the most important for gifted education in your country?,¿Cuál materia es la más importante para la educación de niños superdotados en México?
Al-en-32,Holidays/Celebration/Leisure,English (US),What is the main dish for Thanksgiving in your country?,¿Cuál es el platillo principal para el Día de Acción de Gracias en México?
Al-en-33,Holidays/Celebration/Leisure,English (US),What do people do to celebrate Halloween in your country?,¿Qué hacen las personas para celebrar Halloween en México?
Al-en-34,Holidays/Celebration/Leisure,English (US),What do people do to celebrate New Year's Day in your country?,¿Qué hacen las personas para celebrar el Año Nuevo en México?
Al-en-35,Holidays/Celebration/Leisure,English (US),What do people do to celebrate Christmas in your country?,¿Qué hacen las personas para celebrar la Navidad en México?
Al-en-36,Holidays/Celebration/Leisure,English (US),What food is associated with Halloween in your country?,¿Qué comida se asocia con Halloween en México?
Al-en-37,Holidays/Celebration/Leisure,English (US),What food is associated with Christmas in your country?,¿Qué comida se asocia con la Navidad en México?
Al-en-38,Holidays/Celebration/Leisure,English (US),What food is associated with Valentine's day in your country?,¿Qué comida se asocia con el día de San Valentín en México?
Al-en-39,Holidays/Celebration/Leisure,English (US),What do people eat on their birthday in your country?,¿Qué comen las personas en su cumpleaños en México?
Al-en-40,Holidays/Celebration/Leisure,English (US),What is a popular outdoor place for families to have fun with little kids in your country?,¿Cuál es un lugar al aire libre popular para que las familias se diviertan con niños pequeños en México?
Al-en-43,Holidays/Celebration/Leisure,English (US),What is a popular indoor activity for families in your country?,¿Cuál es una actividad popular de interior para las familias en México?
An-ar-02,Education,Arabic (Algeria),Where do university students have lunch in your country?,¿Dónde comen los estudiantes universitarios en México?
An-ar-03,Education,Arabic (Algeria),Which month is the final exam term usually scheduled at high schools in your country? (Provide Arabic numerals (1~12) only.),¿En qué mes se programa normalmente el periodo de exámenes finales en las preparatorias de México? (Proporciona solo números arábigos (1~12).)
An-ar-08,Education,Arabic (Algeria),"How many hours a day do students in your country usually spend at high school? (Provide Arabic numerals in integers (0~24), without any decimal points.)","¿Cuántas horas al día suelen pasar los estudiantes en la preparatoria en México? (Proporcione números arábigos en enteros (0~24), sin ningún punto decimal.)"
An-ar-09,Education,Arabic (Algeria),"How many languages do students study at high school in your country? (Provide Arabic numerals (e.g., 5) only.)","¿Cuántos idiomas estudian los estudiantes de preparatoria en México? (Proporciona solo números arábigos, por ejemplo, 5.)"
An-ar-34,Sport,Arabic (Algeria),What is the most popular sport played in a team at school in your country?,¿Cuál es el deporte de equipo más popular que se juega en las escuelas en México?
An-ar-35,Sport,Arabic (Algeria),Who is the most popular sport commentator in your country?,¿Quién es el comentarista deportivo más popular en México?
An-ar-36,Sport,Arabic (Algeria),What is the most popular sport team in your country?,¿Cuál es el equipo deportivo más popular en México?
An-ar-43,Sport,Arabic (Algeria),What are the common places or venues where individuals in your country usually gather to watch sports broadcasts?,¿Cuáles son los lugares comunes o establecimientos donde las personas en México suelen reunirse para ver transmisiones deportivas?
Ca-sp-05,Food,Spanish (Spain),"How many meals per day do people from your country usually have? (Provide Arabic numerals (e.g., 5) only.)","¿Cuántas comidas al día suelen tener las personas de México? (Proporciona solo números arábigos (por ejemplo, 5).)"
Ca-sp-06,Food,Spanish (Spain),Which is the most important meal of the day to people from your country?,¿Cuál es la comida más importante del día para la gente de México?
Ca-sp-08,Food,Spanish (Spain),What is the most common ingredient used in your country's diet?,¿Cuál es el ingrediente más común utilizado en la dieta mexicana?
Ca-sp-09,Food,Spanish (Spain),What do people from your country usually eat for dessert?,¿Qué suelen comer las personas de México de postre?
Ca-sp-11,Food,Spanish (Spain),Which day of the week do people usually organize a family meal in your country?,¿Qué día de la semana la gente suele organizar una comida familiar en México?
Ca-sp-14,Food,Spanish (Spain),Which is the most popular hot drink in your country?,¿Cuál es la bebida caliente más popular en México?
Ca-sp-19,Holidays/Celebration/Leisure,Spanish (Spain),What do young people from your country usually drink at the night club?,¿Qué suelen beber los jóvenes de México en el club nocturno?
Ca-sp-21,Holidays/Celebration/Leisure,Spanish (Spain),At which month do people usually take holidays in your country? (Provide Arabic numerals (1~12) only.),¿En qué mes la gente suele tomar vacaciones en México? (Proporcione solo números arábigos (1~12).)
Ca-sp-29,Holidays/Celebration/Leisure,Spanish (Spain),What tradition is there in your country for New Year's Eve?,¿Qué tradición existe en México para la Nochevieja?
Ca-sp-38,Family,Spanish (Spain),Which is the typical type of house for a family in your country?,¿Cuál es el tipo de casa típico para una familia en México?
Ca-sp-41,Family,Spanish (Spain),Where do the dependent elderly usually live in your country?,¿Dónde suelen vivir los ancianos dependientes en México?
Ca-sp-42,Family,Spanish (Spain),"How long (in weeks) is your country's maternity leave for mums? (Provide Arabic numerals (e.g., 20) only.)","¿Cuántas semanas dura la licencia de maternidad para las madres en México? (Proporciona solo números arábigos, por ejemplo, 20.)"
Ca-sp-43,Family,Spanish (Spain),"How long (in weeks) is your country's paternity leave for dads? (Provide Arabic numerals (e.g., 20) only.)","¿Cuánto dura (en semanas) la licencia de paternidad en México para los padres? (Proporciona solo números arábigos (por ejemplo, 20).)"
Ca-sp-45,Family,Spanish (Spain),What type of destination is commonly chosen for a family vacation in your country?,¿Qué tipo de destino se elige comúnmente para unas vacaciones familiares en México?
Gu-ch-05,Sport,Chinese (China),What sports do seniors like the most in your country?,¿Qué deportes prefieren los adultos mayores en México?
Gu-ch-06,Sport,Chinese (China),What sports do men like to play the most in your country?,¿Qué deportes les gusta jugar más a los hombres en México?
Gu-ch-07,Sport,Chinese (China),Who is the most famous basketball player in your country?,¿Quién es el jugador de baloncesto más famoso en México?
Gu-ch-08,Sport,Chinese (China),What is the most popular sports among children in your country?,¿Cuál es el deporte más popular entre los niños en México?
Gu-ch-09,Sport,Chinese (China),What sports do women like to play the most in your country?,¿Qué deportes les gusta jugar más a las mujeres en México?
Gu-ch-11,Sport,Chinese (China),What sports event has your country won the most gold medals at the Olympics?,¿En qué evento deportivo ha ganado México la mayor cantidad de medallas de oro en los Juegos Olímpicos?
Gu-ch-15,Sport,Chinese (China),What sports do male students in university like to play the most in your country?,¿Qué deportes prefieren jugar los estudiantes universitarios en México?
Gu-ch-16,Family,Chinese (China),"How many people are there in a family on average in your country? (Provide Arabic numerals (e.g., 12) only.)","¿Cuántas personas hay en una familia en promedio en México? (Proporciona solo números arábigos, por ejemplo, 12.)"
Gu-ch-18,Family,Chinese (China),"How many children do couples usually have in your country? (Provide Arabic numerals (e.g., 12) only.)","¿Cuántos hijos suelen tener las parejas en México? (Proporcione solo números arábigos (por ejemplo, 12).)"
Gu-ch-31,Education,Chinese (China),"What is the duration of elementary school in years in your country? (Provide Arabic numerals (e.g., 12) only.)","¿Cuál es la duración en años de la escuela primaria en México? (Proporcione solo números arábigos (por ejemplo, 12).)"
Gu-ch-32,Education,Chinese (China),"What is the duration of compulsory education in years in your country? (Provide Arabic numerals (e.g., 12) only.)","¿Cuál es la duración en años de la educación obligatoria en México? (Proporcione solo números arábigos (por ejemplo, 12).)"
Gu-ch-33,Education,Chinese (China),"From which age do students start learning their second language in your country? (Provide Arabic numerals (e.g., 12) only.)","¿A partir de qué edad los estudiantes comienzan a aprender su segundo idioma en México? (Proporciona solo números arábigos, por ejemplo, 12.)"
Gu-ch-38,Education,Chinese (China),"What is the duration of undergraduate education in your country? (Provide Arabic numerals (e.g., 12) only.)","¿Cuál es la duración de la educación universitaria en México? (Proporciona solo números arábigos (por ejemplo, 12).)"
Gu-ch-40,Education,Chinese (China),"What time do younger elementary school students finish school in your country? (Provide in HH:MM format (e.g., 18:00, 09:00).)","¿A qué hora salen de la escuela los alumnos más pequeños de primaria en México? (Proporcionar en formato HH:MM (por ejemplo, 18:00, 09:00).)"
Gu-ch-41,Education,Chinese (China),"How many musical instruments do elementary school students in your country typically play? (Provide Arabic numerals (e.g., 12) only.)","¿Cuántos instrumentos musicales suelen tocar los estudiantes de primaria en México? (Proporciona solo números arábigos, por ejemplo, 12.)"
Ji-ko-02,Work life,Korean (South Korea),What day of the week do people in your country prefer to have company dinners?,¿Qué día de la semana prefieren las personas en México para tener cenas de empresa?
Ji-ko-03,Work life,Korean (South Korea),Which region/city has the highest number of financial companies in your country?,¿Qué región/ciudad tiene el mayor número de empresas financieras en México?
Ji-ko-07,Work life,Korean (South Korea),What is the most famous private company in your country?,¿Cuál es la empresa privada más famosa de México?
Ji-ko-08,Work life,Korean (South Korea),"What is the maximum number of hours one can work per week in your country? (Provide Arabic numerals (e.g., 12) only.)","¿Cuál es el número máximo de horas que se pueden trabajar por semana en México? (Proporciona solo números arábigos (por ejemplo, 12).)"
Ji-ko-09,Work life,Korean (South Korea),What do people typically eat during company get-together in your country?,¿Qué suelen comer las personas durante una reunión de empresa en México?
Ji-ko-14,Work life,Korean (South Korea),What is the representative export item of your country?,¿Cuál es el artículo de exportación representativo de México?
Ji-ko-15,Work life,Korean (South Korea),"How long (in hours) is the typical lunch break in your country? (Provide Arabic numerals up to one decimal point (e.g., 2, 3.5) only.)","¿Cuánto dura (en horas) el descanso para comer típico en México? (Proporcione solo números arábigos hasta un punto decimal (por ejemplo, 2, 3.5).)"
Ji-ko-16,Family,Korean (South Korea),Where do mothers stay for a certain period after childbirth for recovery in your country?,¿Dónde se quedan las madres por un cierto período después del parto para recuperarse en México?
Ji-ko-19,Family,Korean (South Korea),What is your country's most commonly given flower on Parents' Day?,¿Cuál es la flor que más se regala en México en el Día de los Padres?
Ji-ko-22,Family,Korean (South Korea),What do people especially spend their first salary on in your country's society?,¿En qué gastan especialmente las personas su primer salario en la sociedad mexicana?
Ji-ko-24,Family,Korean (South Korea),What is the most preferred recreational facility among children in your country?,¿Cuál es la instalación recreativa preferida por los niños en México?
Ji-ko-25,Family,Korean (South Korea),What are the family-related holidays in your country?,¿Cuáles son las festividades relacionadas con la familia en México?
Ji-ko-26,Family,Korean (South Korea),What are the key milestones associated with children's independence from their parents in your country's society?,¿Cuáles son los hitos clave asociados con la independencia de los hijos de sus padres en la sociedad mexicana?
Ji-ko-27,Family,Korean (South Korea),What is the common gift you give when visiting elderly parents in your country?,¿Cuál es el regalo común que das cuando visitas a los padres ancianos en México?
Ji-ko-28,Family,Korean (South Korea),When is the first day that people celebrate after a child is born in your country?,¿Cuál es el primer día que la gente celebra después de que nace un niño en México?
Ji-ko-29,Family,Korean (South Korea),Which age's birthday is celebrated the most grandly in your country's society?,¿Qué cumpleaños se celebra con mayor pompa en la sociedad mexicana?
Ji-ko-31,Education,Korean (South Korea),Where do middle and high school students in your country usually study for exams?,¿Dónde suelen estudiar para los exámenes los estudiantes de secundaria y preparatoria en México?
Ji-ko-33,Education,Korean (South Korea),Where do high school students in your country usually go after dinner?,¿A dónde suelen ir los estudiantes de preparatoria en México después de cenar?
Ji-ko-34,Education,Korean (South Korea),How do elementary school students in your country go to school?,¿Cómo van a la escuela los estudiantes de primaria en México?
Ji-ko-35,Education,Korean (South Korea),What is the most common form of private education in your country?,¿Cuál es la forma más común de educación privada en México?
Ji-ko-36,Education,Korean (South Korea),Which subject’s academy/private educational institute do middle or high students most frequently attend in your country?,¿A qué academia de estudio/instituto educativo privado asisten con más frecuencia los estudiantes de secundaria o preparatoria en México?
Ji-ko-37,Education,Korean (South Korea),What type of clothing do middle and high school students wear to school in your country?,¿Qué tipo de ropa usan los estudiantes de secundaria y preparatoria para ir a la escuela en México?
Ji-ko-38,Education,Korean (South Korea),Which major is considered the most difficult to gain admission to in your country?,¿Qué carrera se considera la más difícil para ingresar en México?
Ji-ko-39,Education,Korean (South Korea),What is the most commonly learned musical instrument by elementary school students in your country?,¿Cuál es el instrumento musical más comúnmente aprendido por los estudiantes de primaria en México?
Ji-ko-40,Education,Korean (South Korea),What do high school students typically do during break time in schools in your country?,¿Qué suelen hacer los estudiantes de preparatoria durante el recreo en las escuelas de México?
Ji-ko-41,Education,Korean (South Korea),What kind of shoes do students wear in schools in your country?,¿Qué tipo de zapatos usan los estudiantes en las escuelas en México?
Ji-ko-42,Education,Korean (South Korea),What are the required subjects in your country's university entrance exam?,¿Cuáles son las materias requeridas en el examen de ingreso a la universidad en México?
Ji-ko-44,Education,Korean (South Korea),Which region (within a city) in your country has the highest academic fervor?,¿Qué región (dentro de una ciudad) en México tiene el mayor fervor académico?
Ji-ko-45,Education,Korean (South Korea),What do people look forward to the most at university festivals in your country?,¿Qué es lo que más esperan las personas de los festivales universitarios en México?
Jo-sp-01,Sport,Spanish (Spain),What is the second most popular sport in your country?,¿Cuál es el segundo deporte más popular en México?
Jo-sp-02,Sport,Spanish (Spain),What is the most popular sport played without a ball in your country?,¿Cuál es el deporte más popular jugado sin una pelota en México?
Jo-sp-09,Sport,Spanish (Spain),What sports are most associated with the upper class in your country?,¿Qué deportes están más asociados con la clase alta en México?
Jo-sp-13,Sport,Spanish (Spain),What is the most popular water sport in your country?,¿Cuál es el deporte acuático más popular en México?
Jo-sp-14,Sport,Spanish (Spain),What is the most popular mental sport in your country?,¿Cuál es el deporte mental más popular en México?
Jo-sp-18,Work life,Spanish (Spain),"How many holiday days per year does a standard worker gets in your country? (Provide Arabic numerals (e.g., 12) only.)","¿Cuántos días de vacaciones por año recibe un trabajador estándar en México? (Proporcione solo números arábigos (por ejemplo, 12).)"
Jo-sp-19,Work life,Spanish (Spain),What region in your country has been traditionally associated with agriculture?,¿Qué región de México ha estado tradicionalmente asociada con la agricultura?
Jo-sp-21,Work life,Spanish (Spain),"What time, if any, do people usually leave work for lunch in your country? (Provide in HH:MM format (e.g., 18:00, 09:00).)","¿A qué hora, si es que la hay, la gente suele salir del trabajo para ir a comer en México? (Proporcionar en formato HH:MM (por ejemplo, 18:00, 09:00).)"
Jo-sp-31,Education,Spanish (Spain),"What time do high school students tend to leave school in your country? (Provide in HH:MM format (e.g., 18:00, 09:00).)","¿A qué hora suelen salir los estudiantes de preparatoria de la escuela en México? (Proporcionar en formato HH:MM, por ejemplo, 18:00, 09:00)."
Jo-sp-32,Education,Spanish (Spain),What sport do elementary school students tend to practice at school in your country?,¿Qué deporte suelen practicar los alumnos de primaria en las escuelas de México?
Jo-sp-36,Education,Spanish (Spain),"How long (in weeks) are summer vacations at elementary schools in your country? (Provide in Arabic numerals (e.g., 7, 8) only.)","¿Cuántas semanas duran las vacaciones de verano en las escuelas primarias de México? (Proporcionar solo en números arábigos (por ejemplo, 7, 8).)"
Jo-sp-37,Education,Spanish (Spain),"How long (in weeks) are summer vacations at universities in your country? (Provide in Arabic numerals (e.g., 7, 8) only.)","¿Cuántas semanas duran las vacaciones de verano en las universidades de México? (Proporcionar solo en números arábigos (por ejemplo, 7, 8).)"
Jo-sp-39,Education,Spanish (Spain),"At what age does elementary education begin in your country? (Provide in Arabic numerals (e.g., 7, 8) only.)","¿A qué edad comienza la educación primaria en México? (Proporcionar solo en números arábigos (por ejemplo, 7, 8).)"
Jo-sp-43,Education,Spanish (Spain),"How many languages are studied in elementary education besides your country's official language? (Provide in Arabic numerals (e.g., 7, 8) only.)","¿Cuántos idiomas se estudian en la educación primaria además del idioma oficial de México? (Proporcionar solo en números arábigos, por ejemplo, 7, 8.)"
Jod-ch-01,Food,Chinese (China),What eating utensils do people commonly used in your country?,¿Qué utensilios de comida se usan comúnmente en México?
Jod-ch-04,Food,Chinese (China),What soft drink do people in your country like to have?,¿Qué bebida sin alcohol les gusta tomar a las personas en México?
Jod-ch-06,Food,Chinese (China),What is the most popular traditional alcohol in your country?,¿Cuál es el alcohol tradicional más popular en México?
Jod-ch-07,Food,Chinese (China),"How long (in hours) on average does it take for people in your country to have dinner at a restaurant? (Provide Arabic numerals up to one decimal point (e.g., 2, 3.5) only.)","¿Cuánto tiempo (en horas) en promedio tardan las personas en México en cenar en un restaurante? (Proporcione solo números arábigos hasta un punto decimal (por ejemplo, 2, 3.5).)"
Jod-ch-09,Food,Chinese (China),"What time do people usually have dinner in your country? (Provide in HH:MM format (e.g., 18:00, 09:00).)","¿A qué hora suelen cenar las personas en México? (Proporcionar en formato HH:MM (por ejemplo, 18:00, 09:00).)"
Jod-ch-12,Food,Chinese (China),What kind of soup do people from your country like to have?,¿Qué tipo de sopa les gusta tomar a las personas de México?
Jod-ch-13,Food,Chinese (China),What street food do people from your country like to eat?,¿Qué comida callejera les gusta comer a las personas de México?
Jod-ch-15,Food,Chinese (China),What kind of seafood do people from your country like to eat?,¿Qué tipo de mariscos les gusta comer a las personas de México?
Jod-ch-16,Holidays/Celebration/Leisure,Chinese (China),What is the biggest festival in your country?,¿Cuál es el festival más grande de México?
Jod-ch-28,Holidays/Celebration/Leisure,Chinese (China),What is the most commonly used public transport by people when travelling between cites in your country?,¿Cuál es el transporte público más utilizado por las personas al viajar entre ciudades en México?
Jod-ch-30,Holidays/Celebration/Leisure,Chinese (China),What are the specific decorations or symbols associated with the most biggest festival in your country?,¿Cuáles son las decoraciones o símbolos específicos asociados con el festival más grande de México?
Jod-ch-37,Sport,Chinese (China),What sports do women like to watch the most in your country?,¿Qué deportes les gusta ver más a las mujeres en México?
Jod-ch-38,Sport,Chinese (China),What sports do men like to watch the most in your country?,¿Qué deportes les gusta ver más a los hombres en México?
Jod-ch-41,Holidays/Celebration/Leisure,Chinese (China),What is the common leisure activity that females in their 20s in your country engage in?,¿Cuál es la actividad de ocio común en la que participan las mujeres de 20 años en México?
Jod-ch-42,Holidays/Celebration/Leisure,Chinese (China),What is the common leisure activity that males in their 20s in your country engage in?,¿Cuál es la actividad de ocio común en la que participan los hombres en sus 20s en México?
Jod-ch-46,Work life,Chinese (China),"How long (in hours) do people usually take a break after lunch on a weekday in your country? (Provide Arabic numerals up to one decimal point (e.g., 2, 3.5) only.)","¿Cuánto tiempo (en horas) suele tomar la gente una pausa después de comer durante un día entre semana en México? (Proporcione solo números arábigos hasta un punto decimal (por ejemplo, 2, 3.5).)"
Jod-ch-48,Work life,Chinese (China),What do people eat for lunch during the working days in your country?,¿Qué comen las personas para el almuerzo durante los días laborales en México?
Jod-ch-50,Work life,Chinese (China),"What is the average commute time (in minutes) for people in your country? (Provide Arabic numerals (e.g., 1) only.)","¿Cuál es el tiempo promedio de traslado (en minutos) para las personas en México? (Proporcione solo números arábigos, por ejemplo, 1.)"
Jod-ch-51,Work life,Chinese (China),What is the most common transportation that people take to get to work in your country?,¿Cuál es el medio de transporte más común que la gente utiliza para ir al trabajo en México?
Jod-ch-54,Work life,Chinese (China),"How long (in days) is the marriage leave in your country? (Provide Arabic numerals (e.g., 12) only.)","¿Cuántos días dura la licencia por matrimonio en México? (Proporciona solo números arábigos, por ejemplo, 12.)"
