ID,Topic,Source,Question,Translation
Jod-ch-56,Work life,Chinese (China),"What is the typical retirement age for women in your country? (Provide Arabic numerals (e.g., 12) only.)","¿Cuál es la edad típica de jubilación para las mujeres en México? (Proporcione solo números arábigos (por ejemplo, 12).)"
Jod-ch-57,Work life,Chinese (China),"What is the typical retirement age for men in your country? (Provide Arabic numerals (e.g., 12) only.)","¿Cuál es la edad típica de jubilación para los hombres en México? (Proporcione solo números arábigos (por ejemplo, 12).)"
Jod-ch-58,Work life,Chinese (China),Which profession is the most respected in your country?,¿Cuál es la profesión más respetada en México?
Jod-ch-60,Work life,Chinese (China),What is the duration (in hours) of a typical workday in your country? (Provide Arabic numerals (0~24) only.),¿Cuál es la duración (en horas) de un día laboral típico en México? (Proporcione únicamente números arábigos (0~24).)
Jod-ch-61,Work life,Chinese (China),Which occupation is most preferred among females in your country?,¿Cuál es la ocupación más preferida entre las mujeres en México?
Jod-ch-62,Work life,Chinese (China),Which occupation is most preferred among males in your country?,¿Cuál es la ocupación más preferida entre los hombres en México?
Ki-pe-17,Education,Persian (Iran),"On average, how far do students typically pursue their education in your country? (e.g., elementary, high school)","En promedio, ¿hasta qué nivel suelen estudiar los estudiantes en México? (por ejemplo, primaria, secundaria)"
Ki-pe-24,Education,Persian (Iran),What language is taught in schools in your country besides English?,¿Qué idioma se enseña en las escuelas de México además del inglés?
Ki-pe-30,Education,Persian (Iran),What days of the week are schools closed in your country?,¿Qué días de la semana están cerradas las escuelas en México?
Ki-pe-32,Food,Persian (Iran),What food do the hosts usually prepare for the guests in your country?,¿Qué comida suelen preparar los anfitriones para los invitados en México?
Ki-pe-34,Food,Persian (Iran),What is the usual drink in the breakfast in your country?,¿Cuál es la bebida habitual en el desayuno en México?
Ki-pe-36,Food,Persian (Iran),"Except the food original from your country, which country's food is more popular in your country?","Exceptuando la comida originaria de México, ¿qué comida de qué país es más popular en México?"
Ki-pe-39,Food,Persian (Iran),What food is usually prepared for a family picnic in your country?,¿Qué comida se suele preparar para un picnic familiar en México?
Ki-pe-40,Food,Persian (Iran),Which food from your country is considered disgusting by the rest of the world?,¿Qué comida de México es considerada asquerosa por el resto del mundo?
Ki-pe-43,Food,Persian (Iran),What is the name of the popular bread in your country?,¿Cuál es el nombre del pan popular en México?
Ki-pe-51,Work life,Persian (Iran),"What time of day are government offices closed in your country? (Provide in HH:MM format (e.g., 18:00, 09:00).)","¿A qué hora cierran las oficinas de gobierno en México? (Proporcionar en formato HH:MM (por ejemplo, 18:00, 09:00).)"
Ki-pe-53,Work life,Persian (Iran),"What is the normal start time of government offices in your country? (Provide in HH:MM format (e.g., 18:00, 09:00).)","¿Cuál es el horario de inicio habitual de las oficinas gubernamentales en México? (Proporcionar en formato HH:MM, por ejemplo, 18:00, 09:00)."
Kik-in-01,Holidays/Celebration/Leisure,Indonesian (Indonesia),What national holiday has the longest duration in your country?,¿Qué día festivo nacional tiene la mayor duración en México?
Kik-in-02,Holidays/Celebration/Leisure,Indonesian (Indonesia),What are the common activities people from your country do to celebrate Independence day?,¿Cuáles son las actividades comunes que la gente de México realiza para celebrar el Día de la Independencia?
Kik-in-04,Holidays/Celebration/Leisure,Indonesian (Indonesia),What is installed in front of the house when a family member dies in your country?,¿Qué se instala enfrente de la casa cuando muere un miembro de la familia en México?
Kik-in-05,Holidays/Celebration/Leisure,Indonesian (Indonesia),When is a pregnancy celebration or ceremony usually held in your country?,¿Cuándo se suele realizar una celebración o ceremonia de embarazo en México?
Kik-in-06,Holidays/Celebration/Leisure,Indonesian (Indonesia),What event is usually held before a wedding in your country?,¿Qué evento se suele realizar antes de una boda en México?
Kik-in-07,Holidays/Celebration/Leisure,Indonesian (Indonesia),What is usually shared to the children during (Lunar) New Year in your country?,¿Qué se suele compartir con los niños durante el Año Nuevo (Lunar) en México?
Kik-in-08,Holidays/Celebration/Leisure,Indonesian (Indonesia),What activities are usually done days before Ramadan in your country?,¿Qué actividades se suelen realizar días antes del Ramadán en México?
Kik-in-10,Holidays/Celebration/Leisure,Indonesian (Indonesia),What is the most popular tourist attraction for foreign visitors in your country?,¿Cuál es la atracción turística más popular para los visitantes extranjeros en México?
Kik-in-11,Holidays/Celebration/Leisure,Indonesian (Indonesia),"What is the most popular religious sites (temple, church, etc.) for tourism in your country?","¿Cuáles son los sitios religiosos (templo, iglesia, etc.) más populares para el turismo en México?"
Kik-in-15,Holidays/Celebration/Leisure,Indonesian (Indonesia),What clothes do women usually wear on graduation commencement ceremony in your country?,¿Qué ropa suelen usar las mujeres en la ceremonia de graduación en México?
Kik-in-16,Food,Indonesian (Indonesia),What drink is commonly consumed in your country when the weather is cold?,¿Qué bebida se consume comúnmente en México cuando el clima está frío?
Kik-in-17,Food,Indonesian (Indonesia),What fruit is more commonly sold and found during Ramadan in your country?,¿Qué fruta se vende y se encuentra más comúnmente durante el Ramadán en México?
Kik-in-24,Food,Indonesian (Indonesia),What carbohydrate is usually served with chicken in a fast-food restaurant in your country?,¿Qué carbohidrato se sirve usualmente con pollo en un restaurante de comida rápida en México?
Kik-in-31,Sport,Indonesian (Indonesia),What is the most famous martial art sports in your country?,¿Cuál es el deporte de artes marciales más famoso en México?
Kik-in-34,Sport,Indonesian (Indonesia),What sports are often broadcasted on national television in your country?,¿Qué deportes se transmiten frecuentemente en la televisión nacional en México?
Kik-in-35,Sport,Indonesian (Indonesia),What sports were popular among people from your country during the COVID-19 pandemic?,¿Qué deportes fueron populares entre la gente de México durante la pandemia de COVID-19?
Kik-in-36,Sport,Indonesian (Indonesia),Who is the most popular soccer coach in your country?,¿Quién es el entrenador de fútbol más popular en México?
Kik-in-37,Sport,Indonesian (Indonesia),What soccer teams in your country are famous for their intense rivalry? (e.g. ___ vs ___),¿Qué equipos de fútbol en México son famosos por su intensa rivalidad? (p. ej. ___ vs ___)
Kik-in-38,Sport,Indonesian (Indonesia),What are the names of soccer supporters in your country who are famous for their intense rivalry? (e.g. ___ vs ___),¿Cuáles son los nombres de los aficionados al fútbol en México que son famosos por su intensa rivalidad? (p. ej. ___ vs ___)
Kik-in-40,Sport,Indonesian (Indonesia),Who is the most famous male badminton player in your country?,¿Quién es el jugador de bádminton masculino más famoso en México?
Kik-in-41,Sport,Indonesian (Indonesia),Who is the most famous female badminton player in your country?,¿Quién es la jugadora de bádminton femenino más famosa en México?
Kik-in-44,Sport,Indonesian (Indonesia),What sport gets the most support from the government in your country?,¿Qué deporte recibe más apoyo del gobierno en México?
Kik-in-45,Sport,Indonesian (Indonesia),What sports field facilities are usually available at schools in your country?,¿Qué instalaciones de campos deportivos suelen estar disponibles en las escuelas de México?
Na-ko-02,Food,Korean (South Korea),What cafe beverage do people from your country most commonly enjoy?,¿Qué bebida de café disfrutan más comúnmente las personas de México?
Na-ko-04,Food,Korean (South Korea),What is the preferred hangover cure food for people from your country?,¿Cuál es la comida preferida para curar la cruda de las personas en México?
Na-ko-05,Food,Korean (South Korea),What is the typical delivery food in your country?,¿Cuál es la comida típica a domicilio en México?
Na-ko-07,Food,Korean (South Korea),What type of meat is consumed most by people from your country?,¿Qué tipo de carne es la más consumida por la gente de México?
Na-ko-08,Food,Korean (South Korea),What fruit do people from your country often eat in the autumn season?,¿Qué fruta comen comúnmente las personas en México durante la temporada de otoño?
Na-ko-09,Food,Korean (South Korea),What side dish is the most commonly served on a dining table in your country?,¿Qué guarnición se sirve más comúnmente en una mesa de comedor en México?
Na-ko-11,Food,Korean (South Korea),What do people from your country eat while watching a soccer game?,¿Qué comen las personas de México mientras ven un partido de fútbol?
Na-ko-15,Food,Korean (South Korea),What is the representative nourishing food in your country?,¿Cuál es el alimento nutritivo representativo en México?
Na-ko-16,Sport,Korean (South Korea),Who is the most famous soccer player in your country?,¿Quién es el futbolista más famoso de México?
Na-ko-17,Sport,Korean (South Korea),What sports do male students enjoy during lunch time at school in your country?,¿Qué deportes disfrutan los estudiantes varones durante la hora del almuerzo en la escuela en México?
Na-ko-18,Sport,Korean (South Korea),What is the most common sport girls participate in during physical education classes in your country?,¿Cuál es el deporte más común en el que participan las niñas durante las clases de educación física en México?
Na-ko-19,Sport,Korean (South Korea),Who is the most popular volleyball player in your country?,¿Quién es el jugador de voleibol más popular en México?
Na-ko-20,Sport,Korean (South Korea),What sports event do people from your country passionately support the most in international competitions?,¿Qué evento deportivo apoyan con más pasión las personas de México en las competiciones internacionales?
Na-ko-22,Sport,Korean (South Korea),Which country is considered the biggest rival in soccer matches for your country?,¿Qué país se considera el mayor rival en partidos de fútbol para México?
Na-ko-23,Sport,Korean (South Korea),What type of sports academies do children attend the most in your country?,¿A qué tipo de academias deportivas asisten más los niños en México?
Na-ko-24,Sport,Korean (South Korea),What is the most commonly eaten food in sports stadiums while watching games in your country?,¿Cuál es la comida más consumida en los estadios deportivos mientras se ven partidos en México?
Na-ko-25,Sport,Korean (South Korea),What are the typical sports played in your country's school sports day?,¿Cuáles son los deportes típicos que se juegan en el día del deporte escolar en México?
Na-ko-26,Sport,Korean (South Korea),What are the popular sports among the middle-aged population in your country?,¿Cuáles son los deportes populares entre la población de mediana edad en México?
Na-ko-28,Sport,Korean (South Korea),Who is the most popular winter sports player in your country?,¿Quién es el deportista de deportes de invierno más popular en México?
Na-ko-29,Sport,Korean (South Korea),Who is the most famous swimmer in your country?,¿Quién es el nadador más famoso de México?
Na-ko-30,Sport,Korean (South Korea),What is the most popular e-sports game in your country?,¿Cuál es el juego de e-sports más popular en México?
Na-ko-33,Holidays/Celebration/Leisure,Korean (South Korea),What symbolic food do people from your country eat on (Lunar) New Year?,¿Qué comida simbólica comen las personas de México en el Año Nuevo (Lunar)?
Na-ko-37,Holidays/Celebration/Leisure,Korean (South Korea),What is the most popular domestic vacation spot for people from your country?,¿Cuál es el destino turístico nacional más popular entre la gente de México?
Na-ko-38,Holidays/Celebration/Leisure,Korean (South Korea),What is the most common wedding gift between bride and groom in your country?,¿Cuál es el regalo de boda más común entre novios en México?
Na-ko-39,Holidays/Celebration/Leisure,Korean (South Korea),What is typically given as a congratulatory gesture when attending a friend's wedding in your country?,¿Qué se suele dar como gesto de felicitación al asistir a la boda de un amigo en México?
Na-ko-40,Holidays/Celebration/Leisure,Korean (South Korea),"How long (in days) does a funeral typically last in your country? (Provide Arabic numerals (e.g., 12) only.)","¿Cuánto tiempo (en días) dura típicamente un funeral en México? (Proporcione solo números arábigos (por ejemplo, 12).)"
Na-ko-41,Holidays/Celebration/Leisure,Korean (South Korea),What should you prepare as a condolence offering when attending a funeral in your country?,¿Qué deberías preparar como ofrenda de condolencia al asistir a un funeral en México?
Na-ko-42,Holidays/Celebration/Leisure,Korean (South Korea),What type of food is commonly provided at funeral parlors in your country?,¿Qué tipo de comida se ofrece comúnmente en las funerarias en México?
Na-ko-43,Holidays/Celebration/Leisure,Korean (South Korea),What do people do in your country in the morning of the (Lunar) New Year?,¿Qué hacen las personas en México en la mañana del Año Nuevo (Lunar)?
Na-ko-44,Holidays/Celebration/Leisure,Korean (South Korea),When is the day with your country's most severe nationwide traffic congestion?,¿Cuándo es el día con la congestión de tráfico más severa a nivel nacional en México?
Na-ko-45,Holidays/Celebration/Leisure,Korean (South Korea),What is the most popular honeymoon destination in your country?,¿Cuál es el destino de luna de miel más popular en México?
Ne-ar-05,Holidays/Celebration/Leisure,Arabic (Algeria),What is the most important national holiday in your country?,¿Cuál es la fiesta nacional más importante en México?
Ne-ar-06,Holidays/Celebration/Leisure,Arabic (Algeria),What do people from your country eat in Ramadan?,¿Qué comen las personas de México en Ramadán?
Ne-ar-09,Holidays/Celebration/Leisure,Arabic (Algeria),What do people from your country eat in Eid ul Fitr?,¿Qué comen las personas de México en Eid ul Fitr?
Ne-ar-10,Holidays/Celebration/Leisure,Arabic (Algeria),What do people from your country eat in Eid ul Adha?,¿Qué comen las personas de México en Eid ul Adha?
Ne-ar-11,Holidays/Celebration/Leisure,Arabic (Algeria),Where do people from your country go to celebrate New Year's Day?,¿A dónde va la gente de México para celebrar el Año Nuevo?
Ne-ar-14,Holidays/Celebration/Leisure,Arabic (Algeria),Where do a family gather for Eid festivities in your country?,¿Dónde se reúne una familia para las festividades de Eid en México?
Ne-ar-16,Work life,Arabic (Algeria),"When is the weekend in your country (e.g. Monday, Tuesday)?","¿Cuándo es el fin de semana en México (por ejemplo, lunes, martes)?"
Ne-ar-17,Work life,Arabic (Algeria),"At what time do most people start work in your country? (Provide in HH:MM format (e.g., 18:00, 09:00).)","¿A qué hora comienza la mayoría de la gente a trabajar en México? (Proporcionar en formato HH:MM, por ejemplo, 18:00, 09:00)."
Ne-ar-18,Work life,Arabic (Algeria),"At what time do most people finish work in your country? (Provide in HH:MM format (e.g., 18:00, 09:00).)","¿A qué hora termina la mayoría de la gente de trabajar en México? (Proporcionar en formato HH:MM (por ejemplo, 18:00, 09:00).)"
Ne-ar-20,Work life,Arabic (Algeria),What is considered to be a secure job in your country?,¿Qué se considera un empleo seguro en México?
Ne-ar-24,Work life,Arabic (Algeria),Which city is the primary commercial hub in your country?,¿Cuál ciudad es el principal centro comercial en México?
Ne-ar-25,Work life,Arabic (Algeria),What is the industry that pays the best in your country?,¿Cuál es la industria que mejor paga en México?
Ne-ar-26,Work life,Arabic (Algeria),What is the most famous public corporation in your country?,¿Cuál es la corporación pública más famosa de México?
Ne-ar-31,Food,Arabic (Algeria),What is the most famous dish in your country?,¿Cuál es el platillo más famoso de México?
Ne-ar-32,Food,Arabic (Algeria),What do people usually have for breakfast in your country?,¿Qué suelen desayunar las personas en México?
Ne-ar-33,Food,Arabic (Algeria),"When do people usually have lunch in your country? (Provide in HH:MM format (e.g., 18:00, 09:00).)","¿A qué hora suelen almorzar las personas en México? (Proporcionar en formato HH:MM (por ejemplo, 18:00, 09:00).)"
Ne-ar-34,Food,Arabic (Algeria),What is typically indispensable in meals in your country?,¿Qué es típicamente indispensable en las comidas en México?
Ne-ar-36,Food,Arabic (Algeria),What is a typical festive meal in your country?,¿Cuál es una comida festiva típica en México?
Ne-ar-37,Food,Arabic (Algeria),Which fruit do people usually offer tourists/visitors from abroad in your country?,¿Qué fruta suelen ofrecer a los turistas/visitantes del extranjero en México?
Ne-ar-38,Food,Arabic (Algeria),Which food do people usually offer as charity in your country?,¿Qué comida suelen ofrecer como caridad las personas en México?
Ne-ar-39,Food,Arabic (Algeria),What is the cheapest fast food in your country?,¿Cuál es la comida rápida más barata en México?
Ne-ar-43,Food,Arabic (Algeria),What do people usually have with tea in your country?,¿Qué suelen tomar las personas con té en México?
Ne-ar-44,Food,Arabic (Algeria),What do people have with coffee in your country?,¿Qué acompaña la gente con el café en México?
New-am-02,Food,Amharic (Ethiopia),What is the most popular traditional food in your country?,¿Cuál es la comida tradicional más popular en México?
New-am-04,Food,Amharic (Ethiopia),What is the most popular dipping sauce in your country?,¿Cuál es la salsa para untar más popular en México?
New-am-08,Food,Amharic (Ethiopia),What food is most often consumed during Christian fasting in your country?,¿Cuál es la comida más consumida durante el ayuno cristiano en México?
New-am-15,Food,Amharic (Ethiopia),What food is usually prepared when mothers give birth in your country?,¿Qué comida se prepara habitualmente cuando las madres dan a luz en México?
New-am-27,Sport,Amharic (Ethiopia),Who is the most popular female sportperson in your country?,¿Quién es la deportista femenina más popular en México?
New-am-34,Education,Amharic (Ethiopia),Where do most elementary school students prepare for their exams in your country?,¿Dónde se preparan la mayoría de los estudiantes de primaria para sus exámenes en México?
New-am-41,Education,Amharic (Ethiopia),"In your country, at which grade level do students take their first national-level examination?",¿En qué grado escolar los estudiantes en México presentan su primer examen a nivel nacional?
New-am-53,Work life,Amharic (Ethiopia),Which region in your country is widely known for its coffee/tea industry?,¿Qué región de México es ampliamente conocida por su industria del café/té?
New-am-54,Work life,Amharic (Ethiopia),Which region in your country is widely known for its livestock industry?,¿Qué región de México es ampliamente conocida por su industria ganadera?
New-am-59,Work life,Amharic (Ethiopia),What is the main occupation of people living in deserts in your country?,¿Cuál es la principal ocupación de las personas que viven en los desiertos de México?
New-am-60,Work life,Amharic (Ethiopia),Which animal is typically used for transportation in your country?,¿Qué animal se utiliza típicamente para el transporte en México?
New-am-72,Family,Amharic (Ethiopia),What is the most popular comic book for children to read in your country?,¿Cuál es el cómic más popular para niños en México?
New-am-73,Family,Amharic (Ethiopia),What is the most popular YouTube channel for children in your country?,¿Cuál es el canal de YouTube más popular para niños en México?
New-am-74,Family,Amharic (Ethiopia),What is the most popular talk show in your country?,¿Cuál es el programa de entrevistas más popular en México?
New-am-77,Holidays/Celebration/Leisure,Amharic (Ethiopia),What is the most famous religious holiday in your country?,¿Cuál es la festividad religiosa más famosa en México?
New-am-81,Holidays/Celebration/Leisure,Amharic (Ethiopia),"What is the busiest month for weddings in your country? (Provide Arabic numerals (e.g., 1) only.)","¿Cuál es el mes más ocupado para bodas en México? (Proporciona solo números arábigos (por ejemplo, 1).)"
New-am-83,Holidays/Celebration/Leisure,Amharic (Ethiopia),What is the most popular traditional musical instrument in your country?,¿Cuál es el instrumento musical tradicional más popular en México?
New-as-01,Food,Assamese (Assam),What is the main agricultural product produced in your country?,¿Cuál es el principal producto agrícola producido en México?
New-as-02,Food,Assamese (Assam),What is the most popular wheat-based food item in your country?,¿Cuál es el alimento a base de trigo más popular en México?
New-as-05,Food,Assamese (Assam),What is the most typical drink offered to guests when they visit households in your country?,¿Cuál es la bebida más típica que se ofrece a los invitados cuando visitan hogares en México?
New-as-07,Food,Assamese (Assam),What is the most popular dish cooked with fish in your country?,¿Cuál es el platillo más popular preparado con pescado en México?
New-as-14,Food,Assamese (Assam),What food do people from your country like to eat during rainy weather?,¿Qué comida les gusta comer a las personas de México durante el clima lluvioso?
New-as-15,Food,Assamese (Assam),What drink is commonly consumed in your country when the weather is hot?,¿Qué bebida se consume comúnmente en México cuando hace calor?
New-as-20,Sport,Assamese (Assam),What is the most popular indoor sport in your country?,¿Cuál es el deporte de interior más popular en México?
New-as-29,Sport,Assamese (Assam),What sport do men in your country like to watch?,¿Qué deporte les gusta ver a los hombres en México?
New-as-30,Sport,Assamese (Assam),What sport do women in your country like to watch?,¿Qué deporte les gusta ver a las mujeres en México?
New-as-58,Work life,Assamese (Assam),What is the most popular beverage that people from your country like to drink in their workplace?,¿Cuál es la bebida más popular que a la gente de México le gusta tomar en su lugar de trabajo?
New-as-64,Family,Assamese (Assam),On which holiday do all family members tend to reunite in your country?,¿En qué festividad suelen reunirse todos los miembros de la familia en México?
New-as-76,Holidays/Celebration/Leisure,Assamese (Assam),What traditional games do families play during traditional holidays in your country?,¿Qué juegos tradicionales juegan las familias durante las festividades tradicionales en México?
New-as-80,Holidays/Celebration/Leisure,Assamese (Assam),What type of clothing do people from your country wear during traditional festivals?,¿Qué tipo de ropa usan las personas de México durante los festivales tradicionales?
New-as-89,Holidays/Celebration/Leisure,Assamese (Assam),What traditional festival accessories do people from your country wear?,¿Qué accesorios tradicionales de festivales usan las personas en México?
New-az-05,Food,Azerbaijani (Azerbaijan),What is the most famous region for alcohol production in your country?,¿Cuál es la región más famosa para la producción de alcohol en México?
New-az-11,Food,Azerbaijani (Azerbaijan),What fruit do people from your country often eat in the summer season?,¿Qué fruta comen a menudo las personas de México en la temporada de verano?
New-az-12,Food,Azerbaijani (Azerbaijan),Which region in your country is known for its seafood?,¿Qué región de México es conocida por sus mariscos?
New-az-21,Sport,Azerbaijani (Azerbaijan),Which region in your country is the most popular skiing destination?,¿Cuál es la región más popular para esquiar en México?
New-az-26,Sport,Azerbaijani (Azerbaijan),Who is the most popular martial arts player in your country?,¿Quién es el luchador de artes marciales más popular en México?
New-az-27,Sport,Azerbaijani (Azerbaijan),Which sport has been one of the fastest-growing in your country over the last decade?,¿Cuál deporte ha sido uno de los de más rápido crecimiento en México durante la última década?
New-az-39,Education,Azerbaijani (Azerbaijan),Which country is the most popular destination for students from your country studying abroad?,¿Cuál es el país de destino más popular para los estudiantes de México que estudian en el extranjero?
New-az-49,Work life,Azerbaijani (Azerbaijan),"How many people work in a typical family in your country? (Provide Arabic numerals (e.g., 1) only.)","¿Cuántas personas trabajan en una familia típica en México? (Proporcione solo números arábigos (por ejemplo, 1).)"
New-az-60,Family,Azerbaijani (Azerbaijan),"In your country, who takes care of kids when both parents are working?","¿En México, quién se encarga de los niños cuando ambos padres están trabajando?"
