,ID,Topic,Source,Question,Translation
258,New-ch-01,Food,Chinese (China),¿Qué tipo de carne suelen comer las personas cuando hacen carne asada en México?,What kind of meat do people usually eat when they have barbecue in Mexico?
259,New-ch-02,Food,Chinese (China),"¿A qué hora suelen desayunar las personas en México? (Proporcionar en formato HH:MM (por ejemplo, 18:00, 09:00).)","When do people usually have breakfast in Mexico? (Provide in HH:MM format (e.g., 18:00, 09:00).)"
260,New-ch-04,Food,Chinese (China),¿Qué tipos de comida suelen comer las personas en México como bocadillos nocturnos?,What kinds of food do people usually eat for late-night snacks in Mexico?
261,New-ch-05,Food,Chinese (China),¿Cuál es el platillo picante más famoso de México?,What is the most famous spicy dish in Mexico?
262,New-ch-07,Food,Chinese (China),¿Qué alimentos suelen acompañar las personas con bebidas alcohólicas fuertes en México?,What food items do people typically pair with hard liquor in Mexico?
263,New-ch-08,Food,Chinese (China),¿Qué condimento esencial es indispensable en la cocina en México?,What seasoning is indispensable in cooking in Mexico?
264,New-ch-09,Food,Chinese (China),¿Qué comida consumen típicamente las personas cuando el clima está frío en México?,What food do people typically consume when the weather is cold in Mexico?
265,New-ch-13,Food,Chinese (China),¿Cuál es la marca de alcohol más famosa en México?,What is the most famous alcohol brand in Mexico?
266,New-ch-14,Food,Chinese (China),¿Qué alimentos suelen comer las personas cuando están enfermas en México?,What foods do people usually eat when they are sick in Mexico?
267,New-ch-15,Food,Chinese (China),¿Qué alimentos preparados/listos para comer suelen comprar las personas en los supermercados de México?,What prepared/ready-to-eat food do people typically buy at supermarkets in Mexico?
268,New-ch-16,Sport,Chinese (China),¿Cuál es la película relacionada con el deporte más famosa en México?,What is the most famous sports-related movie in Mexico?
269,New-ch-17,Sport,Chinese (China),¿Qué deporte extremo desean intentar más las personas en general en México?,What extreme sport do people generally wish to try the most in Mexico?
270,New-ch-18,Sport,Chinese (China),¿Cuál es la prueba de atletismo más popular para ver durante las competiciones en México?,Which track and field event is the most popular to watch during competitions in Mexico?
271,New-ch-19,Sport,Chinese (China),¿Cuál es el evento de gimnasia más popular para ver durante las competencias en México?,Which gymnastics event is the most popular to watch during competitions in Mexico?
272,New-ch-23,Sport,Chinese (China),¿Quién es el jugador de tenis de mesa más famoso en México?,Who is the most famous table tennis player in Mexico?
273,New-ch-26,Sport,Chinese (China),"En los Juegos Olímpicos de Invierno, ¿cuál es el evento más popular para ver en México?","In the Winter Olympics, which event is the most popular to watch in Mexico?"
274,New-ch-27,Sport,Chinese (China),¿Quién es el boxeador más famoso de México?,Who is the most famous boxer in Mexico?
275,New-ch-30,Sport,Chinese (China),¿Quién es el atleta de pista y campo más famoso en México?,Who is the most famous track and field athlete in Mexico?
276,New-ch-31,Work life,Chinese (China),¿Qué profesión esperan los padres que sus hijos persigan más en México?,What job do parents most hope their children will pursue in Mexico?
277,New-ch-32,Work life,Chinese (China),¿Qué software de oficina suelen utilizar las personas en el lugar de trabajo en México?,What office software do people typically use in the workplace in Mexico?
278,New-ch-38,Work life,Chinese (China),¿Qué ciudades o regiones son conocidas por sus actividades de importación y exportación en México?,Which cities or regions are known for their import and export activities in Mexico?
279,New-ch-39,Work life,Chinese (China),¿Qué plataforma se utiliza comúnmente en la industria del comercio electrónico en México?,What platform is commonly used in the e-commerce industry in Mexico?
280,New-ch-44,Work life,Chinese (China),"¿Cuál es el período de prueba típico para los nuevos empleados antes de firmar un contrato formal en México? (por ejemplo, 1 mes).","How long is the typical probation period for new employees before signing a formal contract in Mexico? (e.g., 1 month)."
281,New-ch-45,Work life,Chinese (China),¿Qué industrias suelen elegir los jóvenes para iniciar negocios en México?,Which industries do young people typically choose to start businesses in Mexico?
282,New-ch-49,Family,Chinese (China),¿Cuál es la forma más común en que los miembros de la familia se comunican a distancia en México?,What is the most common way for family members to communicate remotely in Mexico?
283,New-ch-51,Family,Chinese (China),¿Qué tipo de alojamiento se reserva habitualmente para viajes familiares en México?,What form of accommodation is typically booked for family trips in Mexico?
284,New-ch-54,Family,Chinese (China),¿Qué fruta se suele preparar más para las cenas familiares en México?,Which fruit is usually prepared the most for family dinners in Mexico?
285,New-ch-64,Education,Chinese (China),"¿Cuántas horas de clases suelen tener los estudiantes universitarios por semana en México? (Proporciona solo números arábigos (por ejemplo, 1).)","How many hours of classes do university students typically have per week in Mexico? (Provide Arabic numerals (e.g., 1) only.)"
286,New-ch-66,Education,Chinese (China),"¿Cuál es la cuota de inscripción típica por semestre para las preparatorias públicas en México? (Proporciona solo números arábigos (por ejemplo, 1).)","What is the typical tuition fee per semester for public high schools in Mexico?  (Provide Arabic numerals (e.g., 1) only.)"
287,New-ch-70,Education,Chinese (China),¿Qué cursos obligatorios tienen en común los estudiantes universitarios en México?,What compulsory courses do university students have in common in Mexico?
288,New-ch-71,Education,Chinese (China),"¿Cuál es el tamaño promedio de las clases en las preparatorias en México? (Proporcione únicamente números arábigos (por ejemplo, 1).)","What is the average class size in high schools in Mexico? (Provide Arabic numerals (e.g., 1) only.)"
289,New-ch-72,Education,Chinese (China),¿Qué carrera se considera más conducente al empleo en México?,Which major is considered most conducive to employment in Mexico?
290,New-ch-73,Education,Chinese (China),¿Qué tipo de clubes son los más populares entre los estudiantes universitarios en México?,What type of clubs are most popular among university students in Mexico?
291,New-ch-74,Education,Chinese (China),¿En que tipos de alojamiento viven principalmente los estudiantes universitarios en México?,What types of accommodation do university students in Mexico typically live in?
292,New-ch-75,Education,Chinese (China),"¿Cuánto dura cada período de clase para los estudiantes de secundaria en México (minutos)? (Proporcione solo números arábigos (por ejemplo, 1).)","How long is each class period for middle school students in Mexico (minutes)?  (Provide Arabic numerals (e.g., 1) only.)"
293,New-ch-78,Holidays/Celebration/Leisure,Chinese (China),¿Qué actividades de ocio suelen gustarle a las mujeres jubiladas en México?,What leisure activities do retired women typically like in Mexico?
294,New-ch-79,Holidays/Celebration/Leisure,Chinese (China),¿Qué actividades de ocio suelen gustarles a los hombres jubilados en México?,What leisure activities do retired men typically like in Mexico?
295,New-ch-80,Holidays/Celebration/Leisure,Chinese (China),"¿Durante qué festividades la gente suele visitar lugares religiosos (templos, iglesias, etc.) en México?","During which holidays do people typically visit religious sites (temples, churches, etc.) in Mexico?"
296,New-ch-81,Holidays/Celebration/Leisure,Chinese (China),¿Cuáles son los regalos típicos para una inauguración de casa en México?,What are the typical housewarming gifts in Mexico?
297,New-ch-82,Holidays/Celebration/Leisure,Chinese (China),"¿A qué hora suelen comenzar las bodas típicamente en México? (Proporcionar en formato HH:MM (por ejemplo, 18:00, 09:00).)","At what time do weddings typically start in Mexico? (Provide in HH:MM format (e.g., 18:00, 09:00).)"
298,New-ch-83,Holidays/Celebration/Leisure,Chinese (China),¿Qué ciudad de México es la que más festivales alberga?,Which city in Mexico hosts festivals the most?
299,New-ch-84,Holidays/Celebration/Leisure,Chinese (China),¿Qué color de ropa suelen llevar las personas cuando asisten a bodas en México?,What color of clothing do people typically wear when attending weddings in Mexico?
300,New-ch-85,Holidays/Celebration/Leisure,Chinese (China),¿Qué color de ropa suelen llevar las personas cuando asisten a funerales en México?,What color of clothing do people typically wear when attending funerals in Mexico?
301,New-en-01,Food,English (UK),¿Qué botana se come en el cine en México?,Which snack is eaten in the cinema in Mexico?
302,New-en-02,Food,English (UK),¿Cuál es el sabor de papas fritas más popular en México?,What is the most popular chip/crisp flavour in Mexico?
303,New-en-04,Food,English (UK),¿Quién es un chef celebridad popular en México?,Who is a popular celebrity chef in Mexico?
304,New-en-05,Food,English (UK),¿Qué comida es una opción rápida y económica para comer en México?,Which food is a cost-effective and quick meal option in Mexico?
305,New-en-07,Food,English (UK),¿Cuáles son los programas de cocina más populares en México?,What are the most popular cooking shows in Mexico?
306,New-en-08,Food,English (UK),¿Cuál es la marca de chocolate más popular en México?,What is the most popular chocolate brand in Mexico?
307,New-en-10,Food,English (UK),¿Cuál es el queso más consumido en México?,What is the most eaten cheese in Mexico?
308,New-en-11,Food,English (UK),¿Cuál es la verdura menos gustada en México?,What is the most disliked vegetable in Mexico?
309,New-en-12,Food,English (UK),¿Qué comida se encuentra más comúnmente en las plazas de comida en México?,What food is most commonly found in food courts in Mexico?
310,New-en-17,Sport,English (UK),¿Cuáles son los instrumentos de animación más comunes utilizados por los aficionados al deporte en México?,What are the most common cheering tools used by sports fans in Mexico?
311,New-en-18,Sport,English (UK),¿Qué llevan los aficionados consigo cuando asisten a un partido en vivo en México?,What do fans bring with them when attending a live game in Mexico?
312,New-en-19,Sport,English (UK),¿Cuál es el estadio deportivo más conocido en México?,What is the most well known sporting stadium in Mexico?
313,New-en-23,Sport,English (UK),¿Quién es el paralímpico más famoso de México?,Who is the most famous Paralympian in Mexico?
314,New-en-26,Sport,English (UK),¿Cuál es el cántico deportivo más reconocido en México?,What is the best recognized sporting chant in Mexico?
315,New-en-38,Work life,English (UK),¿Qué industrias son conocidas por tener horarios de trabajo más flexibles en México?,Which industries are known for more flexible working hours in Mexico?
316,New-en-41,Work life,English (UK),¿Quién es el empresario más conocido y exitoso de México?,Who is the most well known and successful entrepreneur in Mexico?
317,New-en-47,Family,English (UK),¿Qué se puede encontrar típicamente en el jardín trasero de las casas en México?,What can typically be found in the back garden of houses in Mexico?
318,New-en-49,Family,English (UK),¿Cuál es el nombre de la familia más famosa de México?,What is the name of the most famous family in Mexico?
319,New-en-50,Family,English (UK),¿Cuál es el apellido más común en México?,What is the most common family name in Mexico?
320,New-en-55,Family,English (UK),¿Cuál es la religión más practicada por las familias en México?,Which religion is most commonly practiced by families in Mexico?
321,New-en-56,Family,English (UK),¿Cuál es el idioma extranjero más hablado por las familias en México?,What is the most popular foreign language spoken by families in Mexico?
322,New-en-59,Family,English (UK),¿Cuál es el país de destino más popular para las familias de México que emigran?,Which country is the most popular destination for families from Mexico to emigrate to?
323,New-en-68,Education,English (UK),¿Qué repercusiones hay para el mal comportamiento en las escuelas en México?,What repercussions are there for bad behavior in schools in Mexico?
324,New-en-69,Education,English (UK),¿Qué escritores se estudian comúnmente en la clase de literatura en México?,Which writers are commonly studied in literature class in Mexico?
325,New-en-70,Education,English (UK),"¿Cuántos periodos vacacionales hay en un año para las preparatorias en México? (Proporciona solo números arábigos (por ejemplo, 1).)","How many school breaks are there in a year for high schools in Mexico? (Provide Arabic numerals (e.g., 1) only.)"
326,New-en-72,Education,English (UK),¿Qué recurso en línea suelen utilizar los estudiantes para estudiar en México?,Which online resource do students usually use to study in Mexico?
327,New-en-75,Education,English (UK),"¿Cuál es la duración promedio de un semestre en términos de semanas de enseñanza en las universidades de México? (Proporcione solo números arábigos (por ejemplo, 1).)","What is the average length of a semester in terms of weeks of teaching at universities in Mexico? (Provide Arabic numerals (e.g., 1) only.)"
328,New-en-76,Holidays/Celebration/Leisure,English (UK),¿Cuál es el aeropuerto más concurrido en México durante la temporada de vacaciones?,Which airport in Mexico is the busiest during the holiday season?
329,New-en-79,Holidays/Celebration/Leisure,English (UK),¿Qué región de México es bien conocida por sus representaciones teatrales?,Which region of Mexico is well known for its theatrical performances?
330,New-en-87,Holidays/Celebration/Leisure,English (UK),¿Cuál es el monumento histórico más famoso de México?,What is the most famous historic landmark in Mexico?
331,New-en-90,Holidays/Celebration/Leisure,English (UK),¿Cuál es la cadena de hoteles más famosa en México?,What is the most famous hotel brand in Mexico?
332,New-gr-05,Food,Greek (Greece),¿Cuál es la opción de desayuno para llevar más popular en México?,What is the most popular grab-and-go breakfast option in Mexico?
333,New-gr-06,Food,Greek (Greece),¿Cuál es la comida más popular en México entre los jóvenes?,What is the most popular food in Mexico among young people?
334,New-gr-08,Food,Greek (Greece),¿Qué tipo de bebida alcohólica se consume más comúnmente en festivales en México?,What type of alcoholic drink is most commonly consumed at festivals in Mexico?
335,New-gr-13,Food,Greek (Greece),¿Cuál es la bebida matutina más común en México?,What is the most common morning drink in Mexico?
336,New-gr-15,Food,Greek (Greece),¿Cuál es el postre tradicional más popular en México?,What is the most popular traditional dessert in Mexico?
337,New-gr-21,Sport,Greek (Greece),¿Cuál es el deporte de raqueta más popular en México?,What is the most popular racket sport in Mexico?
338,New-gr-24,Sport,Greek (Greece),¿Cuál es el deporte de atletismo más popular en México?,What is the most popular track and field sport in Mexico?
339,New-gr-29,Sport,Greek (Greece),¿Cuál evento deportivo internacional es el más popular en México?,Which international sporting event is the most popular in Mexico?
340,New-gr-47,Work life,Greek (Greece),"¿Cuánto duran (en minutos) los descansos laborales típicos en México, excluyendo los descansos para comer y cenar? (Proporcione solo números arábigos (por ejemplo, 1).)","How long (in minutes) are typical work breaks in Mexico, excluding lunch and dinner breaks? (Provide Arabic numerals (e.g., 1) only.)"
341,New-gr-58,Work life,Greek (Greece),¿Qué trabajo se considera mal pagado en México?,Which job is considered underpaid in Mexico?
342,New-gr-76,Holidays/Celebration/Leisure,Greek (Greece),¿Cuál es la comida más común que se sirve durante la Semana Santa en México?,What is the most common food served during Easter in Mexico?
343,New-gr-82,Holidays/Celebration/Leisure,Greek (Greece),¿Cuál es el género musical más popular entre la población de adultos mayores en México?,What is the most popular music genre among the elderly population in Mexico?
344,New-gr-88,Holidays/Celebration/Leisure,Greek (Greece),¿Qué bebida se ofrece habitualmente en los funerales en México?,What drink is usually offered at funerals in Mexico?
345,New-gr-89,Holidays/Celebration/Leisure,Greek (Greece),¿Qué bebida se ofrece habitualmente en las bodas en México?,What drink is usually offered at weddings in Mexico?
346,New-ha-07,Food,Hausa (Northern Nigeria),¿Qué comida se originó en México y puede encontrarse en todo el mundo?,What food originated from Mexico and can be found all over the world?
347,New-ha-08,Food,Hausa (Northern Nigeria),¿Qué comida es típicamente disgustada por los niños pero disfrutada por los ancianos en México?,What food is typically disliked by children but enjoyed by the elderly in Mexico?
348,New-ha-09,Food,Hausa (Northern Nigeria),¿Qué utensilio de cocina se usa más comúnmente en México?,What cooking utensil is most commonly used in Mexico?
349,New-ha-13,Food,Hausa (Northern Nigeria),¿Cuál es la verdura más popular en México?,Which is the most popular vegetable in Mexico?
350,New-ha-19,Sport,Hausa (Northern Nigeria),¿Qué animal se utiliza para los deportes en México?,Which animal is used for sports in Mexico?
351,New-ha-66,Family,Hausa (Northern Nigeria),¿Cuál es el lugar de bodas más popular en México?,What is the most popular wedding venue in Mexico?
352,New-in-01,Food,Indonesian (Indonesia),¿Cuál es la marca de cafetería más popular en México?,Which coffee shop brand is the most popular in Mexico?
353,New-in-03,Food,Indonesian (Indonesia),¿Qué tipo de comida de México se sirve típicamente en restaurantes en el extranjero?,What type of food from Mexico is typically served in restaurants overseas?
354,New-in-33,Work life,Indonesian (Indonesia),¿Qué región en México se asocia generalmente con la minería?,What region in Mexico is usually associated with mining?
355,New-in-34,Work life,Indonesian (Indonesia),¿Qué región de México se asocia normalmente con el petróleo?,What region in Mexico is usually associated with oil?
356,New-in-62,Education,Indonesian (Indonesia),¿Qué universidad en México es popular por su carrera de ingeniería? (Proporciona el nombre oficial.),What university in Mexico is popular because of its engineering major? (Provide the official name.)
357,New-in-63,Education,Indonesian (Indonesia),¿Qué universidad en México es popular por su facultad de medicina? (Proporciona el nombre oficial.),What university in Mexico is popular because of its school of medicine? (Provide the official name.)
358,New-in-78,Holidays/Celebration/Leisure,Indonesian (Indonesia),¿Cuál es el método de pago más popular en México?,What is the most popular payment method in Mexico?
359,New-in-80,Holidays/Celebration/Leisure,Indonesian (Indonesia),¿Cuál es el parque temático más famoso de México?,What is the most famous theme park in Mexico?
360,New-ko-01,Family,Korean (Korea),¿Cuál es la animación infantil más popular que comúnmente ven los niños en México?,What is the most popular children's animation that is commonly watched by kids in Mexico?
361,New-ko-02,Family,Korean (Korea),¿Cuál es la actividad de educación prenatal más popular para mujeres embarazadas en México?,What is the most popular prenatal education activity for pregnant women in Mexico?
362,New-ko-03,Family,Korean (Korea),¿Cuál es la canción infantil más popular en México que las familias cantan juntas?,What is the most popular children's song in Mexico that families sing together?
363,New-ko-04,Family,Korean (Korea),¿Cuáles son los juguetes más populares entre los niños en México?,Which toys are most popular among boys in Mexico?
364,New-ko-05,Family,Korean (Korea),¿Cuáles son los juguetes más populares entre las niñas en México?,Which toys are most popular among girls in Mexico?
365,New-ko-06,Family,Korean (Korea),¿Cuál es el cuento popular más famoso en México que típicamente se les cuenta a los niños?,What is the most popular folk tale in Mexico that is typically told to children?
366,New-ko-07,Holidays/Celebration/Leisure,Korean (Korea),¿Cuál es el símbolo habitual de condolencia utilizado en los funerales en México?,What is the customary symbol of condolence used at funerals in Mexico?
367,New-ko-08,Work life,Korean (Korea),¿Dónde suelen trabajar los estudiantes universitarios en México a tiempo parcial con mayor frecuencia?,Where do university students in Mexico tend to work part-time the most?
368,New-ko-09,Work life,Korean (Korea),¿Cuáles son las actividades de integración de equipos más practicadas en las empresas con sede en México?,What are the most frequently practiced team-building activities in companies based in Mexico?
369,New-ko-10,Work life,Korean (Korea),¿Cuáles son las actividades más comunes que la gente hace como trabajo secundario en México?,What are the most common activities people do as a side job in Mexico?
370,New-pe-02,Food,Persian (Iran),¿Cuál es el recuerdo comestible más famoso para los turistas en México?,What is the most famous edible souvenir for tourists in Mexico?
371,New-pe-06,Food,Persian (Iran),¿Cuál es el guiso más popular en México?,What is the most popular stew in Mexico?
372,New-pe-11,Food,Persian (Iran),¿Cuál es la especia/hierba más común utilizada en los platillos de México?,What is the most common spice/herb used in dishes from Mexico?
373,New-pe-16,Sport,Persian (Iran),¿Cuál es el deporte tradicional más famoso en México?,What is the most famous traditional sport in Mexico?
374,New-pe-20,Sport,Persian (Iran),¿Qué deporte es popular para jugar en la playa en México?,What sport is popular to play on the beach in Mexico?
375,New-pe-45,Work life,Persian (Iran),¿Cuál suele ser el horario de trabajo durante el mes de Ramadán en México?,What is the usual work schedule during the month of Ramadan in Mexico?
376,New-pe-47,Family,Persian (Iran),"¿Cuándo se celebra el Día del Estudiante en México? (Proporcionar en formato MM/DD (por ejemplo, 12/31).)","When is Student's Day celebrated in Mexico? (Provide in MM/DD format (e.g., 12/31).)"
377,New-pe-49,Family,Persian (Iran),¿Dónde se reúnen las familias para rezar juntas en México?,Where do families gather to pray together in Mexico?
378,New-pe-53,Family,Persian (Iran),¿Qué regalos reciben los padres en el Día del Padre (o Día de los Padres) en México?,What gifts do fathers get on Father's Day (or Parents' Day) in Mexico?
379,New-pe-54,Family,Persian (Iran),¿Qué regalos reciben las madres en el Día de la Madre (o Día de los Padres) en México?,What gifts do mothers get on Mother's Day (or Parents' Day) in Mexico?
380,New-pe-59,Family,Persian (Iran),"¿Cuántas generaciones suelen vivir juntas en un hogar en México? (Proporcione solo números arábigos (por ejemplo, 12).)","How many generations typically live together in a household in Mexico? (Provide Arabic numerals (e.g., 12) only.)"
381,New-pe-65,Education,Persian (Iran),"¿Cuántas materias se imparten en las escuelas secundarias en México? (Proporcione solo números arábigos (por ejemplo, 12).)","How many subjects are taught in middle schools in Mexico? (Provide Arabic numerals (e.g., 12) only.)"
382,New-pe-66,Education,Persian (Iran),¿Cuáles son las actividades extracurriculares más populares en las escuelas primarias de México después de clases?,What is the most popular after school curricular in elementary schools in Mexico?
383,New-pe-74,Education,Persian (Iran),¿Cuál es la cuota anual promedio de colegiatura en las universidades públicas de México?,How much is the average annual tuition fee for public universities in Mexico?
384,New-pe-76,Holidays/Celebration/Leisure,Persian (Iran),¿Cuál es una actividad popular para hacer en los parques en México?,What is a popular activity to do in parks in Mexico?
385,New-pe-78,Holidays/Celebration/Leisure,Persian (Iran),¿Cuál es el nombre del festival de cine más famoso que se celebra en México?,What is the name of the most famous film festival held in Mexico?
386,New-pe-83,Holidays/Celebration/Leisure,Persian (Iran),¿Cuál es el juego de cartas popular que se juega durante las reuniones sociales en México?,What is the popular card game played during social gatherings in Mexico?
387,New-pe-85,Holidays/Celebration/Leisure,Persian (Iran),¿Cuál es el destino turístico en el extranjero más popular para la gente de México?,Where is the most popular tourist destination abroad for people from Mexico?
388,New-pe-86,Holidays/Celebration/Leisure,Persian (Iran),¿Cuál es el nombre de la torre más famosa de México?,What is the name of the most famous tower in Mexico?
389,New-spme-01,Food,Spanish (Mexico),¿Qué insecto comestible se consume más a menudo en México?,What edible insect is eaten most often in Mexico?
390,New-spme-04,Food,Spanish (Mexico),¿Cuál es el producto agrícola que más se exporta en México?,Which agricultural product is exported most often in Mexico?
391,New-spme-05,Food,Spanish (Mexico),¿Cuáles son los dulces más populares en México?,What are the most popular sweets in Mexico?
392,New-spme-15,Sport,Spanish (Mexico),¿Cuál es la bebida deportiva más popular en México?,What is the most popular sports drink in Mexico?
