,ID,Topic,Source,Question,Translation
123,Jod-ch-58,Work life,Chinese (China),¿Cuál es la profesión más respetada en México?,Which profession is the most respected in Mexico?
124,Jod-ch-60,Work life,Chinese (China),¿Cuál es la duración (en horas) de un día laboral típico en México? (Proporcione únicamente números arábigos (0~24).),What is the duration (in hours) of a typical workday in Mexico? (Provide Arabic numerals (0~24) only.)
125,Jod-ch-61,Work life,Chinese (China),¿Cuál es la ocupación más preferida entre las mujeres en México?,Which occupation is most preferred among females in Mexico?
126,Jod-ch-62,Work life,Chinese (China),¿Cuál es la ocupación más preferida entre los hombres en México?,Which occupation is most preferred among males in Mexico?
127,Ki-pe-17,Education,Persian (Iran),"En promedio, ¿hasta qué nivel suelen estudiar los estudiantes en México? (por ejemplo, primaria, secundaria)","On average, how far do students typically pursue their education in Mexico? (e.g., elementary, high school)"
128,Ki-pe-24,Education,Persian (Iran),¿Qué idioma se enseña en las escuelas de México además del inglés?,What language is taught in schools in Mexico besides English?
129,Ki-pe-30,Education,Persian (Iran),¿Qué días de la semana están cerradas las escuelas en México?,What days of the week are schools closed in Mexico?
130,Ki-pe-32,Food,Persian (Iran),¿Qué comida suelen preparar los anfitriones para los invitados en México?,What food do the hosts usually prepare for the guests in Mexico?
131,Ki-pe-34,Food,Persian (Iran),¿Cuál es la bebida habitual en el desayuno en México?,What is the usual drink in the breakfast in Mexico?
132,Ki-pe-36,Food,Persian (Iran),"Exceptuando la comida originaria de México, ¿qué comida de qué país es más popular en México?","Except the food original from Mexico, which country's food is more popular in Mexico?"
133,Ki-pe-39,Food,Persian (Iran),¿Qué comida se suele preparar para un picnic familiar en México?,What food is usually prepared for a family picnic in Mexico?
134,Ki-pe-40,Food,Persian (Iran),¿Qué comida de México es considerada asquerosa por el resto del mundo?,Which food from Mexico is considered disgusting by the rest of the world?
135,Ki-pe-43,Food,Persian (Iran),¿Cuál es el nombre del pan popular en México?,What is the name of the popular bread in Mexico?
136,Ki-pe-51,Work life,Persian (Iran),"¿A qué hora cierran las oficinas de gobierno en México? (Proporcionar en formato HH:MM (por ejemplo, 18:00, 09:00).)","What time of day are government offices closed in Mexico? (Provide in HH:MM format (e.g., 18:00, 09:00).)"
137,Ki-pe-53,Work life,Persian (Iran),"¿Cuál es el horario de inicio habitual de las oficinas gubernamentales en México? (Proporcionar en formato HH:MM, por ejemplo, 18:00, 09:00).","What is the normal start time of government offices in Mexico? (Provide in HH:MM format (e.g., 18:00, 09:00).)"
138,Kik-in-01,Holidays/Celebration/Leisure,Indonesian (Indonesia),¿Qué día festivo nacional tiene la mayor duración en México?,What national holiday has the longest duration in Mexico?
139,Kik-in-02,Holidays/Celebration/Leisure,Indonesian (Indonesia),¿Cuáles son las actividades comunes que la gente de México realiza para celebrar el Día de la Independencia?,What are the common activities people from Mexico do to celebrate Independence day?
140,Kik-in-04,Holidays/Celebration/Leisure,Indonesian (Indonesia),¿Qué se instala enfrente de la casa cuando muere un miembro de la familia en México?,What is installed in front of the house when a family member dies in Mexico?
141,Kik-in-05,Holidays/Celebration/Leisure,Indonesian (Indonesia),¿Cuándo se suele realizar una celebración o ceremonia de embarazo en México?,When is a pregnancy celebration or ceremony usually held in Mexico?
142,Kik-in-06,Holidays/Celebration/Leisure,Indonesian (Indonesia),¿Qué evento se suele realizar antes de una boda en México?,What event is usually held before a wedding in Mexico?
143,Kik-in-07,Holidays/Celebration/Leisure,Indonesian (Indonesia),¿Qué se suele compartir con los niños durante el Año Nuevo (Lunar) en México?,What is usually shared to the children during (Lunar) New Year in Mexico?
144,Kik-in-08,Holidays/Celebration/Leisure,Indonesian (Indonesia),¿Qué actividades se suelen realizar días antes del Ramadán en México?,What activities are usually done days before Ramadan in Mexico?
145,Kik-in-10,Holidays/Celebration/Leisure,Indonesian (Indonesia),¿Cuál es la atracción turística más popular para los visitantes extranjeros en México?,What is the most popular tourist attraction for foreign visitors in Mexico?
146,Kik-in-11,Holidays/Celebration/Leisure,Indonesian (Indonesia),"¿Cuáles son los sitios religiosos (templo, iglesia, etc.) más populares para el turismo en México?","What is the most popular religious sites (temple, church, etc.) for tourism in Mexico?"
147,Kik-in-15,Holidays/Celebration/Leisure,Indonesian (Indonesia),¿Qué ropa suelen usar las mujeres en la ceremonia de graduación en México?,What clothes do women usually wear on graduation commencement ceremony in Mexico?
148,Kik-in-16,Food,Indonesian (Indonesia),¿Qué bebida se consume comúnmente en México cuando el clima está frío?,What drink is commonly consumed in Mexico when the weather is cold?
149,Kik-in-17,Food,Indonesian (Indonesia),¿Qué fruta se vende y se encuentra más comúnmente durante el Ramadán en México?,What fruit is more commonly sold and found during Ramadan in Mexico?
150,Kik-in-24,Food,Indonesian (Indonesia),¿Qué carbohidrato se sirve usualmente con pollo en un restaurante de comida rápida en México?,What carbohydrate is usually served with chicken in a fast-food restaurant in Mexico?
151,Kik-in-31,Sport,Indonesian (Indonesia),¿Cuál es el deporte de artes marciales más famoso en México?,What is the most famous martial art sports in Mexico?
152,Kik-in-34,Sport,Indonesian (Indonesia),¿Qué deportes se transmiten frecuentemente en la televisión nacional en México?,What sports are often broadcasted on national television in Mexico?
153,Kik-in-35,Sport,Indonesian (Indonesia),¿Qué deportes fueron populares entre la gente de México durante la pandemia de COVID-19?,What sports were popular among people from Mexico during the COVID-19 pandemic?
154,Kik-in-36,Sport,Indonesian (Indonesia),¿Quién es el entrenador de fútbol más popular en México?,Who is the most popular soccer coach in Mexico?
155,Kik-in-37,Sport,Indonesian (Indonesia),¿Qué equipos de fútbol en México son famosos por su intensa rivalidad? (p. ej. ___ vs ___),What soccer teams in Mexico are famous for their intense rivalry? (e.g. ___ vs ___)
156,Kik-in-38,Sport,Indonesian (Indonesia),¿Cuáles son los nombres de los aficionados al fútbol en México que son famosos por su intensa rivalidad? (p. ej. ___ vs ___),What are the names of soccer supporters in Mexico who are famous for their intense rivalry? (e.g. ___ vs ___)
157,Kik-in-40,Sport,Indonesian (Indonesia),¿Quién es el jugador de bádminton masculino más famoso en México?,Who is the most famous male badminton player in Mexico?
158,Kik-in-41,Sport,Indonesian (Indonesia),¿Quién es la jugadora de bádminton femenino más famosa en México?,Who is the most famous female badminton player in Mexico?
159,Kik-in-44,Sport,Indonesian (Indonesia),¿Qué deporte recibe más apoyo del gobierno en México?,What sport gets the most support from the government in Mexico?
160,Kik-in-45,Sport,Indonesian (Indonesia),¿Qué instalaciones de campos deportivos suelen estar disponibles en las escuelas de México?,What sports field facilities are usually available at schools in Mexico?
161,Na-ko-02,Food,Korean (South Korea),¿Qué bebida de café disfrutan más comúnmente las personas de México?,What cafe beverage do people from Mexico most commonly enjoy?
162,Na-ko-04,Food,Korean (South Korea),¿Cuál es la comida preferida para curar la cruda de las personas en México?,What is the preferred hangover cure food for people from Mexico?
163,Na-ko-05,Food,Korean (South Korea),¿Cuál es la comida típica a domicilio en México?,What is the typical delivery food in Mexico?
164,Na-ko-07,Food,Korean (South Korea),¿Qué tipo de carne es la más consumida por la gente de México?,What type of meat is consumed most by people from Mexico?
165,Na-ko-08,Food,Korean (South Korea),¿Qué fruta comen comúnmente las personas en México durante la temporada de otoño?,What fruit do people from Mexico often eat in the autumn season?
166,Na-ko-09,Food,Korean (South Korea),¿Qué guarnición se sirve más comúnmente en una mesa de comedor en México?,What side dish is the most commonly served on a dining table in Mexico?
167,Na-ko-11,Food,Korean (South Korea),¿Qué comen las personas de México mientras ven un partido de fútbol?,What do people from Mexico eat while watching a soccer game?
168,Na-ko-15,Food,Korean (South Korea),¿Cuál es el alimento nutritivo representativo en México?,What is the representative nourishing food in Mexico?
169,Na-ko-16,Sport,Korean (South Korea),¿Quién es el futbolista más famoso de México?,Who is the most famous soccer player in Mexico?
170,Na-ko-17,Sport,Korean (South Korea),¿Qué deportes disfrutan los estudiantes varones durante la hora del almuerzo en la escuela en México?,What sports do male students enjoy during lunch time at school in Mexico?
171,Na-ko-18,Sport,Korean (South Korea),¿Cuál es el deporte más común en el que participan las niñas durante las clases de educación física en México?,What is the most common sport girls participate in during physical education classes in Mexico?
172,Na-ko-19,Sport,Korean (South Korea),¿Quién es el jugador de voleibol más popular en México?,Who is the most popular volleyball player in Mexico?
173,Na-ko-20,Sport,Korean (South Korea),¿Qué evento deportivo apoyan con más pasión las personas de México en las competiciones internacionales?,What sports event do people from Mexico passionately support the most in international competitions?
174,Na-ko-22,Sport,Korean (South Korea),¿Qué país se considera el mayor rival en partidos de fútbol para México?,Which country is considered the biggest rival in soccer matches for Mexico?
175,Na-ko-23,Sport,Korean (South Korea),¿A qué tipo de academias deportivas asisten más los niños en México?,What type of sports academies do children attend the most in Mexico?
176,Na-ko-24,Sport,Korean (South Korea),¿Cuál es la comida más consumida en los estadios deportivos mientras se ven partidos en México?,What is the most commonly eaten food in sports stadiums while watching games in Mexico?
177,Na-ko-25,Sport,Korean (South Korea),¿Cuáles son los deportes típicos que se juegan en el día del deporte escolar en México?,What are the typical sports played in Mexico's school sports day?
178,Na-ko-26,Sport,Korean (South Korea),¿Cuáles son los deportes populares entre la población de mediana edad en México?,What are the popular sports among the middle-aged population in Mexico?
179,Na-ko-28,Sport,Korean (South Korea),¿Quién es el deportista de deportes de invierno más popular en México?,Who is the most popular winter sports player in Mexico?
180,Na-ko-29,Sport,Korean (South Korea),¿Quién es el nadador más famoso de México?,Who is the most famous swimmer in Mexico?
181,Na-ko-30,Sport,Korean (South Korea),¿Cuál es el juego de e-sports más popular en México?,What is the most popular e-sports game in Mexico?
182,Na-ko-33,Holidays/Celebration/Leisure,Korean (South Korea),¿Qué comida simbólica comen las personas de México en el Año Nuevo (Lunar)?,What symbolic food do people from Mexico eat on (Lunar) New Year?
183,Na-ko-37,Holidays/Celebration/Leisure,Korean (South Korea),¿Cuál es el destino turístico nacional más popular entre la gente de México?,What is the most popular domestic vacation spot for people from Mexico?
184,Na-ko-38,Holidays/Celebration/Leisure,Korean (South Korea),¿Cuál es el regalo de boda más común entre novios en México?,What is the most common wedding gift between bride and groom in Mexico?
185,Na-ko-39,Holidays/Celebration/Leisure,Korean (South Korea),¿Qué se suele dar como gesto de felicitación al asistir a la boda de un amigo en México?,What is typically given as a congratulatory gesture when attending a friend's wedding in Mexico?
186,Na-ko-40,Holidays/Celebration/Leisure,Korean (South Korea),"¿Cuánto tiempo (en días) dura típicamente un funeral en México? (Proporcione solo números arábigos (por ejemplo, 12).)","How long (in days) does a funeral typically last in Mexico? (Provide Arabic numerals (e.g., 12) only.)"
187,Na-ko-41,Holidays/Celebration/Leisure,Korean (South Korea),¿Qué deberías preparar como ofrenda de condolencia al asistir a un funeral en México?,What should you prepare as a condolence offering when attending a funeral in Mexico?
188,Na-ko-42,Holidays/Celebration/Leisure,Korean (South Korea),¿Qué tipo de comida se ofrece comúnmente en las funerarias en México?,What type of food is commonly provided at funeral parlors in Mexico?
189,Na-ko-43,Holidays/Celebration/Leisure,Korean (South Korea),¿Qué hacen las personas en México en la mañana del Año Nuevo (Lunar)?,What do people do in Mexico in the morning of the (Lunar) New Year?
190,Na-ko-44,Holidays/Celebration/Leisure,Korean (South Korea),¿Cuándo es el día con la congestión de tráfico más severa a nivel nacional en México?,When is the day with Mexico's most severe nationwide traffic congestion?
191,Na-ko-45,Holidays/Celebration/Leisure,Korean (South Korea),¿Cuál es el destino de luna de miel más popular en México?,What is the most popular honeymoon destination in Mexico?
192,Ne-ar-05,Holidays/Celebration/Leisure,Arabic (Algeria),¿Cuál es la fiesta nacional más importante en México?,What is the most important national holiday in Mexico?
193,Ne-ar-06,Holidays/Celebration/Leisure,Arabic (Algeria),¿Qué comen las personas de México en Ramadán?,What do people from Mexico eat in Ramadan?
194,Ne-ar-09,Holidays/Celebration/Leisure,Arabic (Algeria),¿Qué comen las personas de México en Eid ul Fitr?,What do people from Mexico eat in Eid ul Fitr?
195,Ne-ar-10,Holidays/Celebration/Leisure,Arabic (Algeria),¿Qué comen las personas de México en Eid ul Adha?,What do people from Mexico eat in Eid ul Adha?
196,Ne-ar-11,Holidays/Celebration/Leisure,Arabic (Algeria),¿A dónde va la gente de México para celebrar el Año Nuevo?,Where do people from Mexico go to celebrate New Year's Day?
197,Ne-ar-14,Holidays/Celebration/Leisure,Arabic (Algeria),¿Dónde se reúne una familia para las festividades de Eid en México?,Where do a family gather for Eid festivities in Mexico?
198,Ne-ar-16,Work life,Arabic (Algeria),"¿Cuándo es el fin de semana en México (por ejemplo, lunes, martes)?","When is the weekend in Mexico (e.g. Monday, Tuesday)?"
199,Ne-ar-17,Work life,Arabic (Algeria),"¿A qué hora comienza la mayoría de la gente a trabajar en México? (Proporcionar en formato HH:MM, por ejemplo, 18:00, 09:00).","At what time do most people start work in Mexico? (Provide in HH:MM format (e.g., 18:00, 09:00).)"
200,Ne-ar-18,Work life,Arabic (Algeria),"¿A qué hora termina la mayoría de la gente de trabajar en México? (Proporcionar en formato HH:MM (por ejemplo, 18:00, 09:00).)","At what time do most people finish work in Mexico? (Provide in HH:MM format (e.g., 18:00, 09:00).)"
201,Ne-ar-20,Work life,Arabic (Algeria),¿Qué se considera un empleo seguro en México?,What is considered to be a secure job in Mexico?
202,Ne-ar-24,Work life,Arabic (Algeria),¿Cuál ciudad es el principal centro comercial en México?,Which city is the primary commercial hub in Mexico?
203,Ne-ar-25,Work life,Arabic (Algeria),¿Cuál es la industria que mejor paga en México?,What is the industry that pays the best in Mexico?
204,Ne-ar-26,Work life,Arabic (Algeria),¿Cuál es la corporación pública más famosa de México?,What is the most famous public corporation in Mexico?
205,Ne-ar-31,Food,Arabic (Algeria),¿Cuál es el platillo más famoso de México?,What is the most famous dish in Mexico?
206,Ne-ar-32,Food,Arabic (Algeria),¿Qué suelen desayunar las personas en México?,What do people usually have for breakfast in Mexico?
207,Ne-ar-33,Food,Arabic (Algeria),"¿A qué hora suelen almorzar las personas en México? (Proporcionar en formato HH:MM (por ejemplo, 18:00, 09:00).)","When do people usually have lunch in Mexico? (Provide in HH:MM format (e.g., 18:00, 09:00).)"
208,Ne-ar-34,Food,Arabic (Algeria),¿Qué es típicamente indispensable en las comidas en México?,What is typically indispensable in meals in Mexico?
209,Ne-ar-36,Food,Arabic (Algeria),¿Cuál es una comida festiva típica en México?,What is a typical festive meal in Mexico?
210,Ne-ar-37,Food,Arabic (Algeria),¿Qué fruta suelen ofrecer a los turistas/visitantes del extranjero en México?,Which fruit do people usually offer tourists/visitors from abroad in Mexico?
211,Ne-ar-38,Food,Arabic (Algeria),¿Qué comida suelen ofrecer como caridad las personas en México?,Which food do people usually offer as charity in Mexico?
212,Ne-ar-39,Food,Arabic (Algeria),¿Cuál es la comida rápida más barata en México?,What is the cheapest fast food in Mexico?
213,Ne-ar-43,Food,Arabic (Algeria),¿Qué suelen tomar las personas con té en México?,What do people usually have with tea in Mexico?
214,Ne-ar-44,Food,Arabic (Algeria),¿Qué acompaña la gente con el café en México?,What do people have with coffee in Mexico?
215,New-am-02,Food,Amharic (Ethiopia),¿Cuál es la comida tradicional más popular en México?,What is the most popular traditional food in Mexico?
216,New-am-04,Food,Amharic (Ethiopia),¿Cuál es la salsa para untar más popular en México?,What is the most popular dipping sauce in Mexico?
217,New-am-08,Food,Amharic (Ethiopia),¿Cuál es la comida más consumida durante el ayuno cristiano en México?,What food is most often consumed during Christian fasting in Mexico?
218,New-am-15,Food,Amharic (Ethiopia),¿Qué comida se prepara habitualmente cuando las madres dan a luz en México?,What food is usually prepared when mothers give birth in Mexico?
219,New-am-27,Sport,Amharic (Ethiopia),¿Quién es la deportista femenina más popular en México?,Who is the most popular female sportperson in Mexico?
220,New-am-34,Education,Amharic (Ethiopia),¿Dónde se preparan la mayoría de los estudiantes de primaria para sus exámenes en México?,Where do most elementary school students prepare for their exams in Mexico?
221,New-am-41,Education,Amharic (Ethiopia),¿En qué grado escolar los estudiantes en México presentan su primer examen a nivel nacional?,"In Mexico, at which grade level do students take their first national-level examination?"
222,New-am-53,Work life,Amharic (Ethiopia),¿Qué región de México es ampliamente conocida por su industria del café/té?,Which region in Mexico is widely known for its coffee/tea industry?
223,New-am-54,Work life,Amharic (Ethiopia),¿Qué región de México es ampliamente conocida por su industria ganadera?,Which region in Mexico is widely known for its livestock industry?
224,New-am-59,Work life,Amharic (Ethiopia),¿Cuál es la principal ocupación de las personas que viven en los desiertos de México?,What is the main occupation of people living in deserts in Mexico?
225,New-am-60,Work life,Amharic (Ethiopia),¿Qué animal se utiliza típicamente para el transporte en México?,Which animal is typically used for transportation in Mexico?
226,New-am-72,Family,Amharic (Ethiopia),¿Cuál es el cómic más popular para niños en México?,What is the most popular comic book for children to read in Mexico?
227,New-am-73,Family,Amharic (Ethiopia),¿Cuál es el canal de YouTube más popular para niños en México?,What is the most popular YouTube channel for children in Mexico?
228,New-am-74,Family,Amharic (Ethiopia),¿Cuál es el programa de entrevistas más popular en México?,What is the most popular talk show in Mexico?
229,New-am-77,Holidays/Celebration/Leisure,Amharic (Ethiopia),¿Cuál es la festividad religiosa más famosa en México?,What is the most famous religious holiday in Mexico?
230,New-am-81,Holidays/Celebration/Leisure,Amharic (Ethiopia),"¿Cuál es el mes más ocupado para bodas en México? (Proporciona solo números arábigos (por ejemplo, 1).)","What is the busiest month for weddings in Mexico? (Provide Arabic numerals (e.g., 1) only.)"
231,New-am-83,Holidays/Celebration/Leisure,Amharic (Ethiopia),¿Cuál es el instrumento musical tradicional más popular en México?,What is the most popular traditional musical instrument in Mexico?
232,New-as-01,Food,Assamese (Assam),¿Cuál es el principal producto agrícola producido en México?,What is the main agricultural product produced in Mexico?
233,New-as-02,Food,Assamese (Assam),¿Cuál es el alimento a base de trigo más popular en México?,What is the most popular wheat-based food item in Mexico?
234,New-as-05,Food,Assamese (Assam),¿Cuál es la bebida más típica que se ofrece a los invitados cuando visitan hogares en México?,What is the most typical drink offered to guests when they visit households in Mexico?
235,New-as-07,Food,Assamese (Assam),¿Cuál es el platillo más popular preparado con pescado en México?,What is the most popular dish cooked with fish in Mexico?
236,New-as-14,Food,Assamese (Assam),¿Qué comida les gusta comer a las personas de México durante el clima lluvioso?,What food do people from Mexico like to eat during rainy weather?
237,New-as-15,Food,Assamese (Assam),¿Qué bebida se consume comúnmente en México cuando hace calor?,What drink is commonly consumed in Mexico when the weather is hot?
238,New-as-20,Sport,Assamese (Assam),¿Cuál es el deporte de interior más popular en México?,What is the most popular indoor sport in Mexico?
239,New-as-29,Sport,Assamese (Assam),¿Qué deporte les gusta ver a los hombres en México?,What sport do men in Mexico like to watch?
240,New-as-30,Sport,Assamese (Assam),¿Qué deporte les gusta ver a las mujeres en México?,What sport do women in Mexico like to watch?
241,New-as-58,Work life,Assamese (Assam),¿Cuál es la bebida más popular que a la gente de México le gusta tomar en su lugar de trabajo?,What is the most popular beverage that people from Mexico like to drink in their workplace?
242,New-as-64,Family,Assamese (Assam),¿En qué festividad suelen reunirse todos los miembros de la familia en México?,On which holiday do all family members tend to reunite in Mexico?
243,New-as-76,Holidays/Celebration/Leisure,Assamese (Assam),¿Qué juegos tradicionales juegan las familias durante las festividades tradicionales en México?,What traditional games do families play during traditional holidays in Mexico?
244,New-as-80,Holidays/Celebration/Leisure,Assamese (Assam),¿Qué tipo de ropa usan las personas de México durante los festivales tradicionales?,What type of clothing do people from Mexico wear during traditional festivals?
245,New-as-89,Holidays/Celebration/Leisure,Assamese (Assam),¿Qué accesorios tradicionales de festivales usan las personas en México?,What traditional festival accessories do people from Mexico wear?
246,New-az-05,Food,Azerbaijani (Azerbaijan),¿Cuál es la región más famosa para la producción de alcohol en México?,What is the most famous region for alcohol production in Mexico?
247,New-az-11,Food,Azerbaijani (Azerbaijan),¿Qué fruta comen a menudo las personas de México en la temporada de verano?,What fruit do people from Mexico often eat in the summer season?
248,New-az-12,Food,Azerbaijani (Azerbaijan),¿Qué región de México es conocida por sus mariscos?,Which region in Mexico is known for its seafood?
249,New-az-21,Sport,Azerbaijani (Azerbaijan),¿Cuál es la región más popular para esquiar en México?,Which region in Mexico is the most popular skiing destination?
250,New-az-26,Sport,Azerbaijani (Azerbaijan),¿Quién es el luchador de artes marciales más popular en México?,Who is the most popular martial arts player in Mexico?
251,New-az-27,Sport,Azerbaijani (Azerbaijan),¿Cuál deporte ha sido uno de los de más rápido crecimiento en México durante la última década?,Which sport has been one of the fastest-growing in Mexico over the last decade?
252,New-az-39,Education,Azerbaijani (Azerbaijan),¿Cuál es el país de destino más popular para los estudiantes de México que estudian en el extranjero?,Which country is the most popular destination for students from Mexico studying abroad?
253,New-az-49,Work life,Azerbaijani (Azerbaijan),"¿Cuántas personas trabajan en una familia típica en México? (Proporcione solo números arábigos (por ejemplo, 1).)","How many people work in a typical family in Mexico? (Provide Arabic numerals (e.g., 1) only.)"
254,New-az-60,Family,Azerbaijani (Azerbaijan),"¿En México, quién se encarga de los niños cuando ambos padres están trabajando?","In Mexico, who takes care of kids when both parents are working?"
255,New-az-69,Holidays/Celebration/Leisure,Azerbaijani (Azerbaijan),¿Cuál es la bebida alcohólica preferida por los hombres de México?,What is the preferred alcoholic beverage for men from Mexico?
256,New-az-70,Holidays/Celebration/Leisure,Azerbaijani (Azerbaijan),¿Cuál es la bebida alcohólica preferida por las mujeres de México?,What is the preferred alcoholic beverage for women from Mexico?
257,New-az-73,Holidays/Celebration/Leisure,Azerbaijani (Azerbaijan),"¿Cuántas personas en promedio suelen asistir a una boda en México? (Proporciona solo números arábigos (por ejemplo, 1).)","How many people on average typically attend a wedding in Mexico? (Provide Arabic numerals (e.g., 1) only.)"
