,ID,Topic,Source,Question,Translation
243,New-as-76,Holidays/Celebration/Leisure,Assamese (Assam),대한민국의 전통적인 명절에 가족들이 함께 하는 민속놀이는 무엇이 있나요?,What traditional games do families play during traditional holidays in South Korea?
244,New-as-80,Holidays/Celebration/Leisure,Assamese (Assam),대한민국의 전통 축제에서 사람들은 어떤 종류의 옷을 입나요?,What type of clothing do people from South Korea wear during traditional festivals?
245,New-as-89,Holidays/Celebration/Leisure,Assamese (Assam),대한민국 사람들은 전통 축제 때 어떤 액세서리를 착용하나요?,What traditional festival accessories do people from South Korea wear?
246,New-az-05,Food,Azerbaijani (Azerbaijan),대한민국에서 가장 유명한 술 생산 지역은 어디입니까?,What is the most famous region for alcohol production in South Korea?
247,New-az-11,Food,Azerbaijani (Azerbaijan),대한민국 사람들은 여름철에 주로 어떤 과일을 먹나요?,What fruit do people from South Korea often eat in the summer season?
248,New-az-12,Food,Azerbaijani (Azerbaijan),대한민국에서 해산물로 유명한 지역은 어디인가요?,Which region in South Korea is known for its seafood?
249,New-az-21,Sport,Azerbaijani (Azerbaijan),대한민국에서 스키 여행지로 가장 유명한 지역은 어디인가요?,Which region in South Korea is the most popular skiing destination?
250,New-az-26,Sport,Azerbaijani (Azerbaijan),대한민국에서 가장 인기 있는 무술 선수는 누구인가요?,Who is the most popular martial arts player in South Korea?
251,New-az-27,Sport,Azerbaijani (Azerbaijan),대한민국에서 지난 10년 동안 가장 빠르게 성장한 스포츠는 무엇입니까?,Which sport has been one of the fastest-growing in South Korea over the last decade?
252,New-az-39,Education,Azerbaijani (Azerbaijan),대한민국에서 해외 유학을 가는 학생들에게 가장 인기 있는 나라는 어디인가요?,Which country is the most popular destination for students from South Korea studying abroad?
253,New-az-49,Work life,Azerbaijani (Azerbaijan),대한민국의 일반적인 가정에서는 몇 명이 일합니까? (아라비아 숫자(예: 1)만 기재해 주세요.),"How many people work in a typical family in South Korea? (Provide Arabic numerals (e.g., 1) only.)"
254,New-az-60,Family,Azerbaijani (Azerbaijan),대한민국에서 부모님이 둘 다 일할 때 아이들을 누가 돌보나요?,"In South Korea, who takes care of kids when both parents are working?"
255,New-az-69,Holidays/Celebration/Leisure,Azerbaijani (Azerbaijan),대한민국 남성들이 선호하는 술은 무엇인가요?,What is the preferred alcoholic beverage for men from South Korea?
256,New-az-70,Holidays/Celebration/Leisure,Azerbaijani (Azerbaijan),대한민국 여성들이 선호하는 술은 무엇인가요?,What is the preferred alcoholic beverage for women from South Korea?
257,New-az-73,Holidays/Celebration/Leisure,Azerbaijani (Azerbaijan),대한민국의 일반적인 결혼식에는 평균적으로 몇 명이 참석하나요? (아라비아 숫자(예: 1)만 기재해 주세요.),"How many people on average typically attend a wedding in South Korea? (Provide Arabic numerals (e.g., 1) only.)"
258,New-ch-01,Food,Chinese (China),대한민국에서 바베큐를 할 때 사람들은 보통 어떤 고기를 먹나요?,What kind of meat do people usually eat when they have barbecue in South Korea?
259,New-ch-02,Food,Chinese (China),"대한민국에서 사람들은 보통 몇 시에 아침을 먹나요? (HH:MM 형식(예: 18:00, 09:00)으로 제공해주세요.)","When do people usually have breakfast in South Korea? (Provide in HH:MM format (e.g., 18:00, 09:00).)"
260,New-ch-04,Food,Chinese (China),대한민국에서 사람들은 보통 야식으로 무엇을 먹나요?,What kinds of food do people usually eat for late-night snacks in South Korea?
261,New-ch-05,Food,Chinese (China),대한민국에서 가장 유명한 매운 음식은 무엇인가요?,What is the most famous spicy dish in South Korea?
262,New-ch-07,Food,Chinese (China),대한민국에서 독한 술을 마실 때 사람들은 보통 어떤 음식을 안주로 먹나요?,What food items do people typically pair with hard liquor in South Korea?
263,New-ch-08,Food,Chinese (China),대한민국 요리에서 필수적인 양념은 무엇인가요?,What seasoning is indispensable in cooking in South Korea?
264,New-ch-09,Food,Chinese (China),날씨가 추울 때 대한민국 사람들은 보통 어떤 음식을 먹나요?,What food do people typically consume when the weather is cold in South Korea?
265,New-ch-13,Food,Chinese (China),대한민국에서 가장 유명한 주류 브랜드는 무엇인가요?,What is the most famous alcohol brand in South Korea?
266,New-ch-14,Food,Chinese (China),대한민국에서는 아플 때 보통 어떤 음식을 먹나요?,What foods do people usually eat when they are sick in South Korea?
267,New-ch-15,Food,Chinese (China),대한민국에서 사람들이 보통 슈퍼마켓에서 구매하는 조리/즉석 식품은 무엇인가요?,What prepared/ready-to-eat food do people typically buy at supermarkets in South Korea?
268,New-ch-16,Sport,Chinese (China),대한민국에서 가장 유명한 스포츠 관련 영화는 무엇인가요?,What is the most famous sports-related movie in South Korea?
269,New-ch-17,Sport,Chinese (China),대한민국 사람들이 일반적으로 가장 해보고 싶어하는 익스트림 스포츠는 무엇인가요?,What extreme sport do people generally wish to try the most in South Korea?
270,New-ch-18,Sport,Chinese (China),대한민국에서 가장 즐겨 보는 육상 경기 종목은 무엇인가요?,Which track and field event is the most popular to watch during competitions in South Korea?
271,New-ch-19,Sport,Chinese (China),대한민국에서 가장 즐겨 보는 체조 경기 종목은 무엇인가요?,Which gymnastics event is the most popular to watch during competitions in South Korea?
272,New-ch-23,Sport,Chinese (China),대한민국에서 가장 유명한 탁구 선수는 누구인가요?,Who is the most famous table tennis player in South Korea?
273,New-ch-26,Sport,Chinese (China),대한민국에서 가장 즐겨 보는 동계 올림픽 경기는 무엇인가요?,"In the Winter Olympics, which event is the most popular to watch in South Korea?"
274,New-ch-27,Sport,Chinese (China),대한민국에서 가장 유명한 복서는 누구인가요?,Who is the most famous boxer in South Korea?
275,New-ch-30,Sport,Chinese (China),대한민국에서 가장 유명한 육상 선수는 누구인가요?,Who is the most famous track and field athlete in South Korea?
276,New-ch-31,Work life,Chinese (China),대한민국에서 부모님들은 자녀가 어떤 직업을 가지길 가장 희망하나요?,What job do parents most hope their children will pursue in South Korea?
277,New-ch-32,Work life,Chinese (China),대한민국의 직장에서 사람들은 일반적으로 어떤 사무용 소프트웨어를 사용하나요?,What office software do people typically use in the workplace in South Korea?
278,New-ch-38,Work life,Chinese (China),대한민국에서 수출입으로 유명한 도시나 지역은 어디인가요?,Which cities or regions are known for their import and export activities in South Korea?
279,New-ch-39,Work life,Chinese (China),대한민국에서 전자상거래에 주로 사용되는 플랫폼은 무엇인가요?,What platform is commonly used in the e-commerce industry in South Korea?
280,New-ch-44,Work life,Chinese (China),대한민국에서 정식 계약을 체결하기 전 새로운 직원들에게 일반적으로 적용되는 수습 기간은 얼마나 됩니까? (예: 1개월).,"How long is the typical probation period for new employees before signing a formal contract in South Korea? (e.g., 1 month)."
281,New-ch-45,Work life,Chinese (China),대한민국에서 청년들은 창업을 할 때 주로 어떤 산업을 선택하나요?,Which industries do young people typically choose to start businesses in South Korea?
282,New-ch-49,Family,Chinese (China),대한민국에서 가족 구성원들끼리 원격으로 소통할 때 사용하는 가장 일반적인 방법은 무엇인가요?,What is the most common way for family members to communicate remotely in South Korea?
283,New-ch-51,Family,Chinese (China),대한민국에서 가족 여행 시 보통 어떤 형태의 숙박시설을 예약하나요?,What form of accommodation is typically booked for family trips in South Korea?
284,New-ch-54,Family,Chinese (China),대한민국의 가족 저녁식사에 가장 흔히 등장히는 과일은 무엇인가요?,Which fruit is usually prepared the most for family dinners in South Korea?
285,New-ch-64,Education,Chinese (China),대힌민국의 대학생들은 일주일에 보통 수업을 몇 시간 듣나요? (아라비아 숫자(예: 1)만 기재해 주세요.),"How many hours of classes do university students typically have per week in South Korea? (Provide Arabic numerals (e.g., 1) only.)"
286,New-ch-66,Education,Chinese (China),대한민국 공립 고등학교의 한 학기당 평균 수업료는 얼마입니까? (아라비아 숫자(예: 1)만 기재해 주세요.),"What is the typical tuition fee per semester for public high schools in South Korea?  (Provide Arabic numerals (e.g., 1) only.)"
287,New-ch-70,Education,Chinese (China),대한민국 대학생들이 공통적으로 듣는 필수 과목은 무엇인가요?,What compulsory courses do university students have in common in South Korea?
288,New-ch-71,Education,Chinese (China),대한민국 고등학교의 한 학급당 평균 학생 수는 몇 명인가요? (아라비아 숫자(예: 1)만 기재해 주세요.),"What is the average class size in high schools in South Korea? (Provide Arabic numerals (e.g., 1) only.)"
289,New-ch-72,Education,Chinese (China),대한민국에서 어떤 전공이 취업에 가장 유리하다고 여겨지나요?,Which major is considered most conducive to employment in South Korea?
290,New-ch-73,Education,Chinese (China),대한민국 대학생들 사이에서 어떤 동아리가 가장 인기 있나요?,What type of clubs are most popular among university students in South Korea?
291,New-ch-74,Education,Chinese (China),대한민국 대학생들은 주로 어떤 유형의 거주지에 거주하나요?,What types of accommodation do university students in South Korea typically live in?
292,New-ch-75,Education,Chinese (China),대한민국의 중학교 수업 한 교시는 총 몇 분인가요? (아라비아 숫자(예: 1)만 기재해 주세요.),"How long is each class period for middle school students in South Korea (minutes)?  (Provide Arabic numerals (e.g., 1) only.)"
293,New-ch-78,Holidays/Celebration/Leisure,Chinese (China),대한민국에서 은퇴한 여성들이 일반적으로 즐겨하는 여가 활동은 무엇인가요?,What leisure activities do retired women typically like in South Korea?
294,New-ch-79,Holidays/Celebration/Leisure,Chinese (China),대한민국에서 은퇴한 남성들이 일반적으로 즐겨하는 여가 활동은 무엇인가요?,What leisure activities do retired men typically like in South Korea?
295,New-ch-80,Holidays/Celebration/Leisure,Chinese (China),"대한민국에선 대체로 어느 명절에 종교적인 장소(사찰, 교회 등)를 방문하나요?","During which holidays do people typically visit religious sites (temples, churches, etc.) in South Korea?"
296,New-ch-81,Holidays/Celebration/Leisure,Chinese (China),대한민국의 일반적인 집들이 선물은 무엇인가요?,What are the typical housewarming gifts in South Korea?
297,New-ch-82,Holidays/Celebration/Leisure,Chinese (China),"대한민국에서 결혼식은 보통 몇 시에 시작하나요? (HH:MM 형식(예: 18:00, 09:00)으로 제공해주세요.)","At what time do weddings typically start in South Korea? (Provide in HH:MM format (e.g., 18:00, 09:00).)"
298,New-ch-83,Holidays/Celebration/Leisure,Chinese (China),대한민국의 어느 도시에서 축제가 가장 많이 열리나요?,Which city in South Korea hosts festivals the most?
299,New-ch-84,Holidays/Celebration/Leisure,Chinese (China),대한민국 사람들은 결혼식에 참석할 때 보통 어떤 색깔의 옷을 입나요?,What color of clothing do people typically wear when attending weddings in South Korea?
300,New-ch-85,Holidays/Celebration/Leisure,Chinese (China),대한민국 사람들은 장례식에 참석할 때 보통 어떤 색깔의 옷을 입나요?,What color of clothing do people typically wear when attending funerals in South Korea?
301,New-en-01,Food,English (UK),대한민국 영화관에선 어떤 간식을 먹나요?,Which snack is eaten in the cinema in South Korea?
302,New-en-02,Food,English (UK),대한민국에서 가장 인기 있는 감자칩 맛은 무엇인가요?,What is the most popular chip/crisp flavour in South Korea?
303,New-en-04,Food,English (UK),대한민국에서 인기 있는 셀러브리티 셰프는 누구인가요?,Who is a popular celebrity chef in South Korea?
304,New-en-05,Food,English (UK),대한민국에서 가성비가 좋으며 빨리 먹을 수 있는 음식은 무엇인가요?,Which food is a cost-effective and quick meal option in South Korea?
305,New-en-07,Food,English (UK),대한민국에서 가장 인기 있는 요리 프로그램은 무엇인가요?,What are the most popular cooking shows in South Korea?
306,New-en-08,Food,English (UK),대한민국에서 가장 인기 있는 초콜릿 브랜드는 무엇인가요?,What is the most popular chocolate brand in South Korea?
307,New-en-10,Food,English (UK),대한민국에선 어떤 치즈를 가장 많이 먹나요?,What is the most eaten cheese in South Korea?
308,New-en-11,Food,English (UK),대한민국에서 가장 인기 없는 채소는 무엇인가요?,What is the most disliked vegetable in South Korea?
309,New-en-12,Food,English (UK),대한민국의 푸드코트에서 가장 흔히 볼 수 있는 음식은 무엇인가요?,What food is most commonly found in food courts in South Korea?
310,New-en-17,Sport,English (UK),대한민국 스포츠 팬들이 가장 많이 사용하는 응원 도구는 무엇인가요?,What are the most common cheering tools used by sports fans in South Korea?
311,New-en-18,Sport,English (UK),대한민국에서 팬들이 경기를 보러 갈 때 무엇을 가지고 가나요?,What do fans bring with them when attending a live game in South Korea?
312,New-en-19,Sport,English (UK),대한민국에서 가장 유명한 스포츠 경기장은 어디인가요?,What is the most well known sporting stadium in South Korea?
313,New-en-23,Sport,English (UK),대한민국에서 가장 유명한 패럴림픽 선수는 누구인가요?,Who is the most famous Paralympian in South Korea?
314,New-en-26,Sport,English (UK),대한민국에서 가장 잘 알려진 스포츠 응원 구호는 무엇인가요?,What is the best recognized sporting chant in South Korea?
315,New-en-38,Work life,English (UK),대한민국에서 근무 시간이 유연한 것으로 알려진 산업은 어떤 것들이 있나요?,Which industries are known for more flexible working hours in South Korea?
316,New-en-41,Work life,English (UK),대한민국에서 가장 유명하고 성공적인 기업가는 누구인가요?,Who is the most well known and successful entrepreneur in South Korea?
317,New-en-47,Family,English (UK),대한민국의 주택 뒷마당에서 흔히 발견되는 것은 무엇인가요?,What can typically be found in the back garden of houses in South Korea?
318,New-en-49,Family,English (UK),대한민국에서 가장 유명한 가문은 어디인가요?,What is the name of the most famous family in South Korea?
319,New-en-50,Family,English (UK),대한민국에서 가장 흔한 성씨는 무엇인가요?,What is the most common family name in South Korea?
320,New-en-55,Family,English (UK),대한민국의 가정에서 가장 흔히 믿는 종교는 무엇인가요?,Which religion is most commonly practiced by families in South Korea?
321,New-en-56,Family,English (UK),대한민국의 가정에서 어떤 외국어가 가장 많이 사용되나요?,What is the most popular foreign language spoken by families in South Korea?
322,New-en-59,Family,English (UK),대한민국에서 가족 단위로 이민 가기에 가장 인기 있는 나라는 어디인가요?,Which country is the most popular destination for families from South Korea to emigrate to?
323,New-en-68,Education,English (UK),대한민국 학교에서 부적절한 행동을 할 경우 어떤 조치가 취해지나요?,What repercussions are there for bad behavior in schools in South Korea?
324,New-en-69,Education,English (UK),대한민국의 문학 수업에서 주로 배우는 작가는 누구인가요?,Which writers are commonly studied in literature class in South Korea?
325,New-en-70,Education,English (UK),대한민국의 고등학교에는 1년에 방학이 총 몇 번 있나요? (아라비아 숫자(예: 1)만 기재해 주세요.),"How many school breaks are there in a year for high schools in South Korea? (Provide Arabic numerals (e.g., 1) only.)"
326,New-en-72,Education,English (UK),대한민국 학생들이 공부할 때 주로 사용하는 온라인 웹사이트는 무엇인가요?,Which online resource do students usually use to study in South Korea?
327,New-en-75,Education,English (UK),대한민국 대학교는 한 학기에 몇 주 동안 수업하나요? (아라비아 숫자(예: 1)만 기재해 주세요.),"What is the average length of a semester in terms of weeks of teaching at universities in South Korea? (Provide Arabic numerals (e.g., 1) only.)"
328,New-en-76,Holidays/Celebration/Leisure,English (UK),대한민국 명절 시즌에 가장 붐비는 공항은 어디인가요?,Which airport in South Korea is the busiest during the holiday season?
329,New-en-79,Holidays/Celebration/Leisure,English (UK),대한민국 어느 지역이 연극으로 잘 알려져 있습니까?,Which region of South Korea is well known for its theatrical performances?
330,New-en-87,Holidays/Celebration/Leisure,English (UK),대한민국에서 어떤 역사적 명소가 가장 유명한가요?,What is the most famous historic landmark in South Korea?
331,New-en-90,Holidays/Celebration/Leisure,English (UK),대한민국에서 어떤 호텔 브랜드가 가장 유명한가요?,What is the most famous hotel brand in South Korea?
332,New-gr-05,Food,Greek (Greece),대한민국에서 아침에 간편하게 포장해서 먹을 수 있는 것 중 가장 인기 있는 것은?,What is the most popular grab-and-go breakfast option in South Korea?
333,New-gr-06,Food,Greek (Greece),대한민국의 젊은 층에게 가장 인기 있는 음식은 무엇인가요?,What is the most popular food in South Korea among young people?
334,New-gr-08,Food,Greek (Greece),대한민국의 축제에서 가장 흔히 마시는 술은 무엇인가요?,What type of alcoholic drink is most commonly consumed at festivals in South Korea?
335,New-gr-13,Food,Greek (Greece),대한민국에서 아침에 가장 흔히 마시는 음료는 무엇인가요?,What is the most common morning drink in South Korea?
336,New-gr-15,Food,Greek (Greece),대한민국에서 가장 인기 있는 전통 디저트는 무엇입니까?,What is the most popular traditional dessert in South Korea?
337,New-gr-21,Sport,Greek (Greece),대한민국에서 가장 인기 있는 라켓 스포츠는 무엇입니까?,What is the most popular racket sport in South Korea?
338,New-gr-24,Sport,Greek (Greece),대한민국에서 가장 인기 있는 육상 경기 종목은 무엇입니까?,What is the most popular track and field sport in South Korea?
339,New-gr-29,Sport,Greek (Greece),대한민국에서 가장 인기 있는 국제 스포츠 대회는 무엇인가요?,Which international sporting event is the most popular in South Korea?
340,New-gr-47,Work life,Greek (Greece),대한민국의 직장에서 점심과 저녁 시간을 제외한 일반적인 휴식 시간은 몇 분인가요? (아라비아 숫자(예: 1)만 기재해 주세요.),"How long (in minutes) are typical work breaks in South Korea, excluding lunch and dinner breaks? (Provide Arabic numerals (e.g., 1) only.)"
341,New-gr-58,Work life,Greek (Greece),대한민국에서는 어떤 직업이 하는 일에 비해 제대로 된 보수를 받지 못한다고 여겨지나요?,Which job is considered underpaid in South Korea?
342,New-gr-76,Holidays/Celebration/Leisure,Greek (Greece),대한민국에서 부활절에 가장 흔히 제공되는 음식은 무엇인가요?,What is the most common food served during Easter in South Korea?
343,New-gr-82,Holidays/Celebration/Leisure,Greek (Greece),대한민국의 노년층에게 가장 인기 있는 음악 장르는 무엇인가요?,What is the most popular music genre among the elderly population in South Korea?
344,New-gr-88,Holidays/Celebration/Leisure,Greek (Greece),대한민국의 장례식에서 흔히 제공되는 음료나 술은 무엇인가요?,What drink is usually offered at funerals in South Korea?
345,New-gr-89,Holidays/Celebration/Leisure,Greek (Greece),대한민국의 결혼식에서 흔히 제공되는 음료나 술은 무엇인가요?,What drink is usually offered at weddings in South Korea?
346,New-ha-07,Food,Hausa (Northern Nigeria),전 세계에서 찾을 수 있는 대한민국의 음식은 무엇이 있나요?,What food originated from South Korea and can be found all over the world?
347,New-ha-08,Food,Hausa (Northern Nigeria),대한민국에서 어린이들이 대체로 싫어하지만 노인들이 즐기는 음식은 무엇이 있나요?,What food is typically disliked by children but enjoyed by the elderly in South Korea?
348,New-ha-09,Food,Hausa (Northern Nigeria),대한민국에서 가장 흔히 사용되는 조리 도구는 무엇입니까?,What cooking utensil is most commonly used in South Korea?
349,New-ha-13,Food,Hausa (Northern Nigeria),대한민국에서 가장 인기 있는 채소는 무엇입니까?,Which is the most popular vegetable in South Korea?
350,New-ha-19,Sport,Hausa (Northern Nigeria),대한민국에서 스포츠에 사용되는 동물은 무엇인가요?,Which animal is used for sports in South Korea?
351,New-ha-66,Family,Hausa (Northern Nigeria),대한민국에서 가장 인기 있는 결혼식 장소는 어디인가요?,What is the most popular wedding venue in South Korea?
352,New-in-01,Food,Indonesian (Indonesia),대한민국에서 가장 인기 있는 커피전문점 브랜드는 무엇입니까?,Which coffee shop brand is the most popular in South Korea?
353,New-in-03,Food,Indonesian (Indonesia),해외 식당에서 주로 판매되는 대한민국 음식은 무엇인가요?,What type of food from South Korea is typically served in restaurants overseas?
354,New-in-33,Work life,Indonesian (Indonesia),대한민국에서 광업과 관련된 지역은 보통 어디인가요?,What region in South Korea is usually associated with mining?
355,New-in-34,Work life,Indonesian (Indonesia),대한민국에서 석유와 관련된 지역은 보통 어디인가요?,What region in South Korea is usually associated with oil?
356,New-in-62,Education,Indonesian (Indonesia),대한민국에서 어느 대학이 공학 전공으로 인기 있나요? (공식 명칭을 제공해 주세요.),What university in South Korea is popular because of its engineering major? (Provide the official name.)
357,New-in-63,Education,Indonesian (Indonesia),대한민국에서 어느 대학이 의학 전공으로 인기 있나요? (공식 명칭을 제공해 주세요.),What university in South Korea is popular because of its school of medicine? (Provide the official name.)
358,New-in-78,Holidays/Celebration/Leisure,Indonesian (Indonesia),대한민국에서 가장 흔히 쓰이는 결제 방법은 무엇인가요?,What is the most popular payment method in South Korea?
359,New-in-80,Holidays/Celebration/Leisure,Indonesian (Indonesia),대한민국에서 어느 놀이공원이 가장 유명한가요?,What is the most famous theme park in South Korea?
360,New-ko-01,Family,Korean (Korea),대한민국의 어린이들이 가장 많이 보는 인기 어린이 애니메이션은 무엇인가요?,What is the most popular children's animation that is commonly watched by kids in South Korea?
361,New-ko-02,Family,Korean (Korea),대한민국에서 임산부들이 가장 많이 하는 태교 활동은 무엇인가요?,What is the most popular prenatal education activity for pregnant women in South Korea?
362,New-ko-03,Family,Korean (Korea),대한민국에서 가족 모두가 함께 부를 수 있는 가장 인기 있는 동요는 무엇인가요?,What is the most popular children's song in South Korea that families sing together?
363,New-ko-04,Family,Korean (Korea),대한민국 남자아이들 사이에서 가장 인기 있는 장난감은 무엇인가요?,Which toys are most popular among boys in South Korea?
364,New-ko-05,Family,Korean (Korea),대한민국 여자아이들 사이에서 가장 인기 있는 장난감은 무엇인가요?,Which toys are most popular among girls in South Korea?
365,New-ko-06,Family,Korean (Korea),대한민국에서 아이들에게 가장 많이 들려주는 유명한 전래동화는 무엇인가요?,What is the most popular folk tale in South Korea that is typically told to children?
366,New-ko-07,Holidays/Celebration/Leisure,Korean (Korea),대한민국 장례식에서 애도를 상징하는 것은 무엇인가요?,What is the customary symbol of condolence used at funerals in South Korea?
367,New-ko-08,Work life,Korean (Korea),대한민국 대학생들은 주로 어디에서 아르바이트를 가장 많이 하나요?,Where do university students in South Korea tend to work part-time the most?
